리뷰번호,회원ID,작성일시,리뷰내용,감정키워드,평점
12925888,ba******,2024-01-15 11:56:01.533091,"기기기기기기승 하고 끝나버림...

얇은 분량에 앞쪽에 상황 설명만 쭉 풀어 내길래 마무리를 도대체 어떻게 하려나 했더니 저러고 끝. 인터넷에 보니 결말을 알고 보면 앞쪽에 숨겨진 내용이 보인다는데 이게 무슨 다회차가 요구되는 게임도 아니고 책을 결말을 알고 다시 보라니 이건 또 무슨 강요인지 모르겠다. 더구나 그 결말이 반전이 있다던가 충격적이라던가 하는 것도 아닌데..

원문으로 보면 단어에 숨겨진 내용이라던가 운문적인 어떤 느낌을 받을 수 있는지 모르겠지만 일단 내가 잃은 내용은 전혀 아무런 감동도 받을 수가 없었다. 새삼 베스트셀러라고 무작정 책을 사면 어떻게 되는지 깨닫게 되는 책이었다. 

추가) 감성태그를 선택 안하면 글 등록이 안돼서 어쩔 수 없이  '힐링돼요'를 선택했지만 전혀 힐링돼지 않습니다.",힐링돼요,1
12973171,ye*****,2024-01-21 22:05:19.312619,"재밌는 소설은 아니고,, 애매함만 남겨주는",힐링돼요,2
12647533,yj****,2023-12-03 09:46:40.399594,"견고한 구성, 탄탄한 문장, 그리고 무엇보다 존엄과 품위!",최고예요,4
12919978,so*****,2024-01-14 13:34:24.658593,왜 베스트셀러인지 잘은 모르겠지만 짧아서 금방 읽혔어요.,공감돼요,2
13030685,se********,2024-01-30 00:01:10.904013,"""이 길로 어디든 자네가 원하는데로 갈 수 있다네""
우리의 삶도 물이 흐르듯, 평탄하게 지나가길 바라며, 사소한것 같지만 켤코 사소하지않은 우리의 일상을 다시한번 되돌아보는 뜻깊은 시간이었습니다. ",최고예요,4
13592497,bl*****,2024-04-19 15:45:14.516556,수월한 침묵과 자멸적 용기가 무슨 말인지 읽고 나서 이해했어요.,재밌어요,4
12976270,gk*****,2024-01-22 13:45:39.665062,펄롱의 모든 시간과 행동은 결코 사소하지 않다.,고마워요,4
14258501,wj*****,2024-07-26 17:49:13.449764,올해 읽은 책중에 제일 좋았어요,고마워요,4
14092886,al****,2024-07-02 10:05:30.525198,클레어 키건... 나에게 최고의 작가가 되었다.,공감돼요,4
14152408,ks*******,2024-07-10 15:13:58.845657,"작가는 결코 자신의 느낌과 가치를 강요하지 않은 채 있는 그대로를 서술하기만 하려는 듯 최대한 객관적이다. 그 때문에 집중과 몰입이 가능하고 진실에 가 닿을 듯 하다. 책사랑이들은 꼭 읽고 돌아보아야 할 책이다. 또 하나의 펄링이, 또 하나의 미시즈 윌슨이 되기 위하여. 진정한 평화가 눈 가리고 못본 척 하는 게 아님을 새삼 되새기게 살짝 깨워주는 아름다운 책이다. 키건 작가에게 존경을 보낸다.",공감돼요,4
14116205,be*****,2024-07-05 06:06:45.879792,"클레어 키건의 책은 잔잔한 시같다.
짧지만 의미가 함축된",힐링돼요,4
13454229,bi********************,2024-03-30 01:25:03.6887,짧은 책이지만 깊게 와닿는 책,최고예요,4
13921431,jo******************,2024-06-07 03:00:03.878783,"클레이 키건은 어른답게 과녁을 겨누었다. 그는 난사하지 않았다. 오로지 정조준, 그리고 침묵, 비로소 무겁고 낮게 울리는 총성과 뚫려 있는 정중앙. 이 흐름으로 작가의 일을 완수했다. ",고마워요,4
13054191,tj******,2024-02-02 17:49:40.540185,기대보다 별로였어요,힐링돼요,1
12980638,Ga*******,2024-01-23 09:03:47.869895,맡겨진 소녀를 읽고나니 다른 작품이 궁금해서 구매했어요,최고예요,2
15184905,s0******,2024-12-30 14:36:10.712215,한 번 다시 읽어야 할까?부조리한 현실을 보아 넘기지 않고 실천하는 삶의 자세.타협하지 않는 뜨거운 가슴을 가져야 한다는 명제를 조용히 드러낸다.,고마워요,3
15081865,jh***,2024-12-02 20:26:15.240855,"매우 아름다운 이아기입니다
번역도 잘되었고요
사람이 어떻게 살아야하는지 깊은 울림을 줍니다",공감돼요,4
14056956,mi******,2024-06-28 11:07:40.158876,맡겨진 소녀 읽고 너무 좋아서 무조건 산 책. 너무 좋다. 왜 유명한지 알겠는 책,힐링돼요,4
12977344,mj****,2024-01-22 16:48:45.796916,"클레어 키건 작가님  책 내용이 궁금해서  구매했는데
와 막 재미있다는 아니지만  잔잔하게 읽기  괜찮아요

 ",재밌어요,3
12914439,si********,2024-01-13 15:06:26.072674,겨울에 읽기 좋은 책이에요. 추운 몸이 따뜻한 마음으로 힐링 됐어요. ,힐링돼요,4
15453774,va********,2025-03-02 16:10:08.576758,"맡겨진 아이랑 이 책이랑 두 권 읽었어요. 친구 생일 선물로 이 책을 구매했어요 실화를 바탕으로 했다는 말에 역사적 사건도 찾아보게 되고, 내가 주인공입장이 되어보기도 하고 여운이 남는 작품입니다",재밌어요,4
15204362,ve****,2025-01-03 22:39:57.688752,친구에게 선물한 책입니다 가볍게 읽기 좋다고하네요,힐링돼요,4
15199814,km********,2025-01-02 20:52:01.305562,"짧고 건조하지만 오히려 그래서 몰입이 되는 책.
소설과 동시에 시가 되는 무한한 매력을 가졌다.",재밌어요,4
15196758,ro*****,2025-01-02 08:17:26.1701,영화를 먼저보고  책을  구매했어요,고마워요,4
15188044,at*******,2024-12-31 09:13:52.514324,짧고 굵게 아주 조용히  강렬하게,힐링돼요,4
15176324,se*******,2024-12-28 11:37:48.20144,지금 우리 시대에 꼭 읽어봐야 하는 책인 것 같아요.,힐링돼요,4
15175072,pe********,2024-12-28 00:19:37.239065,잘 읽히고 좋은 내용입니다,힐링돼요,4
15144951,sm*******,2024-12-20 11:47:20.870975,"나는 이 책이 이토록 유명할 일인가 싶다.
제목처럼 많이 사소하다. 특별함 없이 그냥 소소한 재미 정도이다. 인기만큼 엄청나게 재미있지는 않다. ",고마워요,2
15104641,pr*****,2024-12-09 13:47:30.797552,나를 지키는 사소한 것들이 또 무엇이 있을까요 ,최고예요,4
14223320,es********,2024-07-21 11:28:20.395148,사소하지만 사소하지않은것들을 생각하게하는 시같은 소설,공감돼요,4
14132485,fo******,2024-07-07 13:20:04.287196,감명깊게 읽었어요!,최고예요,4
14077718,ie*****,2024-06-30 17:34:03.334736,간결한 필체에서 주는 울림이 큰책,공감돼요,4
14069413,ji******,2024-06-30 00:03:47.229485,추천합니다. 정독했어요,최고예요,4
14039466,bl********,2024-06-25 13:58:14.106273,책이 수월하게 잘 넘어가는 편인데 읽으면서 나도 주인공이 되어 세상을 사랑스럽게 바라볼 수 있어서 일 것 같다. 작가가 존경스랍다. 번역도 좋았던 것 같다. 하드보드된 표지 사진이 너무 어두운 것 같아 조금 아쉽다. ,최고예요,3
14021785,kh******,2024-06-22 16:20:02.017142,힐링되는 시간이었습니다 ,최고예요,4
14004796,ko*******,2024-06-19 15:45:33.001324,"당신의 주위를 둘러싼 이처럼 사소한 것들  속에서 당신은 무탈하십니까?

-이처럼 사소한 것들 
 클레어 키건 

이 소설의 내용은

펄롱은 
빈곤하게 태어나 일찍이 고아가 되었으나 어느 친절한 어른의 후원 아래 경제적 도움을 받았고, 그런 본인이 그저 ‘운’이 좋았음을 민감하게 자각하는 사람입니다.

크리스마스를 앞둔 어느 날 아침, 수녀원으로 석탄 배달을 나가 창고에서 한 여자아이를 발견하고 그곳에서 벌어지는 불법적인 사건의 정황을 알게 됩니다.

‘서로 돕지 않는다면 삶에 무슨 의미가 있나’ 

수녀원이 절대적 권력을 행사하는 마을에서 안락한 삶을 누리던 펄롱은 위험이 예견된 용기를 내야 할지 아니면 딸들과 가정을 위해 자신도 침묵해야 할지 깊은 고민에 빠집니다

당신은 이 사소하고도 거대한 것들 속에서 
어떤 결단을 내릴 수 있나요?

삶을 이루는 것은 이처럼 사소한 것들의 합이며 
어디든 내가 원하는 대로 갈 수 있다는 사실만으로도
당신의 마음은 무탈할 거예요

#이처럼사소한것들 #이처럼사소한것들_클레어키건 #삶은사소한것들의합 #휴머니즘 #막달레나세탁소수녀회",힐링돼요,4
13954371,ar******,2024-06-11 19:50:08.343317,맡겨진 소녀를 잘 봐서 사봤어요 ,고마워요,4
13950849,ro*****,2024-06-11 08:13:35.474354,아이에게 사 준 것인데 어른이 봐도 재미있어요,재밌어요,4
13948700,ak********,2024-06-10 22:14:34.359194,감명 깊게 읽었습니다,고마워요,4
13890294,ti******************,2024-06-03 13:30:02.378151,"멈춰서 생각하고 돌아볼 시간이 있는 삶을 살자. 마음 따뜻해지는 소설.
",힐링돼요,4
12975860,se******,2024-01-22 11:53:55.161187,힐링하려고 구입했는데 쉽게 안넘어가네요.^^ 아직도 몇 페이지 못읽었어요. 다 읽은 후 리뷰 남길께요.,힐링돼요,3
12860139,qm******,2024-01-05 21:29:09.945227,좋아하는 작가에요 잘 읽겠습니다,재밌어요,4
12827757,si******,2024-01-01 15:45:09.491832,재미있게 잘 봤네요. ,재밌어요,3
12661743,wh********,2023-12-04 19:21:52.9671,추찬받아서 구매해요^^,힐링돼요,4
15615341,gk****,2025-04-05 01:06:35.538674,펄롱의 삶에 감사해요,공감돼요,4
15594972,20********************,2025-03-31 17:20:37.447672,"아주 천천히, 하지만 확실히 변화하는 한 인간의 내면을 내밀히 그려낸 수작.",최고예요,4
15594082,db*******,2025-03-31 12:26:27.115065,맡겨진 소녀가 더 좋았어요,힐링돼요,3
15589858,kj******,2025-03-30 13:59:27.266101,간략한 문장들에 꽉찬 의미,고마워요,4
15579106,ru********************,2025-03-27 22:52:52.897052,"주인공이 도움을 줄 수 있었던 것은 일상의 
사소한 것들에서 받았던 친절을 기억해 냈기 
때문이다. 나도 좋은 기억들을 떠올리면서 
베풀고 살아야겠다.",최고예요,4
15569954,sh*******,2025-03-25 19:57:13.531164,"추천받아 구입했습니다
영화도 있다고 하는데 책부터 보려고요",고마워요,4
15566903,sl****************,2025-03-24 23:15:23.023231,생각만큼 좋은책입니다,재밌어요,4
15565025,ak******,2025-03-24 14:28:24.235745,사소한 것 같지만 사소하지 않은 우리의 삶,공감돼요,4
15562540,an********,2025-03-23 22:41:45.169161,짧지만 행간에 함축된 의미가 많아요. 다 읽고나서 책장을 쉽게 덮질 못하겠더라구요ㅠ,공감돼요,4
15549577,kf****,2025-03-21 00:21:08.156641,꼭 필사하고싶어요. ,최고예요,4
15549370,cy*****,2025-03-20 23:35:28.956292,"실화에 바탕을 둔 소설이라는 점이 무척이나 끌렸다. 아일랜드 출신 배우가 주연한 영화로도 개봉되었다는 사실도 매우 매력적이었다. 분량은 적고 책의 무게는 가볍지만, 그 내용과 함의는 두껍고 버거울 정도로 무겁다. 그동안 행동하지 않았던 나약한 양심을 반성하게 만든다.  ",최고예요,4
15543441,jy*****,2025-03-19 18:45:04.072602,짧지만 굵은 이야기,재밌어요,3
15541934,le********,2025-03-19 13:01:24.690385,즡겁게 술술 잘 읽었어요,최고예요,4
15541423,lo******,2025-03-19 10:41:25.978272,"
주인공 ’빌 펄롱‘, 이 사람이 왜 이렇게 마음을 못 잡는 걸까? 

가사 일꾼이었던 엄마는 열여섯 어린 나이에 주인공 펄롱을 임신, 주인 마님이었던 미시즈 윌슨의 배려로 아기를 출산하고 그 집에서 키울 수 있었다. 아버지가 누구인지도 모른채 빈주먹만도 못하게 태어난 펄롱은 어려운 환경에서 자랐지만 지금은 석탄 상인으로 가정적인 부인 아일린과 그 사이에 사랑스런 다섯명의 딸을 두고 부유하지는 않지만 부족함없이 편안한 생활을 하고 있다.

크리스마스를 앞둔 마을의 풍경이 즐거울 수 있을텐데 내면의 갈등을 겪는 펄롱을 보면서 나는 왠지 두려움을 느꼈다. 이러다가 펄롱이 단란한 가정을 버리고 일탈을 하는게 아닐까 혹시 스스로 생을 마감하려는 걸까… 그만큼 펄롱의 심적 갈등이 강하게 표현되고 있다.

사회 어느 한 부분의 부조리를 보고도 안정된 가족의 삶을 위해 모른척 하라는 부인 아일린과 동네 식당 주인 미시즈 케호의 조언을 듣고 갈등하지만, 결국은 정의를 선택하는 주인공 펄롱.

유럽 아일랜드의 작은 마을에서 펼쳐지는 이야기는 짧은 소설이지만 인간다운 삶과 인간의 품위에 대해 깊이 생각하게 한다.

#이처럼사소한것들_클레어키건 
#21세기최고의소설 #다산북스출판사 
",최고예요,4
15540343,th*****,2025-03-19 00:44:03.300653,폭풍의 눈처럼 잔잔하지만 휘몰아친다.,최고예요,4
15538247,sh*******,2025-03-18 16:50:29.444215,"아직 조금밖에 안 읽었지만, 추천했어요",고마워요,4
15529305,wi********,2025-03-16 17:27:33.363918,원서와 같이 보려고 구매했어요.,고마워요,4
15517672,fo*****,2025-03-14 09:54:05.916642,진실된 자아의 목소리를 따르는게 인생,최고예요,4
15490163,is****,2025-03-08 23:46:00.199981,다양한 내용이 많아서 상당히 좋은 것 같습니다.,공감돼요,4
15485059,mi********,2025-03-08 02:28:44.860635,잘못된 일을 알고도 눈감고 살아가는 사람들. 사소한 인생 속에서 전혀 사소하지 않은 행동. ,최고예요,4
15485007,he*******,2025-03-08 01:27:15.919196,너무 좋은 책! 방학동안 잘 읽었어요!,재밌어요,4
15481768,co*****,2025-03-07 14:32:27.381651,진정한 크리스마스의 의미를 담은 책이 아닐런지. ,힐링돼요,4
15476741,ch******,2025-03-06 17:57:00.392935,많은 사람들이 읽었으면 하는 책 ,힐링돼요,4
15471874,ti********,2025-03-05 21:18:00.003759,쉽게 읽히는 내용과 문체. 머리를 비우고 싶을 떄 읽으면 힐링이 된다.,힐링돼요,4
15463045,cr*****************,2025-03-04 13:20:59.345997,소문처럼 간단한 내용의 소설이지만 깊은 울림이 있네요,최고예요,4
15457311,pw***,2025-03-03 10:51:03.980599,"잔잔한 감동이 마음 속 깊이 파고드는 책이에요
책 분량은 적지만 그 내면 속 차지하고 있는
깨달음은 파동이 큽니다",최고예요,4
15457006,fe*****,2025-03-03 09:34:25.373045,짧은 내용이지만 묵직한 무언가가 있는 책이예요,힐링돼요,3
15447846,hu*********,2025-03-01 12:31:46.020222,읽는 내내 힐링되는 ,최고예요,4
15439436,ky****,2025-02-27 17:00:34.583049,마음이 포근해지고 힐링 돼요,힐링돼요,4
15438603,pa*****,2025-02-27 12:47:24.920667,이처럼 사소한 것들 문장에 이끌려서 구매,재밌어요,4
15433956,ug*****,2025-02-26 13:06:27.313788,클레어 키건 작품은 다 좋네요,재밌어요,4
15431606,lj*******,2025-02-25 22:19:23.625758,짧지만 흡입력 있는 작품입니다,힐링돼요,4
15428721,na******,2025-02-25 09:14:04.212905,일상에서의 작은 선택들이 합쳐져 인생을 만들어 간다. 누군가를 구원하고 누군가의 삶이 나를 구원하는 상호구원을 경험하는 것이 인생의 가치가 아닐까.,최고예요,4
15417164,js******,2025-02-22 16:36:05.352695,뭔가를 울리는 글. 최고,최고예요,4
15414502,sy*******,2025-02-22 04:26:42.61108,펄롱의 모든 시간과 행동은 결코 사소하지 않다.,공감돼요,4
15409952,hs*****,2025-02-21 09:14:19.660819,읽으면서 우울한 느낌이다 ,공감돼요,4
15406081,gr********,2025-02-20 11:39:49.935773,영화를 먼저 본게 아쉽네요,재밌어요,4
15403876,ch******,2025-02-19 22:30:02.016053,올해 읽은 책 중 가장 좋았던 책,힐링돼요,4
15400254,su******,2025-02-19 11:23:17.105171,재밌고 유익합니다. 추천합니다.,고마워요,4
15400010,vi*******,2025-02-19 11:04:00.049445,"작가 특유의 쓸쓸함과 따뜻함이 상존하는 소설로
작품의 길이는 짧지만 생각을 많이 하고, 여러가지 유추를 할수 있도록 하는 작품입니다. 잘 읽었습니다",최고예요,4
15398890,su******,2025-02-19 10:14:27.224232,재밌고 유익합니다. 추천합니다.,고마워요,4
15395307,an*********************,2025-02-18 15:40:55.929509,재밌게 잘 읽었습니다,힐링돼요,3
15393656,hj*******,2025-02-18 09:05:36.209444,책을 감명깊게 잘 읽었습니다.,힐링돼요,4
15393219,sy*******,2025-02-18 03:30:45.550962,좋은책이네요.  감사합니다. ,공감돼요,4
15387841,ma*****,2025-02-16 22:14:08.869741,"맡겨진 소녀 읽은 후 두번째 소설인데 짧지만 강합니다.
여운이 엄청 남네요. ",최고예요,4
15384747,dp****,2025-02-16 09:52:51.35393,읽기시작한 책입니다. 기대되는 책이에요,재밌어요,4
15382019,oc****,2025-02-15 16:18:35.541008,번역이 좀 어려워서 그런지 여러번 반복해서 일더야겠어요,힐링돼요,4
15377788,eo******,2025-02-14 16:28:14.578963,좋은 글 잘 읽었습니다,고마워요,4
15376867,za****,2025-02-14 12:04:06.142042,읽어보고 싶은 책이에요,고마워요,4
15374557,dk*******,2025-02-13 19:44:12.562419,"중간에 한 번 책의 분위기가 확 바뀌는 부분이 있어서 좋았고, 최근 읽은 책들 중 가장 좋았습니다",최고예요,4
15372154,dl******,2025-02-13 09:14:18.136638,영화보기전에 봤습니다,힐링돼요,3
15371493,tj********,2025-02-13 00:33:14.249066,읽기 너무 기대됩니다,최고예요,4
15368129,th*******,2025-02-12 11:28:51.478105,잔잔하지만 인상깊어요,최고예요,4
15367639,se*******,2025-02-12 09:33:09.431513,작가의 모든 작품을 읽고 싶어졌다,최고예요,4
15366831,yo*******,2025-02-12 00:26:14.82901,영화보다 섬세한표현!,공감돼요,3
15366414,ha********,2025-02-11 23:05:55.622757,매끄럽게 잘 읽힙니다,재밌어요,3
15365533,yo*******,2025-02-11 19:51:11.00269,"아직 읽는 중이지만 읽은 부분까지는 좋았어요
(완독 후 리뷰 수정)",최고예요,4
15364932,bl*******,2025-02-11 16:54:40.617324,"섬세한 터치로 그린 인상주의 그림같은, 간결한 단어에 숨은 의미심장한 진실을 읽으며 아일랜드를 넘어 사람과 삶의 진실을 가슴으로 읽었다.
p.s :  영화 보기 전, 원작 소설을 읽었다.
책속한문장 : 모든 걸 다 잃는 일이 너무나 쉽게 일어난다는 걸...",공감돼요,4
15364119,ye********,2025-02-11 13:04:42.017732,"주변에서 추천을 많이해서,  한껏 기대하고 있습니다.",고마워요,2
15363219,dp*******,2025-02-11 09:27:42.526674,인간의 이면성이랄까,공감돼요,4
15359314,re*****,2025-02-10 11:16:42.957731,"정의감은 누구에게나 순간 일어날 수 있습니다. 그러나 한 개인이 행동으로 실천하는 것은 무척이나 어려운 일입니다. 수녀원에서 학대 받는 아이에게 '나랑 집으로 가자,세라'라고 말하기 까지... 주저하게 만드는 아버지로서의 현실적인 이유들과, 굳이 나여야 하는가라는 의문들과, 수많은 불면의 밤과 치열하게 싸운 뒤 내린 결정입니다. 용기 있는 '나' 여야 하는 아주 합리적인 이유에 이르기까지 촘촘하게 펼쳐지는 내밀한 사연까지...작은 소설이지만, 그 크기 이상의 감동이 서서히 밀려옵니다.",공감돼요,4
15358855,km*****,2025-02-10 09:25:54.942319,몰랐던 사실을 알게되서 좋았어요,최고예요,4
15357998,ch*****,2025-02-10 00:06:11.279069,술술 읽히고 재밌습니다,재밌어요,4
15353502,wh*******,2025-02-09 01:05:23.0344,짧은 내용 속에서도 주인공만의 고뇌가 느껴져요,최고예요,4
15353229,si*******,2025-02-08 23:39:08.669574,내용은 괜찮네요 제 스타일은 아니였습니다,최고예요,4
15346338,ky*****,2025-02-07 14:54:26.861442,"영화를 먼저 봤어요. 영상을 그리며 읽어서 더 와닿았어요.
세상에 이런 일이,, 덤덤한 글이 더 묵직하게 다가옵니다.",고마워요,4
15340440,ul******,2025-02-06 05:59:32.913981,책을 받자마자 그 자리에서 다 읽은 책,최고예요,4
15338629,bi*******,2025-02-05 18:50:36.577146,"글씨가 커서 보기 좋아요
",힐링돼요,4
15337172,or*****,2025-02-05 14:22:44.464626,두께에 비해 조금 비싼느낌 영화 나왔대서 구매합니다,고마워요,4
15333291,rm*****,2025-02-04 18:54:29.401578,"사소하지만 잊지 않아야 하는 것, 지켜야하는 것들에 대해 생각하게 됩니다",고마워요,4
15333281,so******,2025-02-04 18:51:11.336761,잘 읽어보겠읍니다.,고마워요,4
15330228,sh******,2025-02-04 02:11:34.965463,담담하다. 하이데거 철학이 잘 나타나 있다는 추천을 받아 책을 사서 읽게 됐다. 정치인들과 연예인들에게는 올곧은 잣대를 들이대지만 정말로 내 주변에서 일어나는 일에 양심을 지키고 있는지 생각해보게 된다. 참 사소하지만 눈을 감지않는 주인공에게 찬사를 보낸다.,고마워요,4
