리뷰번호,회원ID,작성일시,리뷰내용,감정키워드,평점
14035704,gu*******,2024-06-24 21:55:07.312738,"유시민님의 논리력과 문장력에 다시 한번 경탄을 표하며 재미있게 잘 읽었습니다. 그의 퇴로를 열어주자는 유작가님 생각은 평범한 사람으로서는 감히 따라하기 힘든 것이었네요. 김대중대통령의 표용까지 갖고 계신 유작가님을 더욱 존경하게 되었습니다. 
젊은 벗들에게 다정히 이르는 맺음말도 너무 감동입니다. 대한민국이 그나마 다행인 것은 유시민 보유국이기 때문이라는 말이 괜한 과장이 아니었어요^^",추천해요,4
14035195,po*****,2024-06-24 19:51:03.341707,그가 있어 세상이 제대로 보인다.,최고예요,4
14035059,ki******,2024-06-24 19:26:37.16835,명불허전 유시민 작가님의 책 입니다.,추천해요,4
14035035,on********,2024-06-24 19:14:43.893955,"평소에 좋아하는 분이라 책도 많이 찾아 보게 되고
나오시는 방송도 챙겨 보는 편 입니다
이번 책도 잘 읽겠습니다 ^^",최고예요,4
14034792,ma*******,2024-06-24 17:45:22.656034,현재 우리 나라가 왜 이런지 잘 설명해 주었네요. ,집중돼요,4
14034009,sz*****,2024-06-24 15:24:03.617645,"유시민 작가의 어느책과 같이 높은 몰입도와 정리된, 자연스런 이야기흐름에 감탄.
추천합니다.",추천해요,4
14033656,ji*******,2024-06-24 14:29:04.602533,속 시원한 책 다들 읽었으면 좋겠어요,도움돼요,4
14033219,lo*****,2024-06-24 13:53:58.256356,유시민 작가님의 혜안에 다시금 놀라게 됩니다,최고예요,4
14032613,mh***************,2024-06-24 11:58:41.352632,선물하려고 한 권 더 구매했어요~,최고예요,4
14032442,ps*****,2024-06-24 10:46:11.216689,겸힘 출연하신 거 보구 지체 없이 교보 바로드림으로 샀다 첫장 표지를 넘기니 유작가님의 사인이 있어 반가웠다 희망은 힘이 세다 ㅡ,최고예요,4
14029190,az******,2024-06-23 21:08:36.416876,마음을 다스려보자.,도움돼요,4
14028868,08******,2024-06-23 19:48:32.848491,"정치에 관심이 없는 사람들도 그가 얼마나 우리나라를 엉망으로 만들어 가고 있는지는 체감했을 거라 봅니다. 임기 2년을 보낸 그가 얼마나 국민을 힘들게 했는지를 책을 읽으며 되새기게 되었네요. 앞으로 3년을 지난 2년처럼 버텨야 한다는 사실에서 절망합니다. 많은 분들이 이 책을 읽고, 우리가 무엇을 해야할 지를 생각해보는 계기가 되었으면 합니다. 우리나라, 좋은나라로 다시 만들어야하지 않겠나요.",추천해요,4
14028448,an****,2024-06-23 18:14:09.248946,추천합니다 꼭 필요한 지식과 함께 하는...,추천해요,4
14027563,yw****,2024-06-23 14:50:54.197642,"작가님의 책을 읽고 그들도 알고 느끼고 반성하면 좋겠습니다. 
자랑스러웠던 내 나라인데 왜 국민을 부끄럽게 만드는건지...
제발 제발  제자리로 돌려놔주기를 ... ...",추천해요,4
14027388,js****,2024-06-23 14:25:30.20709,류시민의 세상을 바라보는 눈은 정확한거 같아요. 굿입니다!!!,최고예요,4
14027170,jl***,2024-06-23 13:49:56.650352,역시 유시민!! 그의 통찰력에 또한번 감탄합니다. 3권씩 삽시다 ㅎ,도움돼요,4
14026458,ga****,2024-06-23 10:38:43.476046,답답한 마음을 뚫어주고 이해하기 어려운 지금 시대를  잘 설명해주고 있음,도움돼요,4
14026084,ky*****,2024-06-23 09:00:54.686036,"유시민 작가가 단숨에 써 내려간 통찰력이 곳곳에 번득이는 읽을 거리가 풍부한 책이다. 이 책과 관련한 유투브 영상도 재미 있었지만, 책을 읽으면서 보는 재미는 더하다. 그간 이해하기 어려웠던 윤석열 정부의 상식과 충돌하는 모순들을 전반적으로 이해하고,  나아가야 할 방향을 제시한 이 책은 유시민 작가만이 쓸 수 있는 위대한 책이다. ",도움돼요,4
14026021,jb******,2024-06-23 08:25:21.192441,어지러운 시기를 이해하는데 큰 도움이 되었습니다,최고예요,4
14024449,mh****,2024-06-22 23:05:40.465181,“역시 최고의 지식인 유시민” 이 한마디면 될 것 같습니다. 책 내주셔서 감사합니다!,최고예요,4
14022578,jj******,2024-06-22 19:19:47.049613,검찰독재 친윤언론 시대의 한줄기 빛과 같은 책. ,최고예요,4
14021830,lu******,2024-06-22 16:27:55.120286,역시 유시민 작가다운 통찰과 해학으로 쓴 책이라 재밌습니다.,추천해요,4
14021611,wk******,2024-06-22 15:49:20.496044,"작가님이 이 책을 쓰신 이유는
대중의 분노와 절망을 행동으로 이끌어내기 위해서 이기도 하지만, 한편으로는 극단적 정치양극화를 우려하셨기 때문이라고 생각합니다.
(불관용을 경계하시는 점, 미국의 닉슨사례 등)
저 또한 윤석열정부의 행태에 매일 분노하고 있으나.
진보세력의 타협과 관용만이 이명박이 시작한 증오정치를 멈출 수 있습니다. 우리는 품위를 잃지 맙니다.",최고예요,4
14021518,ro**************,2024-06-22 15:33:35.29075,속 시원한 국민처방 도서입니다!,최고예요,4
14021435,59****,2024-06-22 15:22:20.219498,"작가의 정치평론을 평소 관심 있게  보고 있었는데, 윤서결이 계속하면 나라가 괜찮을 것인가가 격정 됐는데  읽고나서 조금은 안심 할 수 있었다. 정치에 관신이 없는 분들은앞으로  정치에 적극적으로 참여하여 올바른 지도자를 선출 하도록 해야 미래에 대한 희망이 보인다.",추천해요,4
14021322,co*******,2024-06-22 15:09:06.662636,"역시 유시민.. 늘 유시민 작가님 방송을 봐서 그런지 아는
내용이지만 나와 같은 생각 이라서 위로도 되고 속도 시원하네여 쭉쭉 읽혀집니다😍",최고예요,4
14021117,cd****,2024-06-22 14:24:41.926563,읽기쉽고 좋습니다.,집중돼요,4
14021048,zt***,2024-06-22 14:16:13.046368,참 여러가지로 힘든시기 인것 같다. 유시민작가의 희망은 힘이세다 라는 글귀가 힐링이 된다.  위로가 되는 책인것 같다.,최고예요,4
14020941,oh***,2024-06-22 13:45:13.552463,"목차부터 기대됩니다. 
그 사람의 미래가 행복하지 않길.. 
다른 이의 미래가 불행하길 기대하는 현실이 무섭네요.",추천해요,4
14020426,ym*****,2024-06-22 11:52:36.154248,"말모말모...
정말 혜안이 최고이십니다..
문장이 좋아 술술 읽히는 것도 장점입니다.
모든 시민들이 읽었음 하는 책입니다.
어리석은 지도자 두 번 경험했으니 다시는 이런 일이 없길 바라면서 모두에게 이 책을 추천하고 싶네요~~~",최고예요,4
14020043,k2******,2024-06-22 10:37:30.069425,"이 책은 첫째, 정말 재밌다. 그리고 대중이 읽기 쉽게 씌어져 있다. 그래서 주변인들에게 사주고 싶은 책이다. 유시민의 제안인 '불기소 특별사면'에 대해 정말 마음으로는 윤석열을 용서하고 싶지 않지만, 어쩌면 지금으로서 가장 현명한 대안이 아닌가 하는 생각이 들기 시작했다. 하지만, 과연 이조차 그가 받아들일지는 모르겠다. 유시민은 정말 타고난 글쟁이다. 많은 분들이 읽었으면 좋겠다.",추천해요,4
14019542,hm****,2024-06-22 08:18:54.822127,"역시는 역시에요~
작가님의 통찰력은 최고.
그리고 위로를 받아요.",최고예요,4
14019417,zo******,2024-06-22 07:07:58.20385,그의 말로는 죽이지 못한자와 죽였는데 살아난자가 심판할 것이다,최고예요,4
14019410,na*****,2024-06-22 06:59:50.87074,이 시대 최고의 작가!!!!! 적극 추천합니다 ,추천해요,4
14019080,js*******,2024-06-22 01:23:23.531224,"스스로 사유하는 자는 힘이 있습니다. 국민이 주도해 당선된 정당의 국회의원들을 활용해, 개개인의 힘과 역량을 다해, 박물관에 들어간 코끼리를 끄집어 냅시다.",집중돼요,4
14018971,kw*******,2024-06-22 00:38:33.908091,늘 응원합니다. 감사합니다.,최고예요,4
14011542,be*****,2024-06-20 22:39:25.657452,안전하게 잘 받았습니다.,최고예요,4
14007823,ha******,2024-06-20 01:44:59.850276,유시민 작가님의 아주 개인적인 생각이지만 저에게도 아주 도움이 되네요. ,추천해요,4
14007047,ha***,2024-06-19 23:15:09.274622,오늘 책 왔습니다. 잘 읽어보고 한달 뒤 리뷰 다시하겠습니다.,추천해요,4
14006240,at*******,2024-06-19 20:59:12.930216,"유작가의 대중 저서들을 보면 글은 명료하지만, 날카롭지는 않다. 그러나 유작가는 결코 유한사람도 흐느적한 사람도 아니다. 현대사를 인생으로 부딪혀 온 이가 속에 회한과 분노를 품지 않는다는 건 말이 안 되는 것이다.

그러나 간만에 이 책은 그 날카로움이 서슬퍼렇다.
그 분노가 정돈되었을 뿐이지, 떨어진 머리칼 한 조각도 베어버릴 수 있을 정도로 날카롭다.

난 그런 글을 한 번 볼 수 있게되어서 기쁘지만,
또 한 편으로는 그런 글을 불러일으킨 세태와 시대의 몽매함이 개탄스럴 뿐이다.",도움돼요,4
14004805,ze***,2024-06-19 15:46:10.552645,킬링타임용 (그) 씹기로 생각하고 편하게 읽다가 진지해졌습니다. 읽지도 않고 작가님을 폄훼하는 사람들은 읽고나면 (그)를 불쌍하게 여길...,추천해요,4
14004733,ta********,2024-06-19 15:32:55.732274,"방금 배송받았어요 현 시국에 대한 
진단 잘 읽겠습니다~!",추천해요,4
15500758,k0********************,2025-03-10 21:53:09.513504,유려한 글쓰시의 표본..,추천해요,4
15459200,fu***,2025-03-03 18:07:45.055567,감사합니다. 추천해요.,추천해요,4
15439130,dm*****,2025-02-27 15:51:29.298768,이 시국에 한 번 읽어보려고 구매했습니다.,도움돼요,4
15429989,hs*****,2025-02-25 15:02:02.774851,불안하고 어수선한 지금 이 시기에 현자의 통찰력을 통해 배우고 깨칩니다.,추천해요,4
15422982,gt**************,2025-02-23 21:53:51.122259,새로운 정보와 작가님의 통찰력을 볼 수 있었다 한 번 읽고도 또 읽었다 부디 긍정적인 결과가 우리에게 닿길! ,집중돼요,4
15422038,ng******,2025-02-23 18:44:03.104703,객관적인 시선을 같고자....,도움돼요,4
15412474,ye****,2025-02-21 18:10:01.813217,그저 예언서.. 통찰력을 키우고 싶어지는 책,집중돼요,4
15369656,ar*******,2025-02-12 17:41:33.652622,이번책은 좀 늦게 구입했네요 작가님 파이팅 ,최고예요,4
15330414,gy*****,2025-02-04 06:45:28.312419,유시민 작가님 항상 응원합니다,최고예요,4
15326553,as*******,2025-02-03 09:28:41.825075,현 시대를 살아가는 데에 안심을 주어요.,도움돼요,4
15243677,hj*****,2025-01-12 21:15:44.516165,"고맙게 잘 읽었습니다. 
작가님 정말 대단하십니다.^^",추천해요,4
15217698,fi********,2025-01-06 21:11:57.201999,재밌고 흥미로운 책,추천해요,4
15203021,jj*****,2025-01-03 16:29:12.723648,책이 너무 좋습니다.,집중돼요,4
15182026,mi******,2024-12-29 18:50:00.061542,명불허전! 쾌도난마!,최고예요,4
15175820,jb****,2024-12-28 09:46:28.094576,요즘 계엄 정국에 정말 지도자를 잘 뽑아야한다는 생각을 더하게 하네요.,최고예요,4
15165747,is******,2024-12-25 18:57:32.993838,재미있게 잘 읽었습니다,도움돼요,4
15159283,le******************,2024-12-24 03:54:00.128204,"계엄 사태 이후 충격에서 헤어 나오기가 힘들어서 유시민 작가님을 찾았습니다. 책을 펴 읽기 시작한 지 얼마 지나지 않아 울컥하기도 했고, 우아한 비판에 감탄하기도 했습니다. 쉬운 문장으로 이해하기 쉽게 정치적 맥락을 설명해 주셔서 좋았습니다.",도움돼요,4
15146671,ls********,2024-12-20 20:45:18.92577,"마침 국가란 무엇인가 읽고 있었는데 요즘 시기가 시기인지라 읽어보고 싶어서 구매합니다.
",도움돼요,4
15143997,na********,2024-12-20 00:51:42.917199,요즘 답답한 마음에 기댈 곳은 유시민 작가님과 이 책 뿐이네요 적극 추천합니다.,추천해요,4
15141732,yo*****,2024-12-19 12:41:53.031976,요즘 이 책이 왜 인가안지 알겠어용,도움돼요,4
15141492,dk*******,2024-12-19 11:17:19.369656,12.3 이후 답답한 마음에 읽어봤는데 아주 시기 적절했던 것 같습니다 ,집중돼요,4
15136221,qw*******,2024-12-17 22:59:41.384175,"정치 왕초보가 읽어도 우리나라 현재 시점이 어떤지 전달이 잘 되었고, 유시민 작가님답게 굉장히 잘
비유해서 글을 써주셔서 읽기에도 어렵지 않게 잘 이해할 수 있는 책이었습니다 편향적으로 보일 수도 있으나 개인적인 생각으로는 오히려 객관적으로 잘 표현해주신것 같았습니다",도움돼요,4
15133085,tr*****,2024-12-17 09:33:44.149664,"촌철살인 유시민 작가님,  좋은 글 많이 써주세요",추천해요,4
15080628,ra*****,2024-12-02 14:08:23.942843,현정부에대한 솔직한 의견과 대응정책..공감합니다,집중돼요,4
15051675,ja*****,2024-11-23 21:42:36.400023,"이렇게 논리적으로 
본인의 품위를 잃지 않으면서 
한 인간( 코끼리가 더 맞겠다 )에게 이토록 심하게 욕을 퍼부을수있다니!

글을 잘쓴건지 
좋은 책인지 그런걸 떠나 
너무 속을 후련하게 만들어주는 책! ",최고예요,4
15048206,na***,2024-11-22 20:38:18.161052,"책 도착한 날 밤부터 새벽녘까지 완독했다.
작금의 암울한 정치상황에 대한 명쾌한 미래예견을  들을수있었다.  민주주의 제도와 그것을 운영하는 사람, 그리고 주권자의 역할과 책임에 대해 다시금 생각해보는 시간이었다. 
",도움돼요,4
15017281,y0**********,2024-11-14 14:53:54.35417,책좋아요! 재밌어요,도움돼요,4
15000054,kd******,2024-11-09 18:15:00.674581,내려놓을때를 알아야할때,추천해요,4
14979206,ko******,2024-11-03 22:05:23.352407,내가 하고싶지만 표현할 재주가 없어 못하던 말을 해주는 책입니다. 세상을 보는 시야를 넓혀주고 이해을 도와주는 유시민님의 도움을 오늘도 받아 봅니다~~~,추천해요,4
14924506,dl*********,2024-10-21 18:00:38.217736,우연치 않게 초판사인본을 교보문고에서 샀는데 훌륭한 냄비받침으로 쓰고 있어요~,최고예요,4
14685229,bu*******,2024-09-22 00:20:12.918785,"이런 책은 입가심용인데 괜히 샀어요.
감동도 없고 의미도 없고..
그냥 유시민 책 팔아주기에 일조.",쉬웠어요,3
14633039,re****,2024-09-14 22:14:39.037363,그의 운명에 대한 아주 개인적인 생각.,최고예요,4
14584315,fi********,2024-09-08 12:13:05.760715,"조금 어려워서 읽기가 쉽진 않습니다만, 구구절절 공감 됩니다.",추천해요,4
14504397,ie****,2024-08-29 12:34:36.285614,지금 이 시대에 꼭 읽어야 하는 책이다. ,추천해요,4
14503385,uk****,2024-08-29 10:09:54.038088,마음이 편안해집니다,최고예요,4
14497568,ns*****,2024-08-28 16:41:24.803708,재밋고 유익합니다~,집중돼요,4
14496051,b2*****,2024-08-28 14:49:50.401282,"특히 마지막 4,50대들에게 해주신 말씀에 울컥했네요.",최고예요,4
14495852,iw*******,2024-08-28 14:36:45.336748,글을 읽으면 유시민 작가의 목소리가 들리는 듯합니다. 이 시대의 현인,최고예요,4
14494752,st******,2024-08-28 13:23:32.11653,이런 책에 위로를 받는 현실이 개탄스러울 따름.,최고예요,4
14493259,kr*****,2024-08-28 10:48:33.606031,원인 모를 불안과 짜증을 합리적으로 이해할 수 있는 진단과 정신 건강을 위한 처방전!,도움돼요,4
14492127,el****,2024-08-28 09:07:07.019319,유시민 작가님 책은 무조건 믿고 읽습니다~~,최고예요,4
14491579,th********,2024-08-28 08:07:10.32889,재밌게 잘 읽었어요,최고예요,4
14484989,an******,2024-08-27 17:16:43.201735,아주 도움됩니다. 읽어 보십시오.,도움돼요,4
14482534,ly*****,2024-08-27 13:02:38.791181,2년의 흐름과 3년의 다가옴^^,최고예요,4
14481445,sq****,2024-08-27 11:04:36.072588,윤석열에 대한 날카로운 분석책. 강추합니다.,추천해요,4
14477855,25****,2024-08-27 00:07:10.210113,이런 통찰력을 가지고 싶다 최고,최고예요,4
14477674,dr*********,2024-08-27 00:02:35.163086,잘 읽었습니다 좋아요 ,도움돼요,4
14475235,cf******,2024-08-26 20:29:10.754085,더 좋은 세상이 오기를,도움돼요,4
14474256,ld*****,2024-08-26 17:02:59.046194,정말 글을 잘쓰신다 감탄하며 술술 읽어내려갔습니다,집중돼요,4
14472329,j2****,2024-08-26 10:18:25.686796,아주 개인적인 생각이지만 대다수가 같은 생각일것이다,집중돼요,4
14468195,jh*****,2024-08-25 19:05:44.435424,"이시대 정치와 역사를 꾀뚫는 시선이 좋았다.
한편 우울해지는 현실은 어쩔수없었다ㅠ",집중돼요,4
14466942,ja********,2024-08-25 15:38:43.214533,재미있게 잘 읽었습니다.,최고예요,4
14465109,kh*****,2024-08-25 09:44:41.83682,싫은데 왜싫은지를 정리해줘서 나의 비판에 정당성을 찾은 느낌이다. 또한 이책을 통해 같이 앞담화하면서 국민들이 정치에 또 외면하지 말았으면 하는 마음도 있지 않았을까 생각이 든다.,집중돼요,4
14464601,su******,2024-08-25 08:25:35.66307,유익하고 재밌어요 ,집중돼요,4
14464312,cy*****,2024-08-25 05:08:18.287937,지난 2년의 현상의 우리의 관념이나 행동양식과 어떻게 결합돼 있는지 날카롭게 분석했다,추천해요,4
14462610,bl******,2024-08-24 22:58:16.854538,유시민 답다! 답답한 사회에 대한 일침!,집중돼요,4
14460368,ly*****,2024-08-24 17:10:13.511521,잘 볼께요 ~~~~~~~,추천해요,4
14458498,ta******,2024-08-24 11:44:04.655276,"명쾌하고통찰력 있는 분석, 믿고 봅니다!",도움돼요,4
14458295,my********,2024-08-24 11:09:18.378637,읽어보고 싶어서 샀습니다!,집중돼요,4
14453316,rl******,2024-08-23 16:17:53.109823,무엇이 문제인지 명확하게 알려주는 책,집중돼요,4
14451276,su******,2024-08-23 09:57:00.286892,아주 좋고 유익합니다.,집중돼요,4
14451181,su******,2024-08-23 09:51:11.95128,아주 좋고 유익합니다.,집중돼요,4
14445160,jh*****,2024-08-22 14:25:55.189604,잘 받았습니다...,도움돼요,4
14442014,ba*****,2024-08-22 09:01:21.288113,ㅎㅎㅎ내용이 참 아수,추천해요,1
14441415,he****,2024-08-22 07:51:02.762215,유시민이라서 쓸수 있는 책 ,최고예요,4
14438350,sg*****,2024-08-21 22:10:15.483176,한번 잡으면 끝까지 읽게됩니다. ,추천해요,4
14433595,he*****,2024-08-21 08:56:03.632049,"대단합니다
인간에 대한 통찰력~",추천해요,4
14430207,co*****,2024-08-20 17:12:47.271074,"현재의 정치적 분위기를 이해하기에 재밌게 읽었어요
",추천해요,4
14417959,go******,2024-08-18 17:17:28.857017,해괴한 계란말이 퍼포먼스가 이해되는 책,추천해요,4
14411879,wj********,2024-08-17 19:16:50.365632,생각대로 될지 흥미진진합니다,집중돼요,4
14411536,as******,2024-08-17 18:21:00.961505,"과감하면서도 조심스러운 문장이 인상깊다. 하지만 이정도로 나라를 박살냈는데도 조심스러운 문장이 나올 수 밖에 없는 대한민국의 현실이 부끄럽다. 분명 틀린 선택을 했는데도 징징대는 개돼지들이여, 지금 대통령은 병이 아닌 증상에 불과하며 그대들이 진정 이 나라의 병이다.",추천해요,4
14409610,sa*****,2024-08-17 12:07:59.457616,재미있게 잘 읽었습니다 감사합니다,최고예요,4
14401470,so*******,2024-08-16 09:34:46.619012,언론에 대해 쓰신 파트 흥미로웠습니다. 정말 언론이 사기업치고 국민 전반에 끼치는 영향이 너무 크네요. 공익을 위한 언론이 아니라 사익을 위한 언론이라는 걸 모두가 인지하면 좋겠어요.,추천해요,4
14396117,ri*******,2024-08-15 12:25:12.506362,역시  사길 잘했다 싶을 정도로 훌륭한 글이었습니다.,추천해요,4
14394910,jo*******,2024-08-15 04:02:33.611005,그야말로 아주 개인적인 생각이다.  그는 절대로 자진해서 내려올 자가 전혀 아니다.  피플파워가 필요하다. 더 늦기 전에...,추천해요,4
14389048,jo****,2024-08-14 11:18:08.09211,"작가님의 예리한 통찰력과 관찰력이 돋보입니다.
술술 읽히네요.",최고예요,4
14388801,zz******,2024-08-14 10:33:18.226248,재미잇다 ㅋㅋㅋ 읽어 보아요,도움돼요,4
14384336,so******,2024-08-13 20:35:16.670536,냉철한 비판이 돋보입니다.,도움돼요,4
14383725,Ke**************,2024-08-13 19:08:31.766907,"아직 다못읽었어요
읿어보고 숙고해볼만한 점이 많은거같아요
유작가님 의. 이정권에 대한 통합적인 생각을 읽어볼수 있습니다",최고예요,4
14381821,dl**************,2024-08-13 14:45:26.568014,상당히 편향적으로 보일 수 있음에도 불구하고  그것을 무릅쓰고 외치는 정의.,추천해요,4
14379785,me********,2024-08-13 08:22:58.207133,"이번 정권의 실체를 잘 알게 됐어요. 어느 조직이든 리더를 뽑는게 얼마나 중요한지, 마치 산불로 초토화된 산천을 회복하는데 수십년이 걸리는것처럼 역사는 그렇게 후퇴하는것을요.",최고예요,4
14372773,ro****,2024-08-11 23:20:02.662328,공정과 상식 그리고 민주주의 후퇴를 가져다 준 이유를 알려준다,추천해요,4
14369342,ar*****,2024-08-11 14:13:34.884428,어두운 지금세상에 숨통이 되어라,쉬웠어요,3
14367322,ja********,2024-08-11 02:37:54.650664,"잘 읽었습니다.
공감돼요",쉬웠어요,4
14367202,as*****,2024-08-11 01:27:54.276449,속이 시원합니다..언제나 감사합니다^^,최고예요,4
14366483,fa****,2024-08-10 23:35:52.788643,대한민국이 바로서기를바랍니다,추천해요,2
14363974,le****,2024-08-10 15:57:19.894881,최고의 작가의 최고의 책!!,최고예요,4
14350859,pu*******,2024-08-08 10:27:41.612927,한장한장 오래 머물고 싶은 문장들 입니다.,집중돼요,4
14349415,li********,2024-08-07 23:54:22.87414,응원합니다. 잘 읽었습니다. 사고 또 사서 주변에 선물했어요. ㅋㅋ,최고예요,4
14347889,yo*****,2024-08-07 21:15:53.835644,"유작가님도 2030세대에 기대가 없구나.
4050이 어떻게든 해볼게요.",추천해요,4
14339081,ji****,2024-08-06 13:56:56.076364,필력좋으신 유작가님에 대한 저의 아주 개인적인 생각. 뒷담화는 재미나다.,쉬웠어요,4
14338860,ru*****,2024-08-06 12:58:47.74889,무난하게 술술 읽힙니다,추천해요,4
14338525,jy****************,2024-08-06 11:12:35.530541,작가의 생각을 많이 접할수 있었습니다.,도움돼요,4
14332823,an*******,2024-08-05 15:09:44.284749,"""윤석열은 전두환만큼 기괴하지만, 힘과 능력은 잔두환에 닿지 못한다.""",추천해요,4
14308158,sh*****,2024-08-02 12:00:37.21629,술술 읽히는 좋은 책이었습니다,추천해요,4
14298962,vo*******,2024-08-01 09:09:06.749546,"그의 운명에 대한
아주 개인적인 생각",집중돼요,4
14298121,po*****,2024-08-01 06:07:50.717165,"유시민 작가님 책은 항상 기대되게 하고, 그 이상입니다. 최고네요.",쉬웠어요,4
14293022,Ba*******,2024-07-31 18:25:52.244505,고릴라가 언체 내려갈까요?,집중돼요,4
14291757,my***************,2024-07-31 15:25:00.159492,"유시민씨의 책은 늘 많은 가르침을 줍니다.
이 책 또한 다방면에서 박학다식한 유시민씨의 면모를 잘 느낄 수 있는 책이었습니다. 
즐겁게 읽었고, 좋은 책 감사드립니다. ",추천해요,4
14280280,dd********,2024-07-30 08:42:35.902061,극한으로 대립되는 우리의 정치 이면이 낳은 책이 아닐까 싶습니다. 그의 운명이 궁금하긴 합니다.,집중돼요,3
14280002,pj*****,2024-07-30 06:58:35.249023,"나와 다른 사람에 대한 이해, 다른 사람의 삶에 대한 이해, 나 자신도 돌아볼 수도 있는 기회, 그런 시간을 주었다.",집중돼요,4
14274840,in********,2024-07-29 14:04:01.766998,재미있어요 도움이 돼요 ,추천해요,4
14274653,ss********,2024-07-29 13:30:04.669817,유익한 책 입니다~!,집중돼요,4
14274446,le*******,2024-07-29 12:28:00.134909,읽으면서 응어리진 마음의 위로가 됩니다. 감사합니다.,추천해요,4
14273741,he*******,2024-07-29 09:25:04.105826,'그'에 대한 그의 정확하고 예리한 생각,최고예요,4
14271292,hj*****,2024-07-28 20:51:04.391414,재미있게 읽었습니다,추천해요,4
14263265,lo******,2024-07-27 10:17:19.119928,일상적인 내용 좋아요,도움돼요,4
14255255,be*******,2024-07-26 10:26:39.959525,흥미진진하게 잘 읽었습니다,최고예요,4
14253872,sj***,2024-07-26 08:10:07.921895,다소 노골적인 제목이 살짝 신경 쓰였지만 그래도 믿고 보는 유시민 작가의 생각을 확인하고 싶어 구입했어요.,추천해요,4
14253217,cy*******,2024-07-26 05:32:55.038412,그의 운명의 대해 공감,쉬웠어요,4
14248086,li********,2024-07-25 12:05:56.337401,도움아  너무  됩니다,집중돼요,3
14241603,ho*****************,2024-07-24 09:43:53.123336,그분이 더 알고 싶다면 유시민의 언어로 그분을 다시 한번 돌아보게 되는 책,최고예요,4
