리뷰번호,회원ID,작성일시,리뷰내용,감정키워드,평점
13066054,ca*******,2024-02-04 14:54:11.972793,"잔잔하고 쉽게 읽힌다고 해서 읽었어요.
마지막장을 향할 수록 작가가 무엇을 이야기하려고 했는지 그 의도가 보이기 시작했어요. 
처음에는 ""이처럼 사소한 것들"" 책 제목을 보면서 우리들 삶,일상에서 보고 느낄 수 있는 일들에 관한것인가 라는 생각을 했는데 결말을 보고 다시 생각해 보니 더 깊은 의미가 내포되어 있다는걸 느꼈어요. 

결말이 모호하다고들 하는데 그런 부분도 없잖아 있지만 작가가 무엇을 이야기하려고 하는지를 알 수있었어요. 단어 하나하나에 담긴 의미를 생각하면서 다시 읽으면
더 깊이있게 읽어내려 갈 수 있을꺼 같아요. 
얇지만 휘리릭 읽어가는 소설은 아님에 틀림없네요~ 
클레이 키건이 압축해 놓은 언어의 의미를 하나씩 알아가면서 읽는 재미도 있을 듯! 
두,세번 읽어야 작가의 의도를 파악할 수 있을꺼 같아요. 저는 처음부터 다시 정독하고, 맡겨진 소녀도 읽어봐야겠어요.",재밌어요,4
13060428,ho*******,2024-02-03 16:45:16.222985,많은 생각을 하게 하는 책이네요. 주인공의 입장이 되어서 생각도 해보고 나라면 어땠을 하능 생각도 해보게 되네요. ,공감돼요,4
13059455,jj********,2024-02-03 13:21:37.498923,"일상과 동떨어지지 않은 소설이면서, 묵직한 느낌을 주는 책입니다. 짧고 어렵지않지만 나 자신을 돌아보게하는 소설입니다. 문장도 많이 함축적이라 곱씹어 읽을 때 마다 느낌이 다릅니다. 극장에 들어가 연극을 함께 하는 느낌이 들 정도로 몰입감이 있습니다.",최고예요,4
13056467,so********,2024-02-02 22:49:50.728871,마음이 따뜻해졌어요,고마워요,4
13051689,ca******,2024-02-02 12:12:01.27299,"드디어 클레어 키건 작가님을 만나게 되었다. 오늘이 입덕하는 날이다. 

매우 정교한, 정제된, 압축된 글로써, 내공이 단단히 보여지는...",최고예요,4
13045122,sa******,2024-02-01 14:37:24.311004,가볍고 편안하게 읽을수있었습니다,힐링돼요,4
13042563,sj****,2024-02-01 01:46:46.730183,마음을 울리는 문장들,힐링돼요,4
13039995,jo****,2024-01-31 18:10:51.5526,클레어 키건만의 잔잔하고 담백한 글 속에서 묵직한 여운을 느낄 수 있는 좋은 책입니다!,최고예요,4
13039349,sa********,2024-01-31 16:27:09.281654,아직 초반인데 기대됩니다!,최고예요,4
13032337,nh*******,2024-01-30 12:51:38.662568,잘봤습니다 마음에 남네요 ,공감돼요,4
13032198,ch*****,2024-01-30 12:04:13.746621,재미있게 읽었습니다!!,힐링돼요,4
13030302,jo******,2024-01-29 23:26:34.862237,사소한 것 같아도 절대 사소하지 않은 것들 ,공감돼요,4
13025185,se*****,2024-01-29 12:01:19.419931,많은 도움이 됩니다,고마워요,4
13024745,ok********,2024-01-29 11:24:14.745911,"한 번만 읽기에는 그 깊이를 가늠하기 어렵다고 한다. 그 말의 뜻을 알 것 같다. 세상에 가장 좋은 생각과 말이 이 소설에 꽉 채워졌다. 힘들고 아픈 삶을 살았다고, 구겨진 하늘을 가질 텐가. 울퉁불퉁한 길을 걷고 달렸다고, 자리에 주저앉을 것인가. 내 다리가 아프다고, 피투성이 아이를 업지 않을 텐가. 일기장을 묵직하게 만드는 간결한 문장들이었다. 다시 읽고 싶은 날을 위해 옅은 색의 감정을 남겨본다. '세상 어떤 소설보다 뜨거운 소설'을 만날 수 있는 시간에 감사하며.",고마워요,4
13023261,su********,2024-01-29 08:21:06.270264,추운날 마음이 포근해지네요 ,힐링돼요,4
13021395,so*****,2024-01-29 00:05:14.885327,얇고 슉슉 읽기 좋아요,최고예요,4
13020591,ye********,2024-01-29 00:00:45.689449,재밌게 잘 읽었어요,재밌어요,4
13018485,cl*******,2024-01-28 18:36:01.943978,재미있게 잘 읽었습니다. 추천합니다,최고예요,4
13018259,c9****,2024-01-28 17:51:16.759177,재미있게 읽었어요. ,공감돼요,4
13017870,ch********,2024-01-28 16:14:18.692104,맡겨진 소녀 재미있게 읽어서 이 책도 기대하고 있어요,최고예요,4
13016075,le******,2024-01-28 07:07:45.113956,잔잔하게 잘 읽혀져요,힐링돼요,4
13015794,ce******,2024-01-28 02:25:20.905267,"이처럼 사소한 것들의 힘,,,
대단한 마무리는 아니지만 여운이 있는,,,",공감돼요,4
13015265,pa******,2024-01-27 23:58:52.347111,스토리에 몰입했어요,재밌어요,4
13013500,mr****,2024-01-27 20:47:33.096969,"섬세한 문장들, 타인에 대한 깊은 연민 그리고 용기",공감돼요,4
13013378,lo*******,2024-01-27 20:32:14.544619,자꾸 곱씹게 되는 책입니다. 외면하지 않고 모두 함께 의지하며 살아가는 세상이길 바라봅니다.,최고예요,4
13012411,la*****,2024-01-27 16:41:38.716805,"후기 보고 샀어요, 금방 읽을 수 있을 듯한데 생각보다 얇아서 놀란",힐링돼요,4
13011592,le******,2024-01-27 13:47:47.573142,얇아서 가볍게 읽을 수 있을 거 같아요. ,공감돼요,4
13010278,ha********,2024-01-27 07:14:58.54976,너무너무 좋았습니다.,최고예요,4
13006509,du*****,2024-01-26 18:02:49.725997,기독교인 아니 올바른 삶을 고민하는 모두에게 위로와 고민을 권하는 책,공감돼요,4
13003696,hy******,2024-01-26 12:00:26.402138,편하게 읽기 좋은 책,고마워요,4
13001579,se****,2024-01-26 08:32:45.788875,많은 생각을 하게 해주네요. ,힐링돼요,4
13000908,ki****,2024-01-26 05:13:34.086011,"훌륭한 저서,  감사합니다.",고마워요,4
12992059,xa******,2024-01-24 22:52:33.772201,맡겨진 소녀도 보고 싶네요.,재밌어요,4
12988326,au****,2024-01-24 13:01:55.422372,재미있게 잘 읽었습니다 ,최고예요,4
12982130,zo*****,2024-01-23 14:03:47.746971,"#맡겨진소녀 의 킨셀라 아저씨는 말했다. '나한테 애가 없다고 해서 다른 집 애들 머리에 비가 떨어지는 걸 보고만 있을 순 없지. (47 p.)' 그리고 #이처럼사소한것들의 펄롱은 생각했다. '... 서로 돕지 않는다면 삶에 무슨 의미가 있나 ... (119 p.)' '나'와 세라가, 킨셀라 부부와 펄롱이 겹쳐진다. 시리고 황량한 풍경 속 온기를 찾을 수 있었던 책이었다. ",힐링돼요,4
12981434,cb*************,2024-01-23 11:16:27.270091,지식을 쌓는데 큰 도움이 되었습니다. ~!!,공감돼요,4
12977516,mi*****,2024-01-22 17:20:02.669059,유용합니다. 잘 활용하겠습니다.,고마워요,4
12972769,ba*******,2024-01-21 20:40:00.569424,키건의 글을 알 것 같습니다.,최고예요,4
12971874,cb*************,2024-01-21 17:19:22.166105,추천하는 도서입니다.,힐링돼요,4
12969708,ky*****,2024-01-21 07:05:25.559705,좋은책 소장하려 구입했어요,고마워요,4
12968786,gm********,2024-01-21 00:16:27.140088,읽으면 도움되는 내용입니다,힐링돼요,4
12968351,db*******,2024-01-20 23:32:33.202555,좋은 책 입니다. ,힐링돼요,4
12966574,ps****,2024-01-20 20:05:20.204726,"깔끔한 문체, 함축되어진 의미 잔잔한 글귀에서 몰입감을 느끼기는 처음인듯하다. 단숨에 책을 읽었다. 많은 생각이 들었다.
옮긴이의 말처럼 두번 천천히 글을 읽으면 작가의 무수한 의도와 농축된 글의 깊이를 알게 된다는 말의 의미를 알게 될것이다. 24년멋진 작가를 알게 되었다",최고예요,4
12964140,do******,2024-01-20 13:15:30.853078,끝까지 읽고 이 책을 재밌다고만 할 수 없게 되었습니다. 좋은 책이네요. 책을 읽고 덮자마자 다시 처음부터 다시 읽어야겠다는 생각을 하게 되었습니다. 작가의 다른 책들도 읽어 보야야 겠네요. ,고마워요,4
12963397,wa******,2024-01-20 10:31:38.138766,이처럼 사소한 것 같은 펄롱의 용기가 세상을 변화시키네요. 겨울에 읽으면 마음이 훈훈해지는 소설입니다. 선물 받아 읽고 좋아서 선물 하려고 또 샀어요.,힐링돼요,4
12961811,fi****************,2024-01-20 00:27:06.771783,어떤책일지 궁금하네요,힐링돼요,4
12959095,re****,2024-01-19 17:36:05.790928,이처럼 사소한 것들,고마워요,4
12957405,ww******,2024-01-19 13:02:25.060768,담담히 읽히는 책 추천합니다 ,최고예요,4
12955697,dh*******,2024-01-19 02:18:19.49164,기대감이 많이 높았나.. 생각보다 너무 짧다,힐링돼요,4
12954297,ve*******,2024-01-18 22:34:36.425193,짧은 단편으로 깊은 울림과 여운을 주는 작가입니다. 얼마나 따뜻하고 넓은 마음을 가지고 있는지 궁금해요. 꼭 읽어 보시길 바랍니다,최고예요,4
12952686,ji**************************,2024-01-18 18:10:28.805044,"지금까지 읽었던 그 어떤책보다도 한문장 하나하나
곱싶으며 읽어던 책..
마지막의 여운이 좀 있었던... 그런느낌
요즘 핫한 작가의 문체를 경험한 새로운 시간.. ",최고예요,4
12947895,DD****,2024-01-17 22:42:39.908922,얇아서 한자리에서 금방읽을수있다,재밌어요,3
12947513,tj********,2024-01-17 21:46:57.681131,너무 좋은 책이네요~,힐링돼요,4
12946940,go********,2024-01-17 20:20:49.859863,이처럼 사소한것들 얇은데 기대됩니다,재밌어요,4
12945735,ma*****,2024-01-17 17:43:59.904256,공백을 채우는 독자의 힘을 자연스럽게 끌어내는 문장들,최고예요,4
12941104,sj******,2024-01-17 09:46:15.070591,문장하나하나가 유려한 느낌이드네요. 얇고가벼워서 들고다니며 여행하기좋습니다,힐링돼요,4
12940842,su********,2024-01-17 09:15:50.329914,좋은 책입니다 감사합니다,고마워요,4
12940777,mo******,2024-01-17 09:12:02.466947,잘 읽힙니다~^^  내용도 좋아요,재밌어요,4
12940294,bi*****,2024-01-17 08:53:08.289203,읽을 수록 힐링되는 좋은 책입니다,공감돼요,4
12937778,rs***,2024-01-17 00:01:49.926724,영화도 기대되는 작품입니다,최고예요,4
12931709,th********,2024-01-16 09:02:09.796133,역시 믿고 보는 작가입니다. ,최고예요,4
12931647,su********,2024-01-16 08:38:33.726122,좋은 책입니다 감사합니다,고마워요,4
12930908,ko******,2024-01-16 00:49:45.18787,"마지막, 옮긴이의 글까지 읽고 다시 처음부터 읽어야 제대로 이 책을 읽을 것 같다. 두 번으로도 부족해 보인다.  내재된 감정을 음미할수록 서글퍼지고, 읽을수록 감탄하게 된다. 작가의 다른 작품도 찾아 읽어야겠다.",최고예요,4
12924495,wn*******,2024-01-15 02:43:31.925405,소설 읽기 초보라 외국소설은 문장이 잘 안읽히거나 해서 어려움을 많이 느끼는데 이 책은 술술 잘 읽혔어요 한 번 더 읽어보려고 합니다 ㅎㅎ,재밌어요,4
12923667,to********,2024-01-14 23:48:04.147311,그냥..힐링이 돼요 ,최고예요,4
12922957,ji*******,2024-01-14 22:36:31.56414,그 전 소설 읽고 좋아서 구매했어요,힐링돼요,4
12922472,re*******,2024-01-14 21:21:10.959263,"이처럼 사소한 것들, 이라는 제목이 더없이 어울렸습니다. 짧지만 인상깊은 소설이네요.",공감돼요,4
12920690,el****,2024-01-14 16:22:12.563178,"짧고 잔잔한 내용이였어요. 
",힐링돼요,3
12918596,dd*******,2024-01-14 08:04:36.618466,"생각보다 밝은내용은 아니었지만, 두고두고 곱씹으며 읽기 좋아요. 소설이 매우 짧다 생각했는데, 길게 풀어낼수도 있는것을 정제되고 절제된 언어로 표현해서 그렇구나 이해가 되었어요.  숨겨진은유가 많아 여러번읽어도 좋은 소설입니다",최고예요,4
12917966,yo*****,2024-01-14 00:40:24.959088,너무 좋은 책이에요,최고예요,4
12910722,se*****************,2024-01-12 22:48:06.759231,사소함에 묵직함이 있어요,최고예요,4
12909292,y2***,2024-01-12 18:59:13.219167,잘 읽었습니다 감사합니다,고마워요,4
12908300,si*****,2024-01-12 17:15:34.523453,기대됩니다. 이전 클레어 커건 책 잘읽었어요,공감돼요,4
12907093,ps*****,2024-01-12 15:17:39.885006,"키건의 작품은 한 문장, 한 문장을 정성스레 아껴 읽게 되는 묘한 힘이 있어요. <맡겨진 소녀>를 읽고 반가운 마음에 읽어 본 작품입니다. ",힐링돼요,4
12906625,ad********,2024-01-12 14:33:52.745336,"구매하고 아직 읽기 전인데
너무 설레네요",최고예요,4
12905309,my******,2024-01-12 11:32:10.487734,감사한 마음으로 잘 읽겠습니다,공감돼요,4
12904398,de*****,2024-01-12 09:39:07.17804,감동적입니다. 애써 모른척 하려했던 일들이 주마등처럼 스치고 지나갔습니다. 아름답고 군더더기 없는 소설이었습니다.,최고예요,4
12902814,ar****,2024-01-12 06:02:08.615742,"펄롱같은 용기는 없더라도
용기없음을 부끄러워는
할 줄 알자",최고예요,4
12901786,fb********,2024-01-12 00:48:30.603166,"여러 번 읽고 음미하라는 권유가 겹치는 이유를 알 것 같다.
호흡이 긴 것도 아니라 읽기에 수월하다.",재밌어요,4
12900589,gr********,2024-01-11 23:58:57.902998,기대되는 책인 것 같습니다.,고마워요,4
12899781,wl*********,2024-01-11 22:45:26.76957,읽는 내내 단어 하나 문장 한 줄이 잔잔히 와닿는 책,최고예요,4
12897813,wi*******,2024-01-11 17:57:17.010027,짧지만 강렬하게 읽었습니다. 배경지식을 알고나니 더 와닿는 내용이었어요. 소시민으로써 이상적인 결말이었습니다.,고마워요,4
12897334,wo******,2024-01-11 16:13:48.548286,자극적이거나 구체적인 묘사 없이도 끔찍한 기분과 동시에 희망과 극복을 노래하는 작가의 뛰어난 역량에 감탄했습니다.,힐링돼요,4
12895855,he*****,2024-01-11 10:13:46.268527,"맡겨진 소녀를 보고 너무 좋아진 작가다
이번책도 믿고 구입해본다",최고예요,4
12891978,ps********,2024-01-10 18:24:29.669437,리뷰가 좋아 기대됩니다. ,고마워요,4
12891738,rh********,2024-01-10 17:13:50.682904,사소한 마음이 절대 사소한 것이 아닌 때가 언젠가 옵니다. 그 순간을 잘 포착하는 공감가는 소설입니다.,재밌어요,4
12885230,va********,2024-01-09 19:08:50.327442,믿고 읽을만한 작가를 만났다.,공감돼요,4
12885056,so****,2024-01-09 18:33:03.593705,함축된 문장들의 힘.,최고예요,4
12881667,yj*******,2024-01-09 07:53:06.614233,재밌게 잘 봤습니다,고마워요,4
12875036,bl*****,2024-01-08 09:03:44.794849,"한마디로 ‘여운이 긴, 사회 고발 소설’이다. 부커상 후보 중 가장 짧은 소설이라고 하길래, 여운은 길겠다 싶어 읽기 시작했고 역시 그랬다. 영화로도 제작한다고 들었다.

땔감과 석탄을 파는 회사를 운영하는 빌 펄롱은 풍족한 삶은 아니지만 아내와 다섯 딸과 산다. 그런데 마을에는 수녀회가 운영하는 세탁소가 있고 그 세탁소에서 어린 여자아이들이 종일 일한다. 문제는 잘 먹지도 입지도 못하며 노동을 착취당하는 사실이다. 마을 사람들은 그 사실을 알면서도 쉬쉬한다. 마을의 학교와 교회에 그 수녀회의 영향력이 미치므로 어떤 식으로든 보복해 올 것이기 때문이다. 

빌 펄롱이 크리스마스를 앞두고 그 세탁소에 석탄 배달을 갔다가 한 아이를 발견한다. 마음이 짠해서 그 아이를 집으로 데리고 가면 어떨까, 생각한다. 결국 그 아이를 탈출시킨다. 그 동기는 그가 과거 고아였을 때 자신을 돌봐준 미시즈 윌슨 부인에 대한 기억이다. 그 부인이 보여준 ‘사소한 것들’을 기억하며 그 아이에게도 사소한 것을 주고 싶었을 것이다.

이처럼 이 소설은 사회 고발성 내용을 담고 있다. 그래서 저자 클레어 키건 작가는 첫 문장을 신중하게 썼다고 한다. 첫 문장은 이렇다.

“10월에 나무가 누레졌다. 그때 시계를 한 시간 뒤로 돌렸고 11월의 바람이 길게 불어와 잎을 뜯어내 나무를 벌거벗겼다.”

(책 속에서…)

바닥에서 기어다니며 걸레질을 해서 마루에 윤을 내던 아이들, 그 아이들의 모습 이 계속 생각났다. 또 수녀를 따라 예배당에서 나올 때 과수원에서 현관으로 이어지는 문이 안쪽에서 자물쇠로 잠겨 있었다는 사실, 수녀원과 그 옆 세인트마거릿 학교 사이에 있는 높은 담벼락 꼭대기에 깨진 유리 조각이 죽 박혀있다는 사실도 놀라웠다. 또 수녀가 석탄 대금을 치르러 잠깐 나오면서도 현관문을 열쇠로 잠그던 것도._53쪽

아이의 겁에 질린 시선이 사방으로 돌아가다가 잠시 펄롱과 마주친 다음 식탁과 접시 위 빵 부스러기로 떨어졌다._78쪽

펄롱은 미시즈 윌슨을, 그분이 날마다 보여준 친절을, 어떻게 펄롱을 가르치고 격려했는지를, 말이나 행동으로 하거나 하지 않은 사소한 것들을, 무얼 알았을지를 생각했다._120쪽",최고예요,4
12874302,sw******,2024-01-08 01:14:17.782811,소문듣고 구입합니다.기대돼요,고마워요,4
12872939,j2***,2024-01-07 21:58:52.989007,인기가 많은 이유가 있네요.,고마워요,4
12870870,sk********,2024-01-07 16:46:29.517061,얇고 잘읽혀요~ 베스트,최고예요,4
12869142,sw*****,2024-01-07 10:58:49.765031,올해 독서는 클레어키건으로 시작합니다,최고예요,4
12865650,se********,2024-01-06 20:21:36.081298,오랜만에 젛은 소설을 읽었습니다.,힐링돼요,4
12864089,ur******,2024-01-06 15:27:44.93734,잘 읽고 있어요   ,힐링돼요,4
12846505,ki********,2024-01-03 22:50:09.112174,"교보개새끼들아! 리뷰가 좋은것만 선택하면 무슨리뷰냐? 씹새끼들아! 더럽고, 역겹고, 가증스럽다 캬악ㅡ퉤",재밌어요,1
12846466,ki********,2024-01-03 22:46:42.801077,"리뷰가 개새끼들아!!  니들 좋은 것만 선택하면 무슨 리뷰냐!! 배송이 좆같이 왔는데! 돈 아낄려고 기존의 있던, 랩으로 진공포장하고 박스포장 없고, 뽁뽁이에 그냥 얇은박스 앞뒤로 덮어있네! 교보문고에서 주문하는 이유는 기존의 포장이 잘 되어 있어서, 배송이 좆같아도 감수하고 시키는건데, 개새끼들 하나의 장점을 버리네!  교보대표새끼가 돈처먹냐! 배송만 좆같았는데, 이제는 포장도 개좆같네 더러운개새끼들! 그리고 씹새끼들아 1월1일에 주문하고 한시간도 안되서 출고작업중으로 뜨는데, 너무 쓰레기짓거리 아니냐? 1월3일에 도착하는데, 환불, 반품 못하게 하려고 하는거잖아 개새키들아 그따위로 살지마라 씹새끼들아! 죄받는다! 교보문고 대표새끼 들었냐?? 너 들으라고 양아치새꺄!",재밌어요,1
12841445,ds********,2024-01-03 09:17:44.759111,여운 깊은 좋은 소설입니다,최고예요,4
12832074,DD****,2024-01-02 04:58:14.84274,책이 얇아 금방 읽혔어요 따뜻했습니다,재밌어요,3
12829752,fr*****,2024-01-01 21:37:15.629615,필로미나의 기적이라는 영화를 통해 아일랜드 수녀원에서 있었던 마음 아픈 일들을 키건의 담담한 필체로 인간 심성의 가능성을 다시 한번 느낄 수 있었다.,공감돼요,4
12823192,wi*******,2023-12-31 20:19:22.462135,"밀도높은 문장과 단어들의 나열, 연말에 읽으면 좋은 책",최고예요,4
12820847,tp*******,2023-12-31 10:08:01.565301,잘 읽었습니다 잔잔한 울림이 있는 책,재밌어요,4
12818690,du*****,2023-12-30 22:52:22.800147,아름답고명료하게실리적인소설,최고예요,4
12814031,sw******,2023-12-30 12:01:46.170895,소문듣고 구입함.기대됩니다,고마워요,4
12805851,rs****,2023-12-29 17:20:57.88315,결말은 예상이 되었지만 잠시나마 마음이 따뜻해진다.,힐링돼요,4
12805532,ek*****,2023-12-29 16:10:03.764952,짧지만 임팩트 있는 소설. 과연 내가 주인공이라면 그런 결정을 내릴 수 있었을까.,최고예요,4
12803648,na******,2023-12-29 09:48:01.559903,내 놓지고 살아간 삶의 순간들을 바라보게 한다,고마워요,4
12799459,tm********,2023-12-28 15:50:53.278948,어떤 내용이 있을지 궁금하네요.,고마워요,4
12799002,re*******,2023-12-28 14:40:50.732616,추천이 많아서 기대하고 있습니다,최고예요,4
12795086,ra****,2023-12-27 20:45:18.353897,잘봤어요~~~~~~,고마워요,4
12794552,na******,2023-12-27 19:26:22.037984,"멋지고 또 멋진 책입니다.
선물하려고 한 권 더 주문합니다.",최고예요,4
12793218,vi*****,2023-12-27 15:47:17.966941,"이처럼 사소한 것들에 대한 이야기입니다.
편안하게 읽을 수 있었어요",최고예요,4
12786140,eo*****,2023-12-26 14:21:27.014412,"단숨에 읽을만큼 짧지만 여운 있는 소설.

크리스마스를 열흘도 채 안 남긴 눈 오는 겨울날, 등 따신 곳에서 읽으니 마음 한구석 약간의 미안함과 이유 없는 죄책감이 일었어요.
주위를 둘러보고 살아야 하지 않을까. 펄롱이 말한 ""몸이 가볍고 당당한 느낌. 새롭고 새삼스럽고 뭔지 모를 기쁨이 솟는 기분"" 을 느껴볼 수 있을지.",공감돼요,4
12778784,pn*****,2023-12-25 10:10:19.435598,기대안했는데 잘 읽었어요.. 좋아요 ,최고예요,4
12771661,se********,2023-12-23 22:21:36.094968,다들 리뷰로 공감하는데 구매했습니다. 벌써부터 기대되네요.,힐링돼요,4
12771169,bl******,2023-12-23 21:25:15.175856,연말 선물로 보냈는데 좋아하네요^^,고마워요,4
12765497,lo********,2023-12-22 23:54:57.418919,추천받아 읽게 된 책인데 잘 읽었습니다,최고예요,4
12765024,lh*****,2023-12-22 23:23:35.50719,맡겨진 소녀에 이어 클레어 키건 작가님의 간결하지만 깊이 있는 글을 읽을 수 있어서 좋았습니다.,고마워요,4
12753671,cl********,2023-12-21 06:03:04.785913,짧지만 깊이 있는 책,재밌어요,4
12748931,so***,2023-12-20 10:24:08.152141,짧지만 재미있고 생각거리가 많아요,재밌어요,4
12748365,hj******,2023-12-20 07:00:31.067647,추운겨울 배송해주시느라 수고하셨습니다.,고마워요,4
12748319,ss****,2023-12-20 06:20:24.014579,작가의 섬세한 터치가 돋보이는 추천 작품임.,힐링돼요,4
12747937,kj*****,2023-12-20 01:03:18.986667,아름답고 명료한 소설,공감돼요,4
12742463,yj*******,2023-12-18 22:44:40.885107,"오늘 바로드림 픽업
내일 맘편히 쭉 읽어보겠습니다
믿고 보는 작가!",고마워요,4
12735958,ia******,2023-12-17 17:17:45.115842,섬세한 문체로 써내려간 아일랜드 이야기,힐링돼요,4
12727554,gu*****,2023-12-15 23:39:08.981083,제목이 확 땡겨서 구매했는뎅 유명하군요,최고예요,4
12727121,k0*******,2023-12-15 22:43:54.48862,"책을 다 읽고나서 다시 한단어, 한문장의 깊이를 되세겨보게 되네요.",공감돼요,4
12724755,ki*****,2023-12-15 14:34:11.721107,"짧지만 여운을 강하게 남기는 소설.  
소박하고 반복적인 삶을 살아가는 평범한 사람의 행동이 주는 감동이 있다. 
아일랜드 사람들의 삶을 잔잔하게 묘사해서 마치 영화처럼 눈에 그려지는것도 좋고 크리스마스를 마침 앞두고 있는데 소설의 시간적 배경과 맞아떨어져서 더 좋았던 독서경험. ",최고예요,4
12721785,ra****,2023-12-14 22:31:27.850945,아직 읽기전인데 기대되네요 ,고마워요,4
12721554,sh****,2023-12-14 22:05:56.735918,순식간에 다 읽었습니다. 다시 천천히 읽고 싶은 이야기입니다.,최고예요,4
12717209,my****,2023-12-14 00:46:41.358359,"100페이지 남짓한 작품이지만 소설 그 이상의 가치를 품고 있는 책입니다.
작가의 뛰어난 필력에 감탄하며 등장하는 인물, 묘사 , 배경 모두 하나 버릴 것이 없는 완벽한 작품입니다.",최고예요,4
12717075,su********,2023-12-14 00:10:40.847436,마음이 많이 아픕니다. ,최고예요,4
12715086,ri******,2023-12-13 18:40:10.124056,좋아요.       ,공감돼요,4
12708421,tj********,2023-12-12 17:04:28.602569,읽기 전이지만 기대하고 있습니다,고마워요,4
12706283,db********,2023-12-12 10:40:32.971697,맡겨진 소녀의 작가님의 책이라서 구입했습니다. 짦지만 마음에 오랜 여운을 주는 작가이신 듯합니다. ,최고예요,4
12706203,ch*******,2023-12-12 10:21:39.869891,잔잔하게 읽기 좋아요,고마워요,4
12699981,jk****,2023-12-11 07:42:03.961691,재밌어요 추천드려요,최고예요,4
12691275,lo*******,2023-12-09 17:05:40.495212,올 해 이 책을 읽는 기회를 놓치지 마시길...,재밌어요,4
12680321,hi*****,2023-12-07 23:49:04.156401,이제 펄롱은 과거에 머물지 않기로 했다.,최고예요,4
12674453,sm****,2023-12-06 22:03:02.696332,얇은 책자안에 녹아있는 작가의 감성이 전율로 다가옵니디. 맡겨진 소녀 이후 넘 좋은 책!,최고예요,4
