리뷰번호,회원ID,작성일시,리뷰내용,감정키워드,평점
11522916,yo****,2023-05-16 18:48:39.272044,"역사를 잊고 살아갈 순 없습니다.
정작 읽어야할 사람들은 안 읽는 것 같네요.",공감돼요,4
958238,da********,2016-05-11 23:48:22.686,"내가 태어나기 약 2년전 1980년 5월 광주에서 외치는 소리를 지금 2016년 5월에 듣는다. '기억해주세요' 라는 외침을...
내가 보지 못한걸 기억하기 위해 [소년이온다] 책을 펼쳤고, 영화 '화려한휴가'를 봤고, '솔아 솔아 푸르른 솔아' 음악을 들었다. 
내가 할 수 있는 일이라곤 기억해주는 것, 잊지 않는 것, 몇년이 흘렀지만 같이 분노해주고 슬퍼해주는 것, 이것 뿐이다. 
소설 속 표현처럼 '희생자가 되지 않기위해', 죽을 것을 뻔히 알면서도, 이기지 못할 것을 알면서도, 나몰라라 피하면 그만인 것을, 지은이 한강의 표현처럼 '인간이 무엇이지 않기 위해 무엇을 했던' 1980년 5.18 광주 민주화운동, 그들을 기억한다.

읽기 전 마음의 준비를 하고 읽는 것을 권한다. 문학평론가 신형철의 추천사 표현 처럼 '[소년이 온다]는 한강이 쓴 광주 이야기라면 읽는 쪽에서도 마음의 준비가 필요하겠다고 각오한 사람조차 휘정거리게 만든다'
5월이니까, 5월에 읽기 적합한 책이라 가볍게 선택하고 읽었는데 읽는 내내 마음이 불편했다. 광주를 다시 읽고 광주를 관광이 아닌 추모로 방문하고 싶다.",,4
958370,ea*****,2021-11-16 17:11:34.973,이 책을 읽기 전과 후의 저는 다른 사람인 것 같습니다,,4
14895256,wi*******************,2024-10-14 14:09:13.122682,"한강 작가의 노벨상 소식에 쾌재를 부를 수밖에 없던 이유는 혐오의 시대에서 인터넷에 팽배하는 호남 혐오와 페미니즘 혐오에 진저리 나있었기 때문이다.
광주의 숭고한 희생에서 비롯된 민주화에 감사함은 커녕 그저 조롱거리로만 일삼는 사람들이 무언가 잘못됨을 느끼길 바라고 또 바란다.
똑같은 역사가 반복되지 않길 바라며.",고마워요,4
14872945,ar******,2024-10-08 21:34:40.522838,"양장으로 나와서 소장용으로 샀어요 
이 글에 제가 뭐라고 리뷰를 달겠어요 누구나 한번은 꼭 읽어보셨으면 ",최고예요,4
958010,si*****,2021-11-16 09:54:33.5,역사를 알고 있어야  아픈 역사를 또 만들지 않을것이다..,공감돼요,4
957853,wj*******,2017-10-29 23:30:09.823,"한강 작가의 ""소년이 온다"" , 가슴이 먹먹해진다
광주의 80년 5.18 당시, 그리 멀지 않은 곳에 살고 있었는데,
무슨 일이 벌어지는 지를 어찌 이리 모를 수 있을까!

당시의 사건 속에 있었던 자들에게는
죽은 자나, 살아 남은 있는 자나... 결코 삶에서 고통만이 있다
그리고 역사는 늘 반복 되풀이 된다는 점에,
한계를 느낀다.

책 속에서,
""네가 죽은 뒤 장례식을 치르지 못해,
내 삶이 장례식이 되었다.
용서할 수 없는 물줄기가 분수대에서 뿜어져나온 뒤에, 어디서나 사원의 불빛이 타고 있었다.
봄에 피는 꽃들 속에, 눈송이들 속에, 날마다 찾아오는 저녁들 속에, 다 쓴 음료수 병에 네가 꽂은 양초 불꽃들이...""",공감돼요,4
958296,ki******,2017-06-27 17:47:26.256,"그때 그 시절 그 참혹했던 역사속에서 죄가 없던 사람들의 이름과 애국가 소리가 마음 속 깊숙히에서 절절히 울려 퍼진다 살아남은 자들은 무엇을 위해 살아남았고 죽은 자들은 무엇을 위해 죽었나, 책을 읽으면 알 수 있을 것 같다. 광주의 그 며칠간의 날들은 모든 이에게 아픈 시간이라는 걸.",공감돼요,4
958027,mh****,2017-10-21 02:49:50.216,읽고나서 늪속에 빠진 기분이였어요.너무도 좋은책이에요,고마워요,4
14879605,qk********,2024-10-10 21:49:24.230152,"다시 읽어보려고 주문합니다
수상 축하드려요!",고마워요,4
958025,do*****,2022-01-18 10:28:48.74,잊지 말아야 할 역사,고마워요,4
14883250,sh*******,2024-10-11 17:32:19.973645,이 책을 지난달에 구매한 나 자신을 칭찬합니다 ㅎㅎ,고마워요,4
14443737,se******,2024-08-22 12:01:41.729759,민주주의와 자유는 피로 성취한것,고마워요,4
958363,du********,2022-01-09 23:08:55.613,페이지를 넘기는 매 순간이 마음 아프지만 그래도 더 많은 사람들이 읽었으면,고마워요,4
14881375,eu******,2024-10-11 10:23:52.912998,한강 작가님이 노벨문학상 후보에 오르셨다는 소식을 접하고 책을 구매했는데 상을 받게 되셨다는 소식까지 들어사 너무 기쁘네요! ,최고예요,4
14896996,jj*****,2024-10-14 22:19:56.022454,세계에 518의 참상을 알려주셔서 감사합니다.,최고예요,4
958279,hw*****,2016-07-24 09:50:38.903,돌아오지 않는 그 여름과 당신,,4
14685412,bu*******,2024-09-22 00:58:59.940298,"역시 유명 작가의 글은 다르네요.
일반 소설 책에서는 볼 수없는 범상함에 감탄사가 절로 나왔습니다. 누구나 알고 있는 5.18 얘기를 이렇게 다른 시선으로 홀릴수 있나요?",최고예요,4
14919372,ih*****,2024-10-20 13:16:56.077585,"우선 소년이 온다는 5•18광주화민주화운동 배경으로 하고 있다.

주인공, 등장인물이 배경을 나열하지 않는다.  짧막하게 그 상황을 나열하고 있다.

상상력을 요구하지 않고 그때 모습 그대로 묘사하고 있다.

극 사실주의처럼 사진처럼 그 모습이 떠오른다.

은유법보다는 섬세한 표현으로 직유법으로 묘사했으며 역사적 관점을 대중들이 평가 하도록 유도하였다.

내가 태어나기 거의 1년전 신군부가 세력을 장악하기 위해  계엄령을 선포하고 공수부대를 광주에 투입하여 민주화 운동을 하는 시민들을 무참히 학살하였다.
내가 처음 배웠을때는 광주사태로 배웠었다.

그리고 문민정부가 들어와서 5'18광주 민주화 운동으로 바뀌었다.
예전 기억을 떠오르면 국사시간에 현대사를 자세히 다루지 않았었다. 그리고 한줄로 끝나는 경우가 많았는데 그때 선생님이 하신 말이 아직까지 떠오른다. 역사의 평가는 바뀐다. 너희들이 역사를 제대로 알고 있어야 나라가 바뀐다고는 말을 하셨던게 기억난다.

아마 한강 작가도 대중들에게 그때 상황을 스스로 대중들이 파헤쳐보길 원하지 않았을까? 

그래서 상황을 작가의 생각대로 표현하기 보다 한 템포 쉬어가며 생각하게 만든다.

그리고 역사적 사실을 나열한것이 아니라 인간의 본성에 대해 의구심을 자극한다.

P95에는 군중의 인문서을 인용하는 내용이 나온다.
군중의 도덕성을 결정...

내가 생각하는 인류문명은 전쟁이다.
현재 인류사에서 제일 평화로운 시기이지만 사실 러우전쟁, 중동전쟁은 계속 되고 있다.
전쟁속에 인간의 폭력성은 극한으로 보이고 도덕적 모순이 나타난다.
그래서 철학자는 인간의 본성에 대해 탐구하였고 이것을 인간의 인성론이라 분류한다.
성선설, 성악설,성무선악설

인류사를 보면 항상 인간은 전쟁을 한다.
지금 전쟁을 봐도 그들의 가치관으로 당연한 참이고  국민의 고통은 당연한것이다.

냉전시기.... 
우리나라는 베트남에 참전해서 그곳에서 많은 학살을 하였다. 하지만 대한민국은 그들에게 보상을 하였는가? 

반면 일제강점기때 일본은 학살은 자행하고 위안부, 강제 징용을 회피하고 사과조차 하지 않느며 야스쿠니 신사에 계속 참배하고 있다.

계속 광기어린 역사는 반복 되고 인간은 집단적으로 광기에 몰려있으면 학살을 즐긴다.

분명 처음부터 학살을 즐기지 않았을것이다. 그들도 도덕적 가치로 인하여 딜레마로 고민했을것이다. 하지만  어느순간 광기는 정의가 된다.
쇼펜하우어는 인간을 욕망덩어리라고 말한다.
그래서 인가?
지구상의 생물중 동족을 살해하고 스스로 자해하는 것은 인간밖에 없다.
과연 인간은 선한것인가? 악한것인가? 아님 환경에 의해 그들은 변화되는 것인가?

분명 총구를 겨누고 있지만 그들은 누군가의 사랑하는 자녀이고 부모님이고 형제이다.
명령을 한 사람도 명령을 시행하는 사람도 인간이다.

인간의 본질을 또 생각하며  욕망의 휩싸인 난 분명 그 상황에 오면 그들과 같아질 것이다.

책 후반부로 가면 PTSD를 겪는 그들의 삶을 표현한다. 안정제와 수면제, 술이 없으면 살수 없는 삶...

그리고 잊혀가는 역사시점에서 그들만이 잊혀지지 않고 또렷해진다.

삶을 버티려는자와 포기하는자...

마무리하면 소년은 온다는 역사적 사실과 인간의 본성에 대해 대중들이 사고할 수 있도록 하였다. 역사적 사실 속에 인간의 이중성과 폭력성, 잔인함을 고스라니 표현하고 있다.

로크가 만인의 만인에 대한 투쟁이라고 하듯이... 우리는 욕망을 쟁취하기 위해 투쟁하고 다시 반복적으로 같은 일을 반복하고 있다. 

다만 잊혀지지 않도록 우리는 역사적 사실을 그대로 남겨야 한다.
그리고 평가는 후대의 몫이다. 바로 이것이 역사인것이다.",최고예요,4
13145116,ev***************,2024-02-16 21:31:30.245195,읽으면서 펑펑 운 소설입니다 정말 추천해요,최고예요,4
14551536,yj*******,2024-09-04 01:30:15.889403,"우선 표지가 너무 아름다워요
읽다가 도무지 가슴이 먹먹해서 가슴치고
화가나서 가슴치고
중간에 멈추고
심호흡을 몇번이나 했는지 모르겠어요
가슴치며 완독 했습니다
두번 읽기는 힘들것같아요..",고마워요,4
957902,so********,2019-08-09 12:41:37.126,한강 작가 글은 ..모두 좋습니다. 특히 이 책은 더 강렬하네요..,고마워요,4
958259,li*****,2016-02-21 21:00:20.963,"추천합니다
한강 작품중 가장 좋아요",,4
14333854,db*******,2024-08-05 17:40:31.52812,한국인이라면 꼭 읽어봐야 하는 책,고마워요,4
15086631,ea********,2024-12-04 03:19:07.535402,여러분 오늘을 기억하셔야 합니다. 우리가 이 이야기를 잊었을 때 어떤 일이 반복될 수 있는지 오늘 우린 그 무서운 가능성을 봤습니다. 잊지 말아주세요.,공감돼요,4
14895788,ss*******,2024-10-14 16:14:55.616141,"한강 작가님의 수상이 있기 전, 남자친구에게 이 책을 선물해주었습니다. 어제 앉은 자리에서 다 읽고 '울컥하면서 가슴이 너무 답답하고 체한 느낌이 든다'는 평을 들려주며 한동안 여운에 잠긴 모습을 보여주었습니다.",최고예요,4
15088746,gk*****,2024-12-04 20:12:11.312235,"슬프고 저릿합니다
이 책 내용이 반복되질 않길 바랐는데 1203 비상계엄이 선포됐네요. 다행히 빠르게 해제됐지만 민주주의는 항시 감시하지 않으면 원복되는구나 싶습니다. 이 시국에 적합한 책 추천해요",고마워요,4
15088413,kh****,2024-12-04 17:49:56.167505,2024년 12월 3일 이후로 또 다른 의미를 갖게 된 책. 더욱 더 많은 사람들이 읽었으면 좋겠다.,고마워요,4
14901762,ar****************,2024-10-16 01:53:07.454303,"오늘 소년이 온다를 끝까지 다 읽기 직전에 갑작스레 눈물이 터져나와서 두 눈을 손으로 꾹 누르다가 오열을 했어요. 전형적인 T인데 당황스러웠습니다.
가슴이 뭉개지듯 아프고 저려 한참 진정이 안되었어요.
이 눈물의 이유를 알 것 같습니다.
정말로 일어났던 끔찍한 비극이라는 것이 계속 눈물을 쏟아내게 한 것 같아요. 읽는 입장이 이런데 이런 글을 쓰신 작가님은 얼마나 극한까지 괴로우셨을까요 아니
동호는 정대남매는 은숙이는 진수는 선주는 그리고 그 가족들은 얼마나.. 아팠을까요.
채 몰랐어서 죄스럽습니다. 그간 알던 얄팍한 지식과 상식이 얼마나 몰이해 했는지 대충이었는지

채식주의자를 두번 읽고 피폐함에 힘들어 그동안 작가님 글을 미뤄 둔 것이 후회가 들었습니다.

이 책을 읽게 해주셔서 진심으로 감사 드립니다.",고마워요,4
13959539,wh******,2024-06-12 16:20:12.202655,이제 우리가 이끌어 나갑시다.,공감돼요,4
14889589,wi********,2024-10-13 07:53:39.602432,꼭 한번 읽어 보고싶은 책이었습니다.,최고예요,4
14464178,Ju**************,2024-08-25 01:59:56.017857,한 강 작가님 덕분에 다시 한 번 그 분들께 감사하는 마음과 역사를 잊어서는 안 된다는 생각을 깊이 새기게 되었습니다.,고마워요,4
14887901,sj*****,2024-10-12 18:47:09.47052,"문학상 수상 소식 듣고 바로 주문해서 오늘 받아서 읽고있네요.
챕터2...와... 작가님이 왜 수상을 했는지 알것 같네요.",최고예요,4
14906488,03******,2024-10-17 09:36:16.801345,노벨문학상 작품을 번역본이 아니 자국의 언어로 된 작품을 읽을 수 있다는 것이 신기방기 합니자.,최고예요,4
14880735,og******,2024-10-11 08:25:11.763733,작품 내용 넘 슬프지만 감동,최고예요,4
14909118,bo****,2024-10-17 22:35:11.676603,재고 딸려서 재판 해야되면 그렇다 메세지를 주든가....지금 들어와보니 어쩌고 멘트 위에 써있네....장난 똥때리나 하....,고마워요,1
14908941,rh********,2024-10-17 21:23:00.9355,"5.18 민주화 운동 안에 담긴 잔혹하고도 아려오는 이야기. 각자의 시선과 환경에서 바라본 5.18을 고요하고 어쩌면 담담한 어조로 표현해내고 있다. 그 어조 안에 담긴 고통은 감히 헤아릴 수 없을 것 같다. 국가에 의해서 목숨을 잃은 사람들에게 태극기를 덮어주는 장면을 동호는 이해하지 못하는데, 나는 국가를 위해서, 평화를 위해서 목소리를 내는 사람이 바로 국가인 것이라고 생각해서 덮어주는 것으로 이해했다.  국가의 명령을 받고 국민들을, 올바른 것을 파괴하는 사람들은 국가라고 부를 수 없다. 
이 책을 읽기 전에는 더욱 시위의 폭력 진압 현장을 격하게 그려내셨을 것이라고 예상했는데, 그러한 장면보다 한 개인의 시선에서 바라본 장면이 주를 이루었기에 아픔에 더 구체적이고 생생하게 공감하고 슬퍼했던 것 같다. 

인간이란 무엇인가? 어느 온전하고 평화로운 것을 지켜내기 위해 목소리를 내는 사람도 인간이지만, 그러한 것은 어리석은 것이라며 파괴하고 목숨을 잔인하게 빼앗는 사람도 인간이다.
인간 어딘가에 있는 기저에 대해 깊게 생각해볼 수 있는 책이었다",고마워요,4
958187,ca*******,2017-11-01 01:07:25.67,첫문장부터 빠져들어요,고마워요,4
14899862,na*****,2024-10-15 17:45:31.494701,"축하드리고 고맙고 고맙습니다.
노벨문학상 작품을 
한글로 읽 수 있다는것에
감사드리고🙏
광주의 아픔을 위로해 주심에 감사드리고🙏
다시한번 축하합니다🥳",고마워요,4
14896568,so****,2024-10-14 20:47:39.834221,다시는 이 땅에 이런 비극이 일어나지 않기를.,공감돼요,4
15337716,hu*******,2025-02-05 16:00:57.275429,"이를 꽉 물고 읽어야 하는 책...읽는 내내 마음이 아프고 내가 편안한 곳에서 책을 읽고 있다는 현실이 미안하고 불편하게 한다.
무모하다는 걸 알면서도 사람들은 무얼 지키고 싶었던 걸까...왜 그래야 했던 걸까?를 생각하게 한다....아직 그 답을 찾지는 못했지만...계속 생각의 꼬리를 물게하는 책. 한강 작가님 감사합니다.",공감돼요,4
15089742,dr******,2024-12-05 00:12:50.60127,"한강 작가에게, 1980년의 광주에게 큰 빚을 졌습니다. 부디 나도 그 빚을 갚을 수 있는 용기를 낼 수 있기를.",고마워요,4
14907630,h8****,2024-10-17 15:10:49.867633,이제 당신이 나를 이끌고 가기를 바랍니다. 당신이 나를 밝은 쪽으로 빛이 비치는 쪽으로 꽃이 핀 쪽으로 끌고 가기를 바랍니다. 본문 내용중...맘 아픈 구절입니다. 많은 분들이 함께 읽어보고 공유했으면 합니다. 강력추천 합니다.,최고예요,4
14904163,na*******,2024-10-16 16:35:06.710442,서점에 딱 한권 남아있는 거 집어 왔습니다. 뭔가 러키비키구나 싶어 기분 좋았습니다 ㅎㅎ장마다 화자가 달라서 다 읽고 나서 다시 첫장을 읽어보니 처음 읽을때와 느낌이 다르네요. 소년이 저에게로도 온 거 같아요,고마워요,4
14899561,hj*******,2024-10-15 16:15:48.20319,노벨상에 가장 큰 공헌을 한 작품이라고 생각합니다,최고예요,4
14898517,ye*****,2024-10-15 12:00:08.804069,읽기가 마음이 좀 힘들지만 흡입력이 굉장하네요,최고예요,4
14898077,ss*****,2024-10-15 09:57:10.533572,읽어보고 싶은 도서라 구입했어요. ,고마워요,4
15083933,ye********,2024-12-03 11:25:41.734483,"언제부턴가 518관련 작품들은 고통스러워 피하곤 했는데, 의무감으로 구매하였네요. 역사의 희생자분들과 작가님께 감사드립니다.",최고예요,4
15055361,re*****,2024-11-25 00:43:12.829982,"그 때의 그들이... 군인들이 독일의 나지들과 일제시대의 일본군과 다를게 뭐가 있을까요?
전씨는 죽을 때까지 잘 먹고 잘살다 천수를 누리고 살다 죽어서도 국립묘지에 묻히려고까지 한다는 기사를 봤는데 아직도 국립묘지에 넣고자 그의 가족들은 기다리고 있나요?
그 시절 저는 서울에서 국민학교를 다니고 연관된 친척도 없는데도 책을 읽고 기사를 보는 것 만으로도 이렇게 슬픔이 밀려와 어찌할바를 모르겠는데 그 때 그 고통을 격은 분들과 가족들은 오죽할까요.......
지금의 시국에서는 아차하는 순간 그 때의 그 상황으로 가는건 한 순간 일 것이라는 생각이 듭니다.
박근혜 때는 너무 어이가 없어서 뭐 저렇게도 무능, 무지할까 했는데, 지금의 정부는 전쟁을 일으킬까봐 무섭습니다. 일본에  헐값에 넘길까봐 무섭습니다.",공감돼요,4
15046103,c0********,2024-11-22 09:09:22.910983,"첫장 넘기기가 두려웠지만 한번에  쓱 다 읽혔습니다.
동호야...그날  저녁 계속 마음에 메아리쳤어요.",최고예요,4
14890727,ji*****,2024-10-13 13:12:09.351643,노벨문학상 수상을 진심으로 축하합니다.,최고예요,4
14886695,kj******,2024-10-12 13:34:20.961591,한강 작가 노벨문학상 수상축하합니다.,고마워요,4
14883036,da********,2024-10-11 16:22:36.821003,받으면 잘 볼게요 노벨문학상 축하드립니다,최고예요,4
14412580,tj******,2024-08-17 20:51:24.89709,10주년 특별판 좋아요,최고예요,4
11490864,fi*****,2023-05-09 23:35:07.746116,역시나 정말 좋은책입니다,최고예요,4
958175,vi********,2017-10-23 14:35:57.27,왠지 읽어보고 싶은 책이라서 구입했는데 꼭 읽어봐야되는 책이 됐어요!,공감돼요,4
15555911,93*************,2025-03-22 11:43:16.456612,"80년 5월의 광주.
그 참상과 트라우마.
이 역사를 모독하는 자들에게 저주를",최고예요,4
15218011,lo***,2025-01-06 22:36:34.566808,"이책을 읽고 계엄으로 인한 무고한 생명이 희생됨에 가슴이 너무 아픈데 현실에서 계엄이란걸 겪게되다니 소름돋을지경이다.
5.18그당시 우리의 소년들 얼마나 아팠을까 감사한마음으로 민주주의를 지키며 살자.",고마워요,4
15202358,bi*****,2025-01-03 13:32:30.56278,"인간은 어떻게 이토록 폭력적인가? 동시에 인간은 어떻게 그토록 압도적인 폭력의 반대편에 설 수 있는가?

한강 작가님의 의문들이, 이제는 저의 의문들이 되었습니다. 근 한 달, 유난히 시린 겨울이었습니다. 나와 관계 없다고 생각했던 과거의 일들이 다시 일어나고, 가슴 아픈 비극들이 연이어 발생했습니다. 하지만 그들을 도우려는 사람들이 있었기에 다시 한 번 의문에 가로 막힙니다. 어떻게 힘 없는 사람이, 그토록 압도적인 폭력에 대항할 수 있는 겁니까? 사리사욕에 눈이 먼 자들은 폭력에 몸을 기대어 눈과 귀를 막는데, 아무것도 없는 자들이 폭력의 반대편에 서 있습니다. 책을 읽고 3개월이 흐르고, 여의도에서 추운 겨울을 보냈음에도 아직 답을 찾지 못했습니다. 나조차 아무런 힘이 없고 폭력에 반대하면서도 답을 모릅니다. 앞으로의 삶은 이 답을 찾아가는 데 목적을 두어야 할 것 같습니다.

뼛속까지 공대생이라 문학작품은 거들떠도 안 봤는데, 한강 작가님 덕분에 접할 수 있었네요. 감사합니다.",고마워요,4
15200357,so******,2025-01-02 22:53:14.608025,과거가 현재를 돕는다,공감돼요,4
15198805,je*****,2025-01-02 17:16:23.443618,"국격을 높혀준 한강작가님 감사합니다.

읽어야지 읽어야지 하다가 시국이 시국이라 아플 마음을 각오 하고 읽었습니다.
그날 그곳의 아픔이 내 아픔이 되고, 내 주변의 아픔이 되어 더욱 마음이 아려옵니다.
그때의 그 공포와 아픔이 다시는 일어나지 않길 모두가 노력해야 합니다. ",고마워요,4
15196410,se*******,2025-01-02 01:16:19.790413,광주에게 참 많은 빚을 졌습니다 우리가,고마워요,4
15194913,re*********,2025-01-01 20:39:47.4602,픽션이 아닌 아픈 우리의 역사를 쓴 소설을 보자니 마음이 우울해져 미루고 미루다 2024년이 가기전에 읽어야겠단 다짐으로 어제 겨우 책을 다 읽었습니다 4시간 남짓을 슬프고 화나고 무너지는 마음을 가까스로 달랬습니다 과거가 현재를 도울 수 있을까? 죽은 자가 산 자를 구할 수 있는가? 1980년의 광주는 2024년의 우리를 도왔고 광주에서 숱하게 스러져간 이들이 오늘날 우리를 구하고 있음을 다시 한번 느낄 수 있는 시간이었습니다,최고예요,4
15180124,mj*******,2024-12-29 09:32:18.083729,"양심.
그래요, 양심.
세상에서 제일 무서운 게 그겁니다. ",고마워요,4
15179984,yg****,2024-12-29 08:59:23.020919,너무 슬프고 현 시국에서 많은 생각을 하게 하는 책입니다,최고예요,4
15163292,en*******,2024-12-24 23:58:32.666607,"죽은자가 산자를 살릴수 있는가?
네, 남태령의 기적을 보았습니다. 소년은 응원봉을 든 수많은 소녀들이 되어 다시 나타났습니다.
추운 밤, 수많은 별들이 남태령에 내려와 반짝였습니다.",최고예요,4
15161215,ko******,2024-12-24 16:18:11.764648,2024 년 말미의 어이없는 사건으로 더 집중해서 2 독하게 됩니다. 역사속 안타까운 희생자들을 애도하는 마음 모아모아 탄!핵!,공감돼요,4
15130544,do***************,2024-12-16 15:13:18.099861,5월의 광주 고립된 도시에서 얼마나 무서웠을지 감히 상상조차 하기 힘들었다. 책을 읽다가 여러 번 덮게 되었지만 그럼에도 다시 열어 끝까지 읽은 책. 죽은 자는 산 자를 도왔다. 그해 광주를 잊지 않을 것이다. ,고마워요,4
15117592,wh********,2024-12-12 22:02:33.924926,이런 시국에 띡 읽어야겠네요!,최고예요,4
15108829,gg********,2024-12-10 15:51:00.684771,너무 재밌게 읽었어요,최고예요,4
15108739,pa***,2024-12-10 15:29:21.541319,깊은 울림과 함께 역사적 아픔을 다시금 되새기게 만든다.,고마워요,4
15108267,kd******,2024-12-10 13:11:01.746893,내인생 첫 선물한책,최고예요,4
15085206,tm********,2024-12-03 18:31:46.396483,그냥 고맙습니다  ,고마워요,4
15084347,cy*****,2024-12-03 14:18:28.0037,오열하면서 읽음........,최고예요,4
15084272,wo******************,2024-12-03 14:04:07.511648,배송은 느렸지만 한강작가님 책을 접할 수 있어서 좋았습니다.,고마워요,4
15051653,ja*******************,2024-11-23 21:38:00.081192,"한국 최초로 노벨 문학상을 받았다는 소식을 듣고 선택하여 읽기 시작했습니다.
역시 상 받은 작품은 난해하다는 얘기가 맞는 것 같습니다.
그 시대에 살지 않은 사람으로서 많은 생각을 하게 하는 작품인 듯 합니다.",재밌어요,4
15047219,cy*****,2024-11-22 14:54:51.164302,"1980년 5월과 광주는 시공간적으로 함께하지는 못했지만, 이 책을 읽고 나니 그 당시의 잔혹한 상황과 그 당시 사람들의 울부짖음에 더 가까이 다가간 느낌이다. 작가의 상상력과 생생함이 전달되는 특유의 서사 방식 덕분이다. 한국전쟁을 직접 경험하지 못한 세대들이 전쟁의 참혹함에 대한 온도 차이가 있듯, 광주도 마찬가지일 것이다.  하지만, 기성세대의 책임은 그들의 앞 세대가 되었든 그들이 되었건 잘못된 역사가 되풀이 되지 않도록 끊임없이 자신을 반성하고, 다음 세대에게 진실을 왜곡됨 없이 전해주는 것이다. 소년이 온다처럼.... ",공감돼요,4
14987657,sj*****,2024-11-06 08:42:00.029553,뉴스에서 제대로 보도되지 않은 당시의 광주를 생각해 본다,최고예요,4
