리뷰번호,회원ID,작성일시,리뷰내용,감정키워드,평점
14241140,ca********,2024-07-24 06:52:28.282819,"유시민의
인사이트!",도움돼요,4
14241138,ca********,2024-07-24 06:52:04.194401,유시민의 인사이트!,도움돼요,4
14238595,co*****,2024-07-23 20:28:22.933478,"좋아하는 작가의 책을 접하게 되어 기대가 됩니다
잠시 읽어보면서 통찰력에 끄덕여지네요
",추천해요,4
14238203,xo******,2024-07-23 19:01:43.206248,"아직 읽기 전 이지만 기대됩니다.
열심히 읽을께요",집중돼요,3
14236321,le********,2024-07-23 11:06:33.160296,"재밋게 읽고 비평의 방법과 논리에 대해
잘 알게 되었네요",도움돼요,4
14234347,el******,2024-07-22 22:51:41.714254,너무좋네요 내용도 알차게 구성되어있습니다,도움돼요,4
14233461,le********,2024-07-22 20:11:33.656721,재미있게 잘 보고 있어요 ,추천해요,4
14232542,nl*******,2024-07-22 17:18:45.456801,"하하하, 역시 글쟁이다움이 묻어나네요. 간만에 시원 시원한 글을 읽었습니다. 말씀주신 참여의
일환으로 이 책을 주변에 권합니다. 병든 시기에 결단의
글을 남겨줘서 감사합니다.",최고예요,4
14232429,ju********,2024-07-22 17:03:08.908553,언론의 실체에 대해 수준 높은 이해를 돕는 완벽한 책,최고예요,4
14232427,le*****,2024-07-22 17:02:04.882008,욕한마디로 정의해야할 인간에 대한 유작가님의 고급진 해석,추천해요,4
14230586,yy*****,2024-07-22 12:46:18.792995,우리나라 정치현황에 대한 막힘없는 설명이 통쾌하게 느껴짐.,최고예요,4
14230234,ps******,2024-07-22 12:07:11.534826,양쪽의 혼란스럽던 생각이 명료하게 정리되요,도움돼요,4
14229711,sa*******,2024-07-22 10:13:24.515257,"누군가 한번쯤은 속으로 생각하고 뱉지 못한 생각들을 정리해주시니 글들이 살아움직이는 것 같습니다 지식이 얕아서 이해하기 어려운 부분도 있지만 마음이 움찔거리네요
추천합니다",추천해요,4
14226419,ac******,2024-07-21 20:09:17.335569,현재 정치상황을 설명한 책으로 보입니다.,추천해요,4
14224898,sn******,2024-07-21 16:16:04.989702,유시민 작가님 책은 믿고 구매합니다!,추천해요,4
14222595,ni*******,2024-07-21 08:45:22.081135,좋아요~좋아~~~^^,최고예요,4
14220304,ds*****,2024-07-20 23:12:46.145727,어쩌다 고등학생 때 거꾸로 읽는 세계사를 보다가 지금도 유시민 이야기를 듣는다. 유시민의 호불호를 떠나 그의 능력이 부럽다. 하고 싶은 삶을 수익으로 창출하는 유일한 분,집중돼요,4
14219179,ch********,2024-07-20 21:42:38.543893,그의 운명에 대한 같은 생각입니다.,최고예요,4
14218103,ku********,2024-07-20 19:10:14.605921,유명한 책 잘 읽었습니다.,집중돼요,4
14215367,ky*****,2024-07-20 12:06:19.044702,병든 대한민국에 대한 개인적인 생각 잘봤습티다.,집중돼요,4
14213938,an****,2024-07-20 08:18:09.091914,모두 읽어야될 책입니다 ,도움돼요,4
14211979,na*****,2024-07-19 23:16:46.705368,기대됩니다 기대됩니다 ,쉬웠어요,4
14208377,hw***************,2024-07-19 12:39:13.461624,윤석열 정부의 문제를 생각해보고 유권자로서 역할을 다시한번 곱씹어볼수있는 책,쉬웠어요,4
14207748,yj*****,2024-07-19 10:32:49.916475,재밌게 잘 읽었습니다. ,쉬웠어요,4
14207563,ki****,2024-07-19 10:12:43.986059,"비 오는 날, 그냥 읽어 보셨으면 합니다.",집중돼요,4
14202801,so*******,2024-07-18 16:20:55.583709,요즘의 이 사태를 이해하는데 도움이 많이 됩니다,집중돼요,4
14202586,hy****,2024-07-18 15:39:21.732244,"현실 공부를 한것같아 좋았어요 
",최고예요,4
14202472,su*******,2024-07-18 15:08:58.399706,딱 요즘 읽어야할 책,집중돼요,4
14202441,su*******,2024-07-18 14:55:00.337325,딱 요즘 읽어야할 책,집중돼요,4
14201970,pu********,2024-07-18 13:01:29.695799,"뉴스나 라디오, 유튜브 등 미디어를 볼 때마다 숱하게 보고 듣는 믿을 수 없는 현실이 이해가 되지 않아서 이 책을 샀습니다. 머릿속을 가슴 언저리를 답답하게 하던 수많은 생각들이 한결 정리가 되었습니다. 현실이 너무 비현실 같아서 화가 나고 짜증이 나는 감정에만 머물러 있었는데 이 책을 읽고 현 상황에서도 배울점은 분명히 있다고 생각했습니다. 우리 인생에서도 답답하고 힘든 일이 있어도 방법을 찾아 앞으로 나아가듯이, 지금도 같은 실수를 하지 않도록 다 함께 연대하여 방법을 찾아야겠죠. 우리는 힘들고 어려운 시기를 늘 지혜롭게 잘 해결해 왔으니 이번에도 현명하게 해쳐 나가리라 믿어봅니다.",도움돼요,4
14197012,oz*****,2024-07-17 17:10:27.288907,쉬운 단어로 간단명료하게 쓰여진 문장이 읽기에 부담이 없다.,추천해요,4
14192210,ko******,2024-07-16 21:53:13.677391,대단한 내공을 다시한번 확인할수 있었다. 왜 유시민인지 고개가 끄덕여진다. 강력추천!,최고예요,4
14191871,sa******,2024-07-16 20:56:01.926553,많은 사람들이 읽었으면 좋겠습니다. ,최고예요,4
14190390,ni*****,2024-07-16 16:32:41.708119,조아요 괜찮아요 도움돼요 ,추천해요,4
14189906,mn****,2024-07-16 14:52:09.760458,매불쇼 수요난장판을 보는듯 했습니다.  ^^ 5번의 작가님 출연 회차가 영상 순위 1위부터 5위를 차지한 것은 다 이유가 있는듯..,쉬웠어요,4
14189815,wl******,2024-07-16 14:30:38.203017,"또 다른 시각으로 현 상황을 이해하는데 도움이 되었어요.
보면서 다양한 감정이 들었고, 좀 더 나은 대한민국이 되었으면 좋겠다는
생각을 함.",최고예요,4
14189074,di********,2024-07-16 12:05:40.433521,논리있는 글이었습니다,집중돼요,4
14188211,he*****,2024-07-16 07:47:07.157416,유시민이 있어 너무 감사합니다ㅠㅠ,최고예요,4
14188103,cw*****,2024-07-16 06:34:05.513408,유시민이 유시민했네요^^,최고예요,4
14185184,hu***,2024-07-15 21:02:53.984127,현상황을 직시하고 대안과 그 이유를 깔끔하게 정리한 책!!,최고예요,4
14183755,qg****,2024-07-15 16:32:13.809716,lss sljs plan dkzkksjsn,도움돼요,4
14181901,sh********,2024-07-15 11:05:28.539628,필체는 가벼우면서도 내용은 무겁습니다. 시대를 사는 사람으로 적극 추천 드립니다. ,추천해요,4
14181608,38****,2024-07-15 09:54:48.774728,작금의 시대가 문제라는 인식을 공유하고 잇다면 읽어보고 그의 운명과 대한민국의 미래를 이야기하기 딱 좋은 책입니다.,추천해요,4
14181438,sa*****,2024-07-15 09:02:26.421156,역시 유시민작가입니다,최고예요,4
14180731,li***,2024-07-15 00:24:07.174135,여러가지 재밌는걸 알게되네요,추천해요,4
14177337,jy******,2024-07-14 18:36:09.596053,다시 바로잡는데 조금이라도 힘을 보태고자 구입했습니다. ,최고예요,4
14176756,zx********,2024-07-14 16:18:58.50224,감사합니다 잘 읽었어요,집중돼요,4
14176464,ru******,2024-07-14 15:01:52.556982,유시민 작가님 좋아하시는분께는 추천합니다,추천해요,4
14176305,ru******,2024-07-14 14:36:26.853528,더운 여름 답답한 시기. 추천합니다ㅋ,추천해요,4
14175575,ju******,2024-07-14 12:21:15.757353,역시 유시민의 글은 명문입니다.,최고예요,4
14175091,pe***,2024-07-14 10:20:54.439739,답답한 시대에 대한 유시민 작가의 통찰과 조언. 진심 마음의 위로를 받습니다. ,최고예요,4
14174912,re*****,2024-07-14 09:15:49.049626,2024년 대한민국 주권자가 꼭 읽어야할 책입니다.,추천해요,4
14173976,ch********,2024-07-14 00:28:07.078036,"스트레스 받지말고, 어울리지 않는 자리에 있는 자는 끌어내리면 됩니다~^^",최고예요,4
14171438,ye*******,2024-07-13 21:11:02.808071,그의 탄핵을 애타게 바라며 읽고 또 읽습니다. 탄핵이 되는 날까지 필사라도 하고 싶네요! ,추천해요,4
14170724,ku******,2024-07-13 19:20:41.566867,추천합니다. 융석열을 이해할 수 있는 아주 좋은 책입니다,최고예요,4
14170129,mo********,2024-07-13 16:34:50.521577,"현재 대한민국에서 이정도의 논리와 깊이, 통찰로 이런 분석적인 비판을 할 수 있는 능력을 가진 지식인이 더 있을까, 가장 좋아하고 존경하는 작가이자 지식인..
답답한 마음을 뚫어주심과 동시에 이 현실이 너무나 갑갑하게 와닿는다. 부디 최대한 많은 “보통의 상식적인” 국민들이 이 책을 읽고 함께 분노하고 행동하기를 ..",추천해요,4
14163913,ng***,2024-07-12 15:59:04.786837,유시민 작가님의 특유의 화법이 그대로 전달되는 느낌,최고예요,4
14163363,ry*****,2024-07-12 14:03:36.032401,항상 글로 위로를 해주시는 작가님. ,최고예요,4
14162706,jm******,2024-07-12 11:27:30.856994,여러 매체를 통해 듣던 내용들이 너무 요약이 잘 되어 있어요,도움돼요,4
14162606,bo*****,2024-07-12 10:52:27.023089,유시민 작가님의 뛰어난 통찰력에 대해 박수를 보냅니다.,집중돼요,4
14162535,ky*****,2024-07-12 10:41:41.583531,시원하다. 정말 사이다,집중돼요,4
14159792,hs******,2024-07-11 20:58:19.589913,객관적으로 품위있게 비판하는 법,도움돼요,4
14158821,uo****,2024-07-11 16:30:49.020209,정치를 잘 알지 못하지만 자세히 설명해 주셔서 감사드립니다.,최고예요,4
14158456,sh*****,2024-07-11 15:41:35.326945,명쾌한 상황 정리 및 해석 그리고 기록! 유시민 작가의 책을 읽으면 머리가 시원해집니다,최고예요,4
14156866,un******,2024-07-11 09:33:57.563323,유시민 작가의 통찰을 볼 수 있어요,집중돼요,4
14156401,ak*****,2024-07-11 03:44:05.295409,너무좋아요 너무좋아요 ,집중돼요,4
14156332,ya****,2024-07-11 02:16:06.141351,유시민작가 이번 책도 최고입니다,최고예요,4
14153505,sk****,2024-07-10 17:18:26.375335,지금 꼭 읽어봐야 하는 책!!,추천해요,4
14151762,pr******,2024-07-10 14:12:30.888263,재밌게 잘 봤습니다 ,최고예요,4
14150996,gk******,2024-07-10 10:29:58.483628,작가님의 생각보다 더 빨리 그 분의 마지막이 다가오는 것 같네요. 통찰력에 감탄합니다.,쉬웠어요,4
14150489,jb****,2024-07-10 08:03:20.725663,작가님이 바라보는 통찰력은 대단합니다.,최고예요,4
14147103,jn****************,2024-07-09 18:54:22.185645,"현실을 직시하고 진단하고 처방하는 힘이 있습니다.
추천합니다.",추천해요,4
14145395,hy*******,2024-07-09 14:06:51.945228,역시 이시대의 현자이십니다,쉬웠어요,4
14145004,sw******,2024-07-09 12:40:46.592826,"아주 대단한 감상이 적혀 있는데 
개인적인 소감은 조금 시원답답하나 통쾌한 글의 흐름! 
맥락 알고 읽으면 더 재미있어요!",최고예요,4
14141834,pu****,2024-07-08 22:25:52.010412,좋아요 좋아요 좋아요 좋아요 ,도움돼요,4
14140481,re*****,2024-07-08 19:05:36.357196,운명의 시간이 다가옴을 직감하는 이들에게 그 직감의 이유를 논리적으로 설명해주는 책이다. 3년이 왜 이리도 긴 것일까.,쉬웠어요,4
14140387,jk******,2024-07-08 18:47:14.880057,유시민 작가님의 생각에 많이 공감합니다.,도움돼요,4
14140190,ka******,2024-07-08 17:44:06.921031,책의 내용이 마음을 진정시켜 주네요. 희망을 가지고 지켜볼게요.,최고예요,4
14139925,id*****,2024-07-08 16:42:08.379026,정말 속시원한 글입니다~ 잘 읽었습니다~,추천해요,4
14137634,ro*******,2024-07-08 10:25:30.28025,어머니가 읽고 싶어하셔서 구매했습니다,도움돼요,4
14134161,jj******,2024-07-07 19:47:05.395991,믿고 읽는 유작가의 신간.  그의 통찰력에 무릎을 탁 치게 된다,최고예요,4
14132530,bl**********,2024-07-07 13:37:52.178038,"믿고 읽는 작가님의 책입니다 
술술 읽혀서 시간 가는 줄 모르고 단숨에 읽었습니다
강력 추천합니다",집중돼요,4
14131901,ro******,2024-07-07 10:44:29.024634,"“그는 임기를 마칠 수 있을까? 임기를 마치게 해도 대한민국은 괜찮을까?”

​우리가 묻고 싶었던 질문에 유시민이 답을 한다.
물론 그 답은 유시민의 ‘아주 개인적인 생각’임을 전제로 한다.

책은 그를 보며 깨달은 것, 여당이 참패한 이유, 언론의 몰락, 그가 인기 없는 이유, 그의 적들, 그의 운명까지 총 6장으로 구성되어 있다.
개인적인 생각을 적은 글임에도 불구하고 유시민의 글은 그처럼 무도하고 무지하게 격노하지 않고, 냉철하고 명료하게 그에 대해, 그가 처한 현재의 상황에 대해, 그리고 그의 주변 것들에 대해 일갈一喝한다.
자진 사퇴를 하면 '묻지 말고 보내주자'는 저자의 의견에는 동의하기 어려웠지만, 그 외 대부분은 적극 공감되었다.  

“그는 야당을 상대로 정치적 내전을 벌이면서 탄핵의 파도가 일렁이는 민심의 바다를 항해 할 것이다. 2027년 5월 8일까지 침몰하지 않고 버틸지 여부는 아무도 모른다.”

저자는 그가 ‘자진 사퇴, 협치, 대결’ 중에서 대결을 선택할 것이라고 하였다. 
나 또한 그가 대결을 선택할 것이고(이미 지금도 대결중이다) 절대적으로 변하지 않을 것이라 믿는다.
무엇보다 그가 임기를 끝까지 마친다면 대한민국은 정말 회생불가한 상태가 되지 않을까 하는 걱정이 된다.
그가 내려온다고 해서 모든 것이 해결되지는 않겠지만, 우선은 그가 내려와야 무엇이든 ‘제대로’ 시작할 수 있다고 확신한다.
저자는 어중간한 해법은 없으며 우리가 할 수 있는 일은 서로 이야기하고 행동하여 강한 여론을 형성하고, 그 힘으로 야당과 그의 주변 것들을 압박하여 움직이게 하는 것이라고 하였다.(그는 절대 변하지 않으니)

과연 누가 제일 먼저 그를 버릴까?
동시에? 아니면 앞다투어?
매우 궁금하다.
어렵지 않게 읽히지만 저자가 최근 출연한 <김어준의 다스뵈이다>와 <매불쇼>의 영상을 보고 책을 읽는다면 좀 더 쉽게 이해할 수 있다.

가장 마음에 닿았던, 마음을 울렸던 글을 소개하고 마친다.

“4050 세대는 ‘젊은 벗’으로 여긴다. 그리 어렵지 않게 대화할 수 있다고 느낀다. 젊은 벗들한테 말하고 싶다. 그대들이 앞으로 40년 한국의 운명을 좌우한다고. 그대들 한 사람 한 사람의 지적 문화적 역량이 희망의 크기를 결정한다고. 그대들이 다음 세대의 존경을 받는 어른이 되었다면 대한민국은 사람 살만한 세상이 되어 있을 거라고. 나는 그대들을 믿는다고. 항상 그대들을 응원하는 노인이 될 거라고. 그러니 함께, 힘과 지혜를 모아, ‘윤석열이라는 병’을 이겨내자고.”",집중돼요,4
14131463,di*****,2024-07-07 09:10:17.915845,유시민의 책은 어렵지 않게 쓰여졌는데 내용은 깊이가 있어요 ,최고예요,4
14130881,wl******,2024-07-07 01:23:15.311942,너무 재밌어서 구매한 다음날 바로 술술 읽었어요,쉬웠어요,4
14129259,ch******,2024-07-06 22:21:13.867985,잘 보고 있습니다.,추천해요,4
14129223,ni****,2024-07-06 22:16:48.797443,아들이 읽고 싶다 하여 주문했습니다,도움돼요,4
14127345,al*******,2024-07-06 17:43:35.388647,"역쉬~ 유시민!!!
기다리는 작가의 글이 있는데 그중에 하나다-
책이 나왔다는 사실만으로도 즐거운-",추천해요,4
14125772,ev*******,2024-07-06 12:09:36.713763,"유시민
작가 책은
그냥 읽게
되네요",추천해요,4
14125546,ly*****,2024-07-06 11:11:35.678377,배운사람이글로때리면 이렇게아파요,추천해요,4
14125214,jo*******,2024-07-06 09:47:42.605543,현재의 상황을 쉽게 잘 서술한 책입니다. 쉽게 읽혀요,최고예요,4
14124214,lu********,2024-07-06 00:22:06.608609,"'역시 글쟁이 유시민!'이란 말이 바로 떠오를 정도의 책~! 쓸데없이 어려운 단어로 길게 풀어내지 않고, 짧게 짧게 종결 시켜가면서도 맥락이 딱 떨어지도록 이어나가는 문장들이 책 내용에 더 집중을 할 수 있도록 도와주는 것 같았음. 이렇게 리뷰 작성 하나 쓰는 것에도 길게 풀어 써야만 겨우 한 문장을 종결 시킬 수 있는 내게 유시민 작가님의 그 능력이 그저 부러울 따름.

책 내용도 전혀 무겁거나 지루하지 않고 가볍지만 때론 진중하게, 때론 웃음이 터지게 하는 부분도 있어 주변에 적극 추천중ㅎㅎ",추천해요,4
14122932,lb**************,2024-07-05 22:32:55.780664,너무 갑갑한 시기 잠시 숨 쉬자,추천해요,4
14122003,pi*****************,2024-07-05 20:42:21.321931,유작가의 글을 통해 위로받고싶어 읽었다. 3장 언론의 몰락에서 그의 피토함을 공감하며 우리모두 공유했을것이다.,집중돼요,4
14120708,go********,2024-07-05 16:37:34.446132,재밌을 것 같네요 기대됩니다,도움돼요,4
14119756,lo******,2024-07-05 14:44:39.732694,좋아요. 편하기 읽기 좋습니다,도움돼요,4
14119327,mi******,2024-07-05 13:54:24.653624,이시대 현인 유시민이 굥씨의 운명을 예측한다. 매우 설득력 있다. 굥씨 내외가 조용히 퇴직하지는 않을 거 같다... ,최고예요,4
14119042,gu********,2024-07-05 13:17:56.062578,"잘읽었고,좋은책인것같습니다.잘읽있어요",집중돼요,4
14118571,ao*******,2024-07-05 12:33:59.480123,말이 필요없음. 최고!!!,최고예요,4
14117865,po*******,2024-07-05 11:09:57.046806,유시민 작가의 책은 늘 실망하는 법이 없다,도움돼요,4
14116124,jh****,2024-07-05 06:01:04.611155,유작가님의 통찰력이 대단합니다,최고예요,4
14116032,hw******,2024-07-05 05:42:26.737102,역시 유시민 글을 참 잘 써,최고예요,4
14115987,pa********,2024-07-05 05:20:02.056323,너무너무 흥미진진합니다 ,도움돼요,4
14115125,om****************,2024-07-05 00:42:56.783929,최고예요. 정말 최고예요.,최고예요,4
14112256,yc***************,2024-07-04 21:16:45.448583,어려운 시기를 유작가님과 함께해서 위로가 됩니다,추천해요,4
14111272,he*****,2024-07-04 19:27:52.810551,"너무너무 공감가고 잘 읽어지는 책입니다
유시민 작가님이 함께여서 행복하고 든든해요ㅜㅜ",최고예요,4
14109441,ac******,2024-07-04 17:06:56.888594,생각하며 읽어 볼 책입니다.,추천해요,3
14108443,fi******,2024-07-04 14:54:22.358187,탄핵 청원 동의가 100만이 넘어가고 있는 이때. 유시민의 생각을 함께 공유할 수 있어서 즐거웠습니다.  있으면 안되는 자리에 있는 권력자의 무능과 폐해로 답답함 가슴을 그나마 시원하게 만들어주는 여름수박화채 같은 책입니다. ,추천해요,4
14108431,ro**************,2024-07-04 14:51:33.244842,어떻게 이런 대통령이 나타난 걸까요?  정말 이 나라의 국민이란 게 수치스럽군요 !,최고예요,4
14107760,le********,2024-07-04 13:17:33.240325,읽기 편합니다 추천드려요,최고예요,4
14106491,go*****,2024-07-04 08:05:53.605113,지하철로 출근하며 보는 내내 눈물이 나서 조금 민망한 상황입니다. 분명 이지적인 글인데 왜 따뜻한거죠 ㅠㅠ,최고예요,4
14105757,ow*****,2024-07-04 01:39:50.754802,빨리 지금 이 고통스러움에서 탈출하고 싶다. ,추천해요,4
14105332,lo*******,2024-07-04 00:25:14.981113,이래도 되나 싶지만 속이 시원해지는 책,쉬웠어요,4
14104282,wk******,2024-07-03 22:43:35.384713,"무도하고 무정한 그와 무참히도 한탄스러운 작금의 현실에 치욕스러운 비참함을 느끼며 잃어버린 정의에 통곡한다. 

통탄하고, 분노하며, 수치스럽다.
Time is the herald of truth. 사필귀정.",최고예요,4
14103041,lm***,2024-07-03 19:48:38.365943,더 망가지기 전에 이제 그만두게 합시다.,집중돼요,4
14102647,mi**************,2024-07-03 18:49:00.446117,잘 읽겠습니다 고맙습니다 ,추천해요,4
14096539,se*******,2024-07-02 21:25:18.674499,구매할 생각이 없었는데 목차 살짝 보고선 안 읽을 수가 없어서 재미있을 것같아서 구매했어요 기대되요 ,추천해요,4
14096385,2f******,2024-07-02 20:55:56.143479,책을 읽으면서 반성합니다.  잘못된 판단이 가져온 비극에 대해 무거운 책임감을 느낍니다,최고예요,4
14050095,bu*****,2024-06-27 08:31:06.566381,감정적으로 쓰셨네요 ,최고예요,4
14045743,qg****,2024-06-26 15:29:23.603477,bskd skbd xkjs xjxjxn sjjdjxnx ,집중돼요,4
14021165,ka***,2024-06-22 14:36:03.809696,"책장용 책으로 우서 구매합니다..
시간될때 읽어보면 재밌을거 같기도 하고요..
잘 읽겠습니다..",추천해요,4
