리뷰번호,회원ID,작성일시,리뷰내용,감정키워드,평점
874230,he*****,2020-07-20 21:32:41.83,중학생 딸이 읽고싶다고 해서 주문했는데... 아직 읽지는 않았습니다.마음의 준비가 필요하다나~ ㅋㅋㅋ,추천해요,4
873461,ma******,2018-12-05 03:05:55.476,글쎄요 가치관이 달라서 그런가 잘 읽히지 않네요. ~ 일지도 모른다는 표현이 반복되는 것도 거슬리구요.,,2
873357,na********,2020-03-26 13:55:57.1,"논리적으로 글을 잘 썼다고 생각하며 읽었습니다! 배경지식이 부족해서 천천히 이해하며 읽느라 조금 오래 걸렸지만 다 읽고나니 뿌듯하고, 역사경제문화가 영향을 주고 받으며 변화해나가는 모습이 흥미로워요. 빅히스토리를 다룬 다른책들도 읽어보고싶고, 유발하라리 작가도 논리력에 감탄하여 다른책도 읽어보고싶네요! 사회를 바라보는 시야를 넓힐수 있는 책이니 다들 읽어보면 좋을듯 합니다.",최고예요,4
873857,kb*****,2021-06-21 20:09:24.816,“인간은 권력을 획득하는 데는 매우 능숙하지만 권력을 행복으로 전환하는 데는 그리 능하지 못하다”,도움돼요,4
873180,ja******,2018-08-11 21:07:54.27,저한테는 좀 어려운 내용이고 난해한 책이네요,,2
873638,jo*****,2017-09-02 18:40:15.26,"원문이 그런건지 번역이 잘못된건지 말을 너무 꼬아놔서 읽기가 쉽지않고 이해하기 어렵습니다. 
대부분 알고 있는 호모사이피언스 이야기로 지루합니다.",,1
873951,la*******,2019-04-17 10:04:38.556,"현대 과학의 발전이 어디까지 진행되었고, 어떤 방향을 향해 전진하고 있는지를 잘 보여준다. 그러나 진술에 있어서 어느 한 쪽으로의 짙은 편향성을 가지고 있고, 본인 자신의 어떤 업적이 담겨져 있지는 않다고 보여진다.",,2
874154,jy*******,2021-06-20 09:07:33.726,책이 두껍지만 읽기 시작하면 생각보다 줄줄 읽히는 책이며 그만큼 재미도 느끼게된다,쉬웠어요,4
873963,kk*****,2016-03-05 16:39:27.526,"인간 발달 과정의 새로운 사실, 표현할 수 없는 역사의 진화과정 을 읽으면서 오늘날 우리 인간의 성품을 조금이나마 이해할 수 있게 되었다, 한마디로 놀람, 신비로움 자체다, 저자에게 무한 감사를 드린다.",,3
14895917,si*****,2024-10-14 16:46:16.879371,"두장이나 종이가 이상해서 속상할 뻔했는데 나비였어요ㅋㅌㅋ 럭키 사피엔스자낭~🍀 
책도 재밌어서 도서관에서 빌려보다가 구매했어요!",추천해요,4
874191,ne********,2021-07-17 23:56:34.86,인류학교양 재밌게 술술,최고예요,4
873892,my******,2021-04-30 20:51:46.963,올한해 벽돌책 깨기 프로젝트 하기위해 구매해요,쉬웠어요,4
874018,hy*******,2020-03-19 18:50:28.74,"이건 누구나 한번씩은 꼭 읽어야 하는 책이라고 생각해요. 술술 읽히고 재미도 있으며 유익한 내용이 참 많아요.
읽는 내내 지적수준이 업그레이드 되는 기분을 느낄수 있어요.",집중돼요,4
874017,vn******,2018-11-07 22:34:22.806,벼르고 벼르다 드뎌 구입. 기대됩니다,,3
873369,kw********,2018-03-11 18:56:48.56,이렇게 쉽게 잘 읽힐 줄이야,도움돼요,4
13543818,wo*******,2024-04-12 18:25:34.77709,추천합니다. 유익해요.,추천해요,4
11454150,ca****,2023-05-03 21:38:33.706592,좋은 책이에요 ㅎㅎ,집중돼요,4
10401965,69****,2022-12-26 13:16:14.957143,선물했는데 너무재밌어하고 젛아해요,최고예요,4
873224,lm*****,2022-05-03 22:27:53.653,유발하하하하리 아부지께서 잘 읽으실듯,집중돼요,4
874119,oo*******,2021-07-06 08:50:24.473,재미와 지식 두마리를 동시에.,집중돼요,4
874350,ss******,2021-06-29 03:10:41.486,편하고 재밌게 읽을 수 있습니다.,도움돼요,4
873671,jo*******,2020-05-27 22:59:10.203,두껍지만 술술읽히네요,집중돼요,4
874059,ks*****,2020-03-22 09:00:41.8,재밋어요 전에 알던 지식을 뒤집내요,집중돼요,4
874226,rh*******,2020-01-12 06:41:27.583,좋아요,집중돼요,4
873601,do******,2018-11-28 22:31:36.3,잘읽혀요,도움돼요,4
873995,sa******,2018-06-09 01:22:50.32,"기대하고 잘읽겠습니다.
지난 몇년간 이 책을 읽게 되기를 벼르고 벼르다가 이제 읽게 되었습니다. 감사합니다.",집중돼요,4
874092,ji*******,2017-06-01 10:57:16.336,완전 설렘,추천해요,4
873675,ch*****,2017-03-28 15:53:13.81,귀한존재로서 귀한삶을.......,집중돼요,4
873955,la*******,2016-12-20 11:29:01.983,"어려운책이지만 공감도 되구...
조아요",집중돼요,4
15619979,py****,2025-04-06 05:40:10.76573,사피엔스를 통해서 많이 배웠습니다 :-),도움돼요,4
15608057,yj*****,2025-04-03 11:09:16.096479,재밌게 잘 읽었습니다. ,도움돼요,4
15598459,ch*******,2025-04-01 12:48:33.372321,집중이 잘되는 유익한 책,집중돼요,4
15597468,ps********,2025-04-01 09:08:06.966375,"역사에 관한 새로운 시각은 논리적, 비판적 사고와 통찰력을 키우는데 도움이 됩니다.",추천해요,4
15581077,mo********************,2025-03-28 13:22:34.412569,읽어야겠다 마음만 먹고 미루다가 이제야 읽게 되었습니다  기대됩니다 ,추천해요,4
15576288,JU*****,2025-03-27 11:01:05.108074,너무 잘 읽었습니다,도움돼요,4
15576023,xi******,2025-03-27 10:01:03.568462,논술 선생님 추천 받아 중2 아들과 천천히 조금씩이라도 읽어보려고 구매했습니다. 벽돌책이라며 그닥 좋아하진 않았지만 그래도 몇 장씩 읽어나가고 있습니다.,집중돼요,3
15571885,kk******,2025-03-26 09:25:36.596219,"너무나 유명한 책입니다.
늘 도서관에서 대출해서 읽다가 
안 되겠다 싶어서 구매했습니다.
유발 하라리 교수님의 <사피엔스> 읽고
<총,균,쇠>  읽으려고 합니다.",추천해요,4
15560141,ch*******,2025-03-23 12:43:20.677847,재밌어요 강추합니다,도움돼요,4
15557977,ch******,2025-03-22 21:52:15.119071,필독서를 이제야 읽어봅니다,추천해요,4
15541217,lw*****,2025-03-19 09:49:31.145968,온가족이 같이 읽으려고 구매했습니다! 너무 유명하고 좋은 책이라 많이 기대가 됩니다^^ 잘 보겠습니다😍,최고예요,4
15540924,i0****,2025-03-19 09:07:26.898819,올해 도전책으로 구매~,도움돼요,4
15537552,ss*****,2025-03-18 14:16:42.201378,어렵지만 좋은책입니다,도움돼요,4
15536451,ev*****,2025-03-18 09:19:53.61529,추천받아 구매했습니다. 최고!!!,최고예요,4
15520553,me******,2025-03-14 21:37:50.525408,우리에 대해 알고 싶어요,최고예요,4
15515437,ps********,2025-03-13 20:36:12.328625,관심이 있어서 구매하였습니다. 기대됩니다.,최고예요,4
15510924,ch******,2025-03-12 21:10:14.750304,한번쯤은 읽어볼만합니다.,추천해요,4
15506510,je*******,2025-03-11 23:44:46.988147,"사피엔스는 단순한 역사서가 아니라, 우리가 누구이며 어떻게 여기까지 왔는지를 깊이 있게 탐구하는 책이다. 유발 하라리는 인류의 역사적 흐름을 ‘인지 혁명, 농업 혁명, 과학 혁명’이라는 세 가지 큰 전환점으로 정리하며, 사피엔스(호모 사피엔스)가 지구를 지배하게 된 과정을 명쾌하게 설명한다.",도움돼요,4
15494180,sr**************,2025-03-09 19:48:40.38695,재미있게 잘봐요 좋아해요,추천해요,4
15490759,du*******************,2025-03-09 04:17:06.770418,아이가 너무 재밌어 합니다^,추천해요,4
15463393,ak********,2025-03-04 14:19:07.946993,배송이 빨라서 좋아요!,집중돼요,1
15461764,ca******,2025-03-04 09:04:50.862943,학원교재로샀어요...,집중돼요,4
15458467,ja*******,2025-03-03 15:24:32.994126,학원교재로 구입했습니다. 수업 끝나면 가족들이 돌아가며 보려고 합니다,추천해요,4
15456901,as******,2025-03-03 09:12:58.699274,재미있고 다시 한번 읽고 싶은 책입니다.,최고예요,4
15454282,ka******,2025-03-02 18:28:34.595714,내용이 좋아요.  ,도움돼요,4
15452183,na******,2025-03-02 10:25:34.677031,좋아요좋아요좋아요좋아요,도움돼요,4
15444661,kh****,2025-02-28 19:30:32.497637,유발하라리의 명저 최고에요,집중돼요,4
15441099,nu********,2025-02-27 23:33:45.978054,총균쇠 읽고 읽으니 이해가 잘 되네요~,도움돼요,4
15428652,co*******,2025-02-25 09:04:00.509508,"문가영님추천으로 사게됬어요 
하루하루 아껴읽고있어요",도움돼요,4
15419634,co*******,2025-02-23 07:37:30.769861,두깨에비해술술읽히고  재밌어요.,최고예요,4
15414579,mi******,2025-02-22 07:17:33.788989,샤피엔스는 살아가는 방법을 생각하게 합니다.,집중돼요,4
15405413,ge****,2025-02-20 09:22:48.609446,국어학원에서 추천해 줘서 방학동안 읽어 본다고 구입했어요.,추천해요,4
15403686,ha********,2025-02-19 21:32:10.026184,신선한 충격입니다. 두께가 생각보다 있네요. 속도는 잘 안나지만 꾸준히 읽을게요.,추천해요,4
15398878,su******,2025-02-19 10:13:57.675813,재밌고 유익합니다. 추천합니다.,집중돼요,4
15398379,zi******,2025-02-19 09:10:43.061826,"예전부터 읽고 싶었던 책인데, 처음부터 흥미롭네요.",집중돼요,3
15391075,ph****,2025-02-17 17:19:39.976914,역사를 다른 시각으로 바라보게 해줘서 좋았습니다.,집중돼요,4
15386607,km*****,2025-02-16 18:55:15.688033,모두가 추천하는 이유가 있는 책,추천해요,4
15382240,iy******,2025-02-15 17:49:01.18614,필독서로 추천하는 책입니다,집중돼요,4
15330799,ed*******************,2025-02-04 09:43:22.958016,좋은 책입니다. 잘 읽을게요.,집중돼요,4
15322783,sw******************,2025-02-02 11:14:27.827793,찬사를 보냅니다.~^^,도움돼요,4
15322219,cr******,2025-02-02 08:39:07.464765,차분하게 천천히 읽어야 할 듯,집중돼요,4
15316270,an*******,2025-02-01 06:51:16.095909,어려울줄알았는데 다행히 재미있게 잘 읽고 있습니다 ,도움돼요,4
15306344,dr*******,2025-01-29 17:01:24.099093,중1 국어학원교재로 구매했는데 넘 어려워 걱정했는데 아이가 생각보다 한자리에서 85페이지까지 읽어버리네요~!,도움돼요,4
15301351,we*****,2025-01-27 22:25:43.487038,이곳 저곳에서 언급되어 도전하는 마음으로 천천히 읽고 있어요.,도움돼요,4
15295033,dd********,2025-01-25 21:58:02.533569,책이 너무 좋아요 추천!!,집중돼요,4
15283432,sa********,2025-01-22 18:32:40.210198,정밀 유익한 책입니다,최고예요,4
15258031,kk*****,2025-01-16 09:13:04.289247,유명해서 읽어보려고요,집중돼요,4
15251012,mn******,2025-01-14 15:29:40.660082,상식에 도움 되는 것 같아요,도움돼요,4
15245674,sc********,2025-01-13 10:09:20.103572,꼭 읽어봐야하는 필수,도움돼요,4
15242919,so******,2025-01-12 18:24:53.725073,두껍지만 베스트셀러라 읽어보고 있어요,집중돼요,4
15232880,fo********,2025-01-10 05:51:54.234583,사피엔스 후속편이 기대해봅니다 ,도움돼요,4
15224958,ps******,2025-01-08 13:00:50.164721,중1아들에게 선물. ,도움돼요,4
15224302,cj*****,2025-01-08 10:12:16.902743,이렇게 지식이 넘쳐나는 책을 출간해주셔서 너무 감사드려요,도움돼요,4
15220938,do*******,2025-01-07 14:57:06.394569,인간의 발달사가 논리정연하게 정리되어있는 유익한 책입니다. 작가의 관점에 동의하던 동의하지 않던 한번은 꼭 읽어보면 좋습니다. ,도움돼요,4
15216755,do******,2025-01-06 17:30:37.110843,인간의 진화와 현재 과학발전을 한 눈에 볼 수 있습니다,도움돼요,4
15211133,li******,2025-01-05 11:02:18.905786,새해 첫 책으로 추천,추천해요,4
15210107,ls***************,2025-01-05 00:37:36.089683,그냥 무조건 읽으세요,최고예요,4
15205229,ja******,2025-01-04 06:38:17.923153,영어로는 이해가 안가서,도움돼요,4
15189483,mr********,2024-12-31 16:08:24.079893,유대인작가가 왜 제국주의를 옹호하고 미화하는지.. 도통 알 수도 없고. 책 중반 이후로 삼천포로 빠져서 다 읽는데 고생함… 무엇보다 역사학자가 본인이 비전문적인 분야에 대해 너무 전문가인 척을 하고 ~일지 모른다는 혓바닥을 이빨을 너무 털음…암튼 리뷰에 또 속았음. ,도움돼요,2
15183769,ra*********,2024-12-30 08:40:18.153644,읽어봐야하는 흥미로운 도서,추천해요,4
15178853,gs****,2024-12-28 22:22:25.217048,읽어보고 싶었어요~~,도움돼요,4
15177500,ex******,2024-12-28 16:32:29.640528,"안전하게 잘 받았구요
쉽게 읽히면서 정리가되는 내용이라 한번은 꼭 읽어볼만한 책인것 같아요",도움돼요,4
15163185,gs****,2024-12-24 23:36:44.067981,어렵지만 열심히 읽어볼게요!!^^,집중돼요,4
15163172,ar*****,2024-12-24 23:32:05.567971,쉬운 내용은 아니지만 도움이 됩니다,도움돼요,4
15154398,ao****,2024-12-22 21:44:23.993291,"유명한 유발하라리 사피엔스는 문명에대한 역사를 깊이있게 알려주며, 마크저커버그가 추천란 것처럼 한번은 꼭 읽어주면 좋을 것 같아요",집중돼요,4
15122475,su*******,2024-12-14 09:49:38.777997,읽으면 읽을수록 깨우침이 생기는것 같습니다,집중돼요,4
15121147,dk******,2024-12-13 21:26:26.037251,추천하고 싶은 도서입니다,집중돼요,4
15116053,af********,2024-12-12 13:38:12.688962,초5 아들 만화로 먼저 접했으니 이제는 읽어도 될것 같아서 구매하였습니다.^^,추천해요,4
15115033,dk******,2024-12-12 08:21:27.169901,추천할만한 도서입니다,도움돼요,4
15111242,ad*****,2024-12-11 09:20:14.78297,스테디셀러 최고의 책입니다,최고예요,4
15107253,os*****,2024-12-10 09:10:32.001383,"인공지능의 시대, 우리가 알아야 할 것은 코딩보다 인간의 마음.",최고예요,4
15096124,ni****,2024-12-06 23:15:48.987565,지인 추천으로 읽을려고 샀습니다.~,도움돼요,4
15092379,tr*********,2024-12-05 21:26:18.624269,"좋은책 추천합니다
아들 보라고 주문했는데 이건 아직 못읽었다고해서 다행이네요 ",추천해요,4
15088306,ah*****,2024-12-04 17:14:59.102933,겨울방학동안 아이랑같이 보려고 구입해요.,도움돼요,4
15087659,du*****************,2024-12-04 14:06:36.334312,왜 이책을 이제야 읽었나 싶네요…,추천해요,4
15042151,tj********,2024-11-21 01:47:05.890646,아직 읽어보지는 못했는데 재밌을 거 같아요,최고예요,4
15041046,na*****,2024-11-20 20:05:50.136043,초6남아가 도전하려고 하는 책이에요. 본인이 선택한 책중에 제일 어려운 책인듯 하나 도전하는 모습이 아름답네요. 저도 같이 읽어보려고 합니다,도움돼요,4
15033130,su*****,2024-11-18 21:21:13.493706,아이가 좋아해서 사준책이예요,집중돼요,4
15018302,gs****,2024-11-14 20:55:43.151904,추천받아 읽어봤어요 잘 읽을게요,도움돼요,4
15010412,ah*****,2024-11-12 17:06:10.737418,잘 읽었습니다. 좋은 책 감사합니다.,집중돼요,4
15007719,kd*****,2024-11-12 00:11:42.455448,"과거에 대해 알려주고, 
현재에 대해 고민하고,
미래에 대해 생각하게 만들어준 책
",도움돼요,4
14993284,by******,2024-11-07 18:39:32.470721,너무재밌어요 바빠서 중간중간 읽느라 아쉬울따름,도움돼요,4
14978981,dl*******,2024-11-03 21:16:43.788357,유명한 책임에도 불구하고 읽어본적이 없어서 이번기회에 읽어보려고 구매했습니다,도움돼요,4
14970820,38****,2024-11-01 19:16:50.333772,가을이 왔으니 이제 본격적으로 독서를 다시 시작해야겟다.,집중돼요,4
14956107,da*******,2024-10-29 12:11:42.751107,티비에 나온 요약본 설명듣고 꼭 읽고 싶었던 책이라 구입했습니다,도움돼요,4
14918832,ds*****,2024-10-20 10:22:18.229866,왜 우리는 인간인가. 그러한 과정을 거친 인간은 도대체 어떻게 살아야 하는가. 왜 진화를 멈추고 퇴행하려 하는가.,집중돼요,4
14888554,ba****,2024-10-12 22:04:43.534491,사피엔스를 친구들이랑 함께 읽고 있습니다. 좋은 책과 함께 하는 시간이 정말 좋습니다. ,집중돼요,4
14886160,le****,2024-10-12 10:59:38.660527,유발 하라리 사피엔스 좋아요,도움돼요,4
14870414,dl**************,2024-10-08 06:50:10.934452,잘 읽었습니다.  ,최고예요,4
14801354,Sk*****,2024-09-29 09:39:47.095196,문명과 우리를 알 수 있는 좋은 책 입니다,최고예요,4
14650046,kh*****,2024-09-17 15:47:53.425071,"정독하고 있습니다.
좋습니다 ~~",집중돼요,4
14629583,kh*******,2024-09-14 12:28:56.005553,내용이 어려울 듯 하지만 그만큼 얻어가는 것도 많을 것 같아요.,도움돼요,4
14624686,ic*****,2024-09-13 15:10:54.706061,직원들 주문 해줬는데 좋다하네요,추천해요,4
14577966,la*******,2024-09-07 14:18:10.058713,내용이 잼있고 잘 읽혀요~~,추천해요,4
14553530,ki*****************,2024-09-04 13:42:32.971053,재밌어요 추천 추천,도움돼요,4
14539562,ma********,2024-09-02 19:13:43.992917,인문 베스트라 구매했습니다. 어렵지만 통찰력있는 내용들이라 흥미로워요,집중돼요,4
14472848,wy***************,2024-08-26 13:15:15.928068,열심히 읽어보고 있요 집중됩니다,집중돼요,4
14459669,bl*******,2024-08-24 15:24:05.890413,추천도서라서 꼭 읽어보고싶어서 구매합니다,추천해요,4
14451740,su******,2024-08-23 10:36:52.789769,아주 좋고 유익합니다.,집중돼요,4
14447677,ki*****,2024-08-22 19:28:47.166816,인류의 탄생에서부터 발전해온 과정을 설명한 책,도움돼요,4
14442946,hs****,2024-08-22 10:00:52.985568,좋아요  인류에대한 이해를 위한..ㅎㅎ,도움돼요,4
14416419,da******,2024-08-18 11:27:58.44064,별기대없이아이를위해구매했는데너무재미있네요 제가읽고있어요😂,추천해요,4
14402137,rh******,2024-08-16 11:50:22.358814,어려운 책인거 알면서도 구매했어요 한번 읽어보고 싶어서 구매 읽는데 시간이 꽤 걸릴꺼같지만 두고두고 읽을려구요 ㅋㅋ 도움이 될듯합니다,도움돼요,4
14340698,tn******,2024-08-06 18:53:15.754366,한번은 읽어야 할 책입니다.,도움돼요,4
14280891,bu********,2024-07-30 11:05:33.018092,추천 받아 구매했어요,도움돼요,4
14204894,aj******,2024-07-18 21:22:23.943175,중3아들에게 방학동안 읽어보라고 준비했어요,최고예요,4
14135700,su******,2024-07-07 23:00:54.01392,진짜 필독서 책이에요..,최고예요,4
14132892,op****,2024-07-07 15:16:53.185332,꼭 한번 읽어보고 생각하고 싶은책,최고예요,4
14100095,ou********,2024-07-03 10:12:09.254157,누구나 한번쯤 꼭 읽어야할 책 강추,도움돼요,4
14045922,oh******,2024-06-26 16:03:02.928912,좋아요 도움됩니다 ,도움돼요,4
14020892,le*********,2024-06-22 13:22:46.373932,간결한표현과 인간을 이해히는데 도음,집중돼요,3
13978037,bb*****,2024-06-15 16:38:11.148797,"진짜 싸인이 되어있어요🫢 
완독 하겠습니다😃",추천해요,4
13908303,ki********,2024-06-05 11:39:08.181841,책이 두꺼워서 그렇지 읽기 쉽게 되어 있네요. 재밌습니다,집중돼요,4
13838189,je*******,2024-05-26 17:59:39.97266,친구에게 선물했어요. ,도움돼요,4
13819842,pa******************,2024-05-23 09:24:09.993459,필독 교양서 어렵지 않아요,도움돼요,4
13757293,ba********,2024-05-14 08:03:51.651384,도움이 많이 되었어요,도움돼요,4
13756374,on*****,2024-05-13 23:26:59.431654,추천받아서 구매했어요,집중돼요,4
13697327,bu******,2024-05-04 15:02:57.927014,인류의 역사에 대해 폭 넓게 배울 수 있었습니다. 장문임에도 불구하고 재밌게 읽을 수 있도록 쓰인 책!,최고예요,4
13658784,it******,2024-04-30 00:07:12.432626,재미있게 읽어보내요,추천해요,4
13548280,cw*****,2024-04-13 13:07:54.884786,시야가 넓어진 것 같아요! 매우 추천해요! ,최고예요,4
13545514,ju*****************,2024-04-12 22:38:43.710449,좀 어렵지만 계속 읽다보면 재미있습니다,도움돼요,4
13511890,ms*****************,2024-04-07 20:11:28.43416,인공지능시대에 사는 우리에게 인간의 역사에 대해 알아보고 과거를 통해 현재에 어떻게 살아갈 것인가에 대해 생각해 볼 수 있는 책이예요.. 처음에 책이 좀 두꺼워서 부담이 있었지만 읽고 나니 도움이 됩니다.,도움돼요,4
13499601,wi*******,2024-04-05 15:19:27.373084,최고에요... 이 책은 꼭 읽어봐야한다고 생각해요,최고예요,4
13497575,an******,2024-04-05 07:02:10.842869,내용 좋은 것 같아요. 기대됩니다.,도움돼요,4
13483775,ja******,2024-04-03 10:46:59.100895,아이들때문에 샀지만 내게 더 도움이 된 책,추천해요,4
13424986,bb*******,2024-03-25 13:18:26.049361,어려워요 초심자에겐.. 좀 더 쉬운책 읽고 다시 도전!,추천해요,3
13422175,03******,2024-03-24 23:03:10.7678,항상 읽고 싶었던 책이라 이번에 도전해 봅니다,최고예요,4
13406507,hi*****,2024-03-22 16:13:24.914805,전부터 궁금했었눈데 이제 구매하네요 ,도움돼요,4
13389505,le*******,2024-03-20 13:30:12.955871,재밌게 읽고 도움 많이 받았어요,집중돼요,4
13351388,yo********,2024-03-15 15:11:46.829785,지나가다 교보문고에 들러 유명한 책이 보이길래 집어들었는데 첫 장부터 술술 읽혀 바로드림으로 구매했습니다 ㅎㅎ 두껍지만 틈날때마다 읽어야겠어요,집중돼요,4
13347512,lj***************,2024-03-14 21:10:50.704755,내용이 길었지만 재미있었음,집중돼요,3
13345731,hs********,2024-03-14 15:13:46.696869,유발하라리 사피엔스 재미있게 잘 읽었습니다^ ,도움돼요,4
13315806,te******,2024-03-10 10:02:05.171794,언론의 추천으로 구매했습니다,추천해요,4
13310743,il*******,2024-03-09 16:01:01.381047,유발하라리작가님 책,추천해요,4
13290493,da*****,2024-03-07 08:00:36.862219,인문학적 소양을 쌓는데 필요한 책입니다.,도움돼요,4
13282747,ab*******,2024-03-06 07:43:22.520568,소장하며 여러번 읽을 작정으로 구매,최고예요,4
13281855,yj****************,2024-03-06 00:13:12.625325,"생각보다 어렵지 않네요

",집중돼요,4
13279455,hh*****,2024-03-05 21:35:17.658527,아이와 같이 읽어보려고 주문했어요~기대가 됩니다^^,집중돼요,4
13258733,fo*****,2024-03-03 23:32:51.262283,베스트셀러 이유가 있네요. 잘 읽었습니다. ,최고예요,4
13257111,tm*******,2024-03-03 21:18:26.573566,너무 좋아요. 추천해요. ,집중돼요,4
13238810,lj***************,2024-03-01 02:06:59.926386,몰랐던 내용에 대해서 알게 되어서 좋네여 추천합니다,집중돼요,3
13237130,an*******,2024-02-29 22:15:03.910223,"너무 멋진, 인류의 자기증명.",최고예요,4
13232202,an********************,2024-02-29 02:04:13.383882,너무  읽고 싶은책 잘 받았습니다. ,최고예요,4
13197237,hs********,2024-02-24 11:45:23.199784,사피엔스 코스모스 다음 읽고있습니다. 만족스럽습니다^,추천해요,4
13172171,js****,2024-02-20 23:55:59.252389,진작부터 읽고 싶었지만 내용이 좀 떡딱할까봐 망설였는데 완전히 기우였다. 총균쇠를 읽은 느낌과 비슷하다. 대중적이면서도 깊이가 있는 책. 이런 책이 많이 나와야 하는데...,최고예요,4
13157598,do********,2024-02-18 22:14:50.532176,쉽게 읽히지만 내용은 절대 가볍지 않아요,최고예요,4
13156724,ji*****,2024-02-18 20:54:17.062639,"학원독서교재로 구입해서 아이와 함께 보고있어요.
흥미롭네요",최고예요,4
13149961,sh*******,2024-02-17 17:16:42.414259,유발하라리의 글을 읽는다는것 자체가 다른 세상과의 만남입니다.,최고예요,4
13145602,be****,2024-02-16 22:31:11.079946,생각보다 잘 읽혀좋네요~,도움돼요,4
13143896,go*****,2024-02-16 17:06:54.995356,진화론을 너무 단정적으로 말해서 책을 비판적으로 읽게 되었다. 고고학분야는 추측일 뿐 단정할 수는 없는것인데 저자는 마치 그것이 기정 사실인 양 말한다. 그리고 흥미로웠던 점은 농경사회로의 진입이 인류최대의 사기극이라는 것이 참 새로웠다. 총균쇠 읽고 나서 읽었는데 내용이 많이 겹친다.,도움돼요,4
13136144,de********,2024-02-15 14:05:37.496016,역시 괭장히 좋은 책이었습니다,집중돼요,4
13097931,na*****,2024-02-09 16:57:06.453646,내용이 어렵고 이해가기 좋아요,집중돼요,4
13095413,si*******,2024-02-08 23:23:24.144217,과학에 관심이 생겨서 샀어여,도움돼요,4
13087830,rn********,2024-02-08 00:01:34.325556,이해하기 쉬운 내용은 아니지만 꼭 읽어봐야할 책!,추천해요,4
13079421,mm*****,2024-02-06 17:22:42.168211,지식 쌓는 중 입니다. 교수님 추천으로 읽고있습니다.,최고예요,4
13018239,cl*******,2024-01-28 17:44:38.895617,지난해 벽돌 책을 어렵게 완독하고 이 책도 부담스러워서 걱정하고 시작도 못하고 있었는데 생각보다 잘 읽히고 도움이 되었습니다. ,도움돼요,4
12982123,yu**************,2024-01-23 13:58:00.644917,첨이 힘들고 읽다보면 재밌어요!,추천해요,4
