리뷰번호,회원ID,작성일시,리뷰내용,감정키워드,평점
14930156,ba******,2024-10-23 01:59:23.514504,"비가 거세게 내린다.
책을 다 읽고 난 뒤 답답한 마음에 담배하나 꼬마물고 유일하게 흡연구역인 아파트 입구로 나간다.

비가 온다. 땅바닥에 스며든다. 그 유기물들이 퍼져나가 새로운 생명의 분자가 된다. 어떤 생명의 기초가 되어 한 인간이 된다. 성장하고 늙어가며 다시 유기물로 돌아간다.

한 생명의 삶의 여정은 전부 다 다르다.
어떤 생명은 누가봐도 평탄한 삶을 살아간다.
우리들이 늘 그렇듯이...
그런데 왜 동호는 그 시대 그 도시 그 시간에 그 도청에 있었을까?

자그마한 두려움과 고통에도 도망가기 바쁜 평범한 우리네들과 다르게 동호를 비롯한 그곳의 사람들은 왜 도망가질 않았을까?
정말로 날이 밝으면 수많은 사람들이 흘러나와 그들을 구원해 주었을까?
...

그 일이 있을 당시 나는 중학교 3학년이었다.
그 도시로부터 안전하게 떨어진 강제된 고요와 유.무의식적으로 외면이 공포라는 이유로 일상이 된 평화로운 도시 부산에서 나는 존재했었다. 
어슴푸레 기억 나는건 사람들의 표정이 긴장되었고 어른들도 바깥에 싸돌아다니지 마라고 했었던 거 같다.
제 아무리 언론을 통제하고 그 도시의 고립을 살인자들이 원했다 한들 그 공기조차 막을 수는 없었나보다.

그렇게 시간은 흘러갔고 대학에 입학하고서 몇몇 학생들이 뿌려대는 전단지. 찌라시를 통해 나는 그 때의 사진들을 보았다.
혼란과 충격 그 자체였다.
그 사진들로 인해 이제 막 세상을 사회학적으로 인식하려는 우리는 그렇게 바뀌어 갔다.

학교를 다니면서 여러 학생들과 함께 광주를 방문할 기회가 생겼다.
전남대학교에서 군부독재타도를 외치며 그 수많은 학생들이 궐기하고 있었다.
어느 전남대학생인듯 한 상기된 친구가 우리를 향해 목소리가 작다고 타박했다.
그럼에도 우린 아무도 그 말에 반박을 하지 못했었다.
뚜렷하게 기억나는건  출처를 알 수 없는 죄책감과 부끄러움이었다.

동호를 비롯한 희생자들을 떠올려본다.
그냥 우리 주변에 흔히 보는 그런 사람들일 것이다.
내 아이 일수도 내 누이 일수도 내 어머니 일수도 있었다.

살인자 군사정권을 반대한다는 그 이유로  그들은 처참하게 죽어갔었고 지금도 그 뜻은 살아서 생명을 이어가고 있다.
하지만 살아남은 우리에게 이것은 트라우마다. 죽을때 까지 우리와 함께할 트라우마...
이 트라우마를 기획하고 자행한 그 살인마들은 천수를 누리고 편안하게 잠들어 있고 그 후손들은 아주 잘 살고있다.

도대체 왜? 
그들은 나라와 국민을 지키라고 주었던 총을 왜 시민들에게 겨누고 그리도 무참히 시민들을 학살했었던가?
저자가 시키는 데로 죽은이의 시신을 통해 그를 관통한 총알을 통해 그 총알이 나온 총구를 통해 총알을 쏘아댄 방아쇠를 쥔 따뜻한 손가락을 통해 그리고 그렇게 총알을 쏜 그들의 눈을 통해 인간의 잔인함과 정지된 기계처럼 딱딱해져 버린 그들의 심장을 떠올려본다.
 
이틀에 걸쳐 이 책을 읽었다. 
도무지 한번에 읽어 낼 수 없을 정도로 고통스러웠다.
그렇지만 이유를 모를 의무감으로 읽어나갔다.

시체무덤속에 어두운 그림자가 나도 되어보았다. 
상무대에서 고문을 당하는 희생자가 되어도 보았다.

현재 우리는 그 시대의 광주를 어떻게 그리고 있는가?
나와는 상관없는 한편의 역사로 그냥 있었던 과거로 영화속 필름 자료처럼 느끼는 것이라고만 생각하고 살아오지 않았었나?

저자의 글은 그런 나를 그 당시의 희생자의 육체속으로 마음속으로 마구 몰아 넣고 있었다.
그러나 이 또한 그냥 지금 내가 느끼는 감정일 뿐 그들 속으로 어찌 진정 들어갈 수가 있겠는가?

한강작가가 노벨상을 탓다고 다들 난리도 아니다.
어떤이는 2시간만에 그의 책을 독파했노라고 유투버에선 자랑을 한다. 그것은 느끼지 못함이다. 한강의 글을 그냥 글로써만 읽어내려갔을 뿐이다.
모나미볼편으로 손가락 뼈가 보일정도로 고문당하고 온몸이 난자당하는 한 개인의 영혼을 그냥 글자로 인식했을 뿐이다.

어떤이는 노벨상을 격하하며 한강에 대해 비이성적인 비난을 가하고 있다. 그냥 꼴불견이다 이기심과 주변을 돌아볼 줄 모르는 한심한 유전자만 가진 못난 인간들이다.
언제 어디서건 비슷한 주제들에 발작하며 나타나는 가장 일차원적 본능에 가까운 유전자만 가진 자들이다.

우리가 최소한 적어도 최소한 그 아픔을 겪었고 기억속에 존재하는 그 사람들이 있는 한 우리도 그들과 함께 하고 있음을 알려주고 우리의 기억속에서 결코 지울 순 없는것이다. 우리도 유기물이 되어 흙으로 돌아갈때까지.

한강의 글이 불편하단다. 그것은 그들이 달달하고 먹기쉽고 목구멍에 넘기기 쉬운 것 들만 찾아내는 유아적인 감성을 가졌기에 그렇다고 생각한다. 우리는 성숙한 어른이다. 삶을 살아가고 나이를 들어 어른이 된다는 것은 최소한의 도리 즉 주변을 돌아볼 줄 안다는 것이라고 생각한다.

글 읽기가 힘들어도 작가의 작별하지 않는다와 채식주의자도 읽어낼 것이다. 
그 행위가 나의 영혼에 생채기를 낼지라도 읽어내야한다. 그것이 사람으로 태어나서 알아야하고 외면하지 못할  최소한의 것 책임감이다.  ",고마워요,4
14930130,il********,2024-10-23 01:36:47.369694,최고의 문학 작품입니다.,힐링돼요,4
14930033,pr********,2024-10-23 00:32:29.351972,재밌게 잘 읽었습니다.,힐링돼요,4
14930015,zl***,2024-10-23 00:26:56.668355,"작가가 쓰면서 받은 고통을 독자인 나도 온몸으로 받게되는 경험. 너무나 잘 아는 역사임에도… 기타 미디어를 통해서 느꼈던 것들이 간접경험이었다면, 이 책은 마치 내가 현장에 서있는것만 같은 고통을 느꼈다. 동시에 두려움, 원망, 분노도 찾아온다. 이 힘든 감정을 여러번에 걸쳐 나눠받을 자신이 없어 어떻게든 오늘 하루에 완독했다. 이 책을 두 번 펼칠 용기가 생길까? 내 자의로는 어렵겠지만, 매 년 5월에는 기어코 펼쳐야지 다짐해본다.",고마워요,4
14929903,cm*****,2024-10-22 23:57:16.319157,작가님 책 너무 읽고 싶어서 구매했어요,최고예요,4
14929666,mc*****,2024-10-22 23:19:23.634071,기대되어 주문했습니다 빨리 읽어보고 싶어요!,고마워요,4
14929304,ju********,2024-10-22 22:10:54.877539,차마 재미있다라고 말할수 없는 먹먹함이 남는다,공감돼요,4
14929158,ha*******,2024-10-22 21:39:59.299842,"다시 한번 작가님 노벨문학상 축하드립니다.
출판업계에도 새로운 붐이 오기를 기대합니다-~!!",최고예요,4
14928995,cl*****************,2024-10-22 21:10:24.780675,기다려서 받았어요~~기대됩니다.,최고예요,4
14928781,bu******,2024-10-22 20:06:49.772181,한강작가님의 책의 내용이 좋아요!*^^*,최고예요,4
14928771,bu******,2024-10-22 20:03:34.578726,한강작가님의 책의 내용이 좋아요!*^^*,최고예요,4
14928742,ma*****************,2024-10-22 19:56:30.900467,한강 작가의 노벨문학상 수상을 기쁘게 생각하며 이번 기회로 이제 K-문학이 세계 속으로 뻗어나갔으면 좋겠습니다,공감돼요,4
14928556,jj******,2024-10-22 19:19:54.706041,열심히 읽고 있어요...,공감돼요,4
14928545,gu*****,2024-10-22 19:14:37.688504,드디어 기다리고 기다리던 책이 왔네요~~♡,최고예요,4
14928082,ji*****,2024-10-22 16:46:48.419438,예약주문하고 계속 발송이 늦어지고 있다는 알림을 받아가며 기다리다는~ ,최고예요,4
14927943,gk******,2024-10-22 15:56:48.389719,오래 기다려 드디어 받았어요 ,최고예요,4
14927900,pa******,2024-10-22 15:39:03.619914,감사합니다   늦게라도 택배 와서  볼수있어 좋아요    사람들이 많이 봤으면좋겠네요 ,고마워요,3
14927877,pa******,2024-10-22 15:35:50.284108,너무늦게 책이 주문한 날짜보다 늦었지만  책을보니 감동 받았어  감사합니다 ,고마워요,3
14927750,ko****************,2024-10-22 14:56:50.945507,"예약 날짜보다 늦었지만 그만큼 구매가 많았던 책이라 생각하고 기분 좋게 기다린 책입니다. 앞부분 읽고 있는데 한장한장 몰입해갈 수 있는 책이네요. 다 읽고 또 리뷰할게요. 
노벨문학상 수상 축하드려요 🎉 
",고마워요,4
14927664,su*******,2024-10-22 14:24:21.84914,진지하게 읽었습니다.,최고예요,4
14927623,3m*****,2024-10-22 14:07:15.664977,"3년 전에 읽었지만 이번 좋은 기회에 다시 읽어 보게 되었습니다. 그때는 느끼지 못 했던 마음과 감정을 다시 한번 느끼게 되었고, 잊지 말아야 할 그 날로 저도 스며들었습니다. ",최고예요,4
14927381,dl*****,2024-10-22 12:55:04.849831,드디어 받았어요 아직 읽기 전 이지만 기대됩니다,고마워요,4
14927293,je*****,2024-10-22 12:13:18.14916,문장들을 아껴서 읽고 있어요,최고예요,4
14927286,mc****,2024-10-22 12:10:57.528728,"한강 작가님 책 중 첨으로 읽을 책입니다
기대되네요~^^",공감돼요,4
14927246,so****************,2024-10-22 11:59:53.449871,"읽고싶었던 책, 작가님의 작품을 담는 순간이 기대됩니다.",최고예요,4
14926754,pu*******,2024-10-22 09:51:26.032309,자카의 필력이 최고예요,최고예요,4
14926705,sh********,2024-10-22 09:34:05.312526,역시 노벨상은 쉬운 글에 주지 않는다,고마워요,4
14926607,pi****,2024-10-22 09:07:42.664756,배송이 엄청 늦게 왔어요,고마워요,4
14926547,oh****,2024-10-22 08:33:05.376966,사정상 배송은 좀 늦었지만 잘 읽고 있습니다.,최고예요,4
14926152,no****,2024-10-22 00:55:55.9898,감사합니다.     ,고마워요,4
14926147,th********,2024-10-22 00:54:06.241199,"한강은 단지 '5.18 광주 민주화 운동'이라는 말로는 표현하지 못 할 '그 속의 사람들'을 살려냈다. 
우리가 역사 속 일이라고 생각한 5.18을 아직도 이어지고 있는 일이라고 현실로 그 혼들을 불러들였다.
이 것은 현대사의 비극을, 역도에 맞선 민중을, 국가폭력에 저항한 민주투사들을 초혼한 것이다.",고마워요,4
14926071,ck*****,2024-10-22 00:34:10.544267,읽고나면 먹먹합니다ㅠㅠ,최고예요,4
14925633,ch******,2024-10-21 22:42:13.06662,"오늘 도착했는데 이제 막 다 읽었어요

그 날 그 곳에 있었던 분들을 잊지 못할거 같아요. 책 읽는 내내 비수에 꽂히는 아리고 아픈 이 마음... 잊지않고 기억할 듯",최고예요,4
14925193,kj******,2024-10-21 21:20:17.861375,소년이 온다 공감됩니다,공감돼요,4
14924768,al*****,2024-10-21 19:27:18.393662,"잘받았습니다 
잘 읽겠습니다 
",고마워요,4
14924698,zm*****,2024-10-21 19:05:03.177264,주문이 많아 도착예정보다 늦었지만 최대한 빨리 보내주시려고 주말에도 출고하시더라고요,최고예요,4
14924436,ly*****,2024-10-21 17:32:01.218975,노벨문학상 축하드립니다..!!!,고마워요,4
14924322,co****,2024-10-21 17:13:21.414349,단숨에 읽어버린 가슴아프고 시린 책,최고예요,4
14924206,yy****,2024-10-21 16:21:04.775958,온 국민이 읽어야 할 책,최고예요,4
14923993,er*******,2024-10-21 15:12:48.996403,읽고 소장은 안했는데 노벨 수상하셔서 기념으로 구매했어요 ㅋㅋ ,최고예요,4
14923693,lo*******,2024-10-21 14:23:15.048771,기다림 끝에 보았어요! 한장 한장 찬찬히 잘 읽었습니다!!!,고마워요,3
14923422,aq*******,2024-10-21 13:26:24.737041,"읽는 중, 읽고 나서 마음이 너무 힘든 글.
하지만 반드시 읽어야한다.",고마워요,4
14923372,ao*******,2024-10-21 13:17:18.434374,"서점에 갔다 기대없이, 없을거라 생각했는데 입고되어서 비로 샀네요.. 천천히 잘 읽어볼게요",고마워요,4
14923354,od***,2024-10-21 13:09:48.438206,몰입해서 읽었어요!!읽는 동안가슴 한켠이 점점 무거워짐을 느낌니다~,최고예요,4
14922861,wi******,2024-10-21 10:27:39.294728,소년은 어디에나 있다.,공감돼요,4
14922832,dl*******,2024-10-21 10:23:33.353923,한강 작가님 노벨문화상 축하드립니다.,최고예요,4
14922250,oh****,2024-10-21 07:15:34.779542,"책 잘 받았습니다.
노벨상 직후라 많이 늦을 줄 알았는데 별로 늦지 않아 감사요",최고예요,4
14921993,re*********,2024-10-21 00:57:15.723358,우리 한강작가님 수상을 축하드립니다 전권 다 사고 싶지만 우선 소년이온다부터 읽고 천천히 다음 책으로 넘어가겠습니다,고마워요,4
14920652,sw*******,2024-10-20 19:55:59.772336,사자마자 빠르게 완독했어요. 생각을 많이 하게 되는 책이네요.  한강작가님 첫 책인데 너무 만족스러워요.,최고예요,4
14918904,el*****,2024-10-20 10:46:38.635296,노벨문학상 축하드려요. 좋은작품 감사합니다,최고예요,4
14918507,un******,2024-10-20 08:27:16.476528,"재미있게 읽은 책이었는데, 소장용으로, 지인 선물로 두 권 주문했습니다.",고마워요,4
14918208,65******,2024-10-20 02:33:21.038672,"품절 1주일전 운좋게 구매했네요
한강작가님 수상 축하드립니다",고마워요,4
14917252,od***,2024-10-19 20:46:07.306001,간결한 문체에 묵직한 전달력 그 고통의 순간을 미약하게나마 함께 할 수 있었다!,최고예요,4
14916597,nk*****,2024-10-19 17:38:36.115835,한강 작가님 노벨 문학상 축하드립니다.,고마워요,4
14915650,na*******,2024-10-19 12:25:05.186037,최초로 번역본이 아닌 노벨문학상 작품을 보게되네요,최고예요,4
14915328,pa*****,2024-10-19 10:33:29.931024,"우리나라 역사를 부정할 순 없습니다.
그러나 외면하는 것 또한 폭력입니다.
국가적폭력에 삶을 전부를 빼앗기고 온전한 정신으로 살아남기 힘든 이들의 무너진 가슴을 일부나마 녹여낸 작가의 글을 통해 여러 감정이 올라왔습니다. 가장 큰 것은 미안함이었습니다. 많은 사회적 슬픔들에 무관심으로 치우친 것에 대한 채무자처럼 느껴졌습니다. 많은 이들에게 특히나 청소년들에게 담담하게 이야기해 줄 수 있는 그날의 현장의 생존자들의 목소리가 전해지는 것 같았습니다. 전하는 이에 따라 다가오는 게 달라지기도 하는데 작가님의 어휘와 문장은 꾸밈이 없는 살아있는 이야기로 전해옵니다. 감사합니다!",고마워요,4
14913198,ja*****,2024-10-18 22:06:12.059437,기다리고 있어요.너무 기대됩니다,고마워요,4
14912762,sb****,2024-10-18 20:33:30.607326,"세상에 이렇게 책을 손꼽아 기다린적은 처음인것 같아요 
7일만에 도착했다는.. 나머지도 빨리 만나보고 싶어요 ",고마워요,4
14912572,ky********,2024-10-18 19:26:36.254755,배송전입니다~~기대되요 ,고마워요,3
14912163,hj*******,2024-10-18 17:13:51.884395,"5.18 민주화 운동에 대하여,",고마워요,4
14911847,au***,2024-10-18 15:56:56.797065,노벨문학상 수상 축하드려요!,최고예요,4
14911571,sa******,2024-10-18 15:01:14.987855,애정하고 있습니다.~~,최고예요,4
14911179,mc******,2024-10-18 13:09:55.287293,빨리 받아봤으면 ㅜㅜ,고마워요,4
14910951,ku*******,2024-10-18 12:18:41.791148,노벨 문학상을 계기로 관심을 가지고 읽게 됐는데 가슴 아픈 내용들이 많아서 진도를 내기가 힘드네요. 표현 하나하나가 폐부를 찌르는 책입니다. ,최고예요,4
14910544,cl****,2024-10-18 10:33:53.067175,한강작가 너무 기대되어요!,고마워요,4
14910335,mi********,2024-10-18 09:53:28.559362,"한강 작가님의 노벨문학상 수상을 축하드리며, 원서로 직접 읽을수 있다는 것에 감사하고 감동입니다. ",최고예요,4
14910140,20******,2024-10-18 09:19:29.173636,아직 읽기 전이라 어떤 작품일지 기대됩니다,최고예요,4
14910028,hw******,2024-10-18 08:44:24.657422,노벨프라이즈 작가의 책,최고예요,4
14909534,sh********,2024-10-18 00:10:08.071402,국가공권력으로 국민들의 자유와 행동을 억압하는 잔인한 짓거리는 2024년 현재도 진행중. 소년이 온다 한강 작가님 덕분에 부당한 국가공권력에 저항하고 불의에 항거한 518민주화운동을 다시 기억할 수 있었습니다. 인류보편적가치를 지키기 위해 화이팅입니다^^*,고마워요,4
14908407,wo******,2024-10-17 18:48:04.203223,"정말 기대되는 작품이구요, 천천히 상상하며 오랜시간 읽을 예정입니다",고마워요,4
14908312,ru*************,2024-10-17 18:07:13.425533,"배송 기다리고 있습니다.
빨리 읽어보고 싶어요.",고마워요,4
14908048,hw******,2024-10-17 16:43:57.243092,잊지 말아야 할 중요한 역사를 글로 옮겨주셔서 감사합니다. 덕분에 더 오래 기억하고 아파하고 나아갈 수 있을 것 같아요. 노벨 문학상 축하드립니다.,고마워요,4
14906699,gm******,2024-10-17 10:18:18.675735,읽어보고 싶던책이었는데 이번에 사게되었어요,고마워요,4
14905821,km***,2024-10-17 00:11:11.521552,zzzzz czxzxzXczX,고마워요,4
14905181,sa******,2024-10-16 21:41:04.700945,애정하고 있습니다.~~,최고예요,4
14905112,fl*****,2024-10-16 21:21:44.840997,"역시는 역시
노벨상은 역시",고마워요,4
14904995,sk******,2024-10-16 20:47:41.294455,바로드림 항상구매합니다 좋아요 ,공감돼요,4
14904578,mw****,2024-10-16 18:39:31.202057,한강 작가님~~~~기대되는 도서~~~,공감돼요,4
14904349,pd*****,2024-10-16 17:18:02.541844,고맙습니다.잘 읽겠습니다.,고마워요,4
14904346,pd*****,2024-10-16 17:17:02.986112,"한강작가님의 노벨문학상 수상을 축하드립니다.
잘 읽겠습니다^^♡",고마워요,4
14903957,el*****,2024-10-16 15:42:01.573441,믿고보는 작가님. 노벨상 축하드려요,최고예요,4
14903776,ba*******,2024-10-16 14:54:47.631767,문학적 가치를 떠나서 역사적인 관심을 위해서라도 좋은 작품이네요,고마워요,4
14903395,ch*****,2024-10-16 13:43:12.940939,만족하는 상품입니다.,재밌어요,4
14891890,fu*******************,2024-10-13 18:54:54.455627,오늘 주문했는데 책이 빨리오길 기대합니다.,최고예요,4
14888267,ki*****************,2024-10-12 20:33:38.684261,감사합니다 감사합니다,고마워요,4
14883795,jk****,2024-10-11 20:14:34.621945,슬픔이   너무 마음에 남아요,최고예요,3
14486703,lo***,2024-08-27 21:05:25.643732,한강작가님 책은 정말 좋습니다,최고예요,4
14486540,to*****,2024-08-27 20:55:59.827858,"아직 읽기
전이지만 잘 읽어보겠습니다. ",고마워요,4
14480608,rn*******,2024-08-27 09:24:31.430823,"이제 막 읽기 시작 했어요
기대 됩니다",최고예요,4
14400504,hn*****,2024-08-16 00:57:58.2537,읽겠습니다 언제나 그랬듯,고마워요,4
14370123,pa*******,2024-08-11 17:27:57.30354,재미있게 잘 읽었습니다 ,고마워요,4
14362027,yo**********,2024-08-10 09:11:08.026295,읽어볼만 하네요 ,최고예요,4
14346104,ba****,2024-08-07 15:07:18.520325,관심없던 역사적 사건을 이해하는 계기가 되었어요.,최고예요,4
14341275,gz********,2024-08-06 20:34:05.242285,더디어 소장 하게 되었네요 잘 읽어보겠습니다,최고예요,4
14291359,no********,2024-07-31 14:59:56.587166,Ssssssssss,고마워요,4
14288393,ri*******,2024-07-31 09:06:02.068214,좋은 내용의 책입니다,최고예요,4
14257315,no********,2024-07-26 15:03:44.510295,최고입니다      ,최고예요,4
14219817,70*****************,2024-07-20 22:29:42.730317,잊지않고 기억하기위해 읽으려고 구매합니다..,고마워요,4
14210159,re******,2024-07-19 19:01:54.594331,기대했던 만큼 좋았어요,최고예요,4
14196090,su******************,2024-07-17 15:02:39.800376,가슴묵짐함이 오래 남았던 책이었네요...,최고예요,4
14188294,ti*****,2024-07-16 08:26:03.149952,시원한에어컨틀어놓고 잘 읽겠습니다~,공감돼요,4
14174981,mi******,2024-07-14 09:44:29.904145,논술교재로 너무 좋고 도움이 많이 됩니다,공감돼요,4
14159844,he*****,2024-07-11 21:08:05.973976,소년의 입장에서 세상을 바라보는 일,고마워요,4
14159453,ro*******,2024-07-11 19:46:31.76416,다시 읽어도 너무 슬퍼요,고마워요,4
14151359,jk****,2024-07-10 12:04:35.525968,재밌어요 추천드려요,최고예요,4
14134492,gh******,2024-07-07 20:19:00.348552,한강씨의 소년이 온다 구매하게 되어 감사합니다. 잘읽을 께요,최고예요,4
14113957,k0*******,2024-07-04 23:27:27.099148,기억해야할 그 역사를 읽으며 갑니다.,최고예요,4
14077253,je*****,2024-06-30 16:09:58.262145,짧게나마 부족하게나마 공감할수있믄,재밌어요,4
14068754,ja******,2024-06-30 00:00:57.4078,너무 재미있어요  ,재밌어요,4
14008614,si*****,2024-06-20 10:52:54.641661,가짜이길 바라게 되는 진짜 이야기,최고예요,4
13965088,ke*****,2024-06-13 14:06:27.740742,아ㅡㅡㅡ 먹먹하네요. 감정이입 되는 순간순간이 힘겨웠습니다. 잊지말아요. 우리.,최고예요,4
13937194,ae*******,2024-06-09 10:20:22.381497,매년 5월이면 읽어야 할 책이 생겼다,최고예요,4
13925564,da*******,2024-06-07 20:05:31.262693,슬프지만 끝까지 읽고 알아야 하는 역사..,최고예요,4
13916593,ro********,2024-06-06 10:07:54.950977,특별판들이 계속 나와서 좋군요.,최고예요,4
13905016,eh*****,2024-06-05 00:37:43.762526,페이지를 넘길때마다 마음이 너무 아팠다.모르는 사람들도 많은데 역사를 알려고 하는 사람들이 많아졌으면 좋겠다.,최고예요,4
13873370,lo*******,2024-06-01 08:05:33.440465,티비나 영화보다 생생한 그날의 슬픔,최고예요,4
13858287,ch******************,2024-05-29 19:44:29.522374,커버 이뻐서 있는데또삼,최고예요,4
13857700,vl*******,2024-05-29 17:34:36.397962,정독했어요 잘 읽었습니다,최고예요,4
13856279,sa******,2024-05-29 14:24:49.986814,생각하게 되는책 내용,힐링돼요,4
13818034,ak********,2024-05-22 22:51:53.182604,감명 깊은 글 잘 읽었습니다,고마워요,4
13776868,ha******,2024-05-16 09:47:16.326277,눈물 흘리면서 봤습니다ㅠㅠ,고마워요,4
13774548,he*****,2024-05-16 01:18:41.560263,5월엔 꼭 읽어야하는 필독도서,최고예요,4
13765659,lj*****,2024-05-15 09:40:27.303808,생각했던 대로입니다 ,공감돼요,4
13735612,sa******,2024-05-10 11:56:06.650149,도움되는책입니다 ㅁ ,힐링돼요,4
13684756,le***,2024-05-03 10:47:15.378175,"다 아는 이야기인데 마지막 장 읽을때 눈물이 쏟아졌습니다.
",공감돼요,4
13650457,du******,2024-04-28 19:25:05.964914,"한강 작가님책은 채식주의자, 작별하지 않는다 두 권 읽어 봤네요. 
이 책을 구매한 시점은 4월 말. 최근 어떤 작가님 한국 현대사 읽고 이 책으로 흘러왔네요.  당시 시대를 공감해 보면서 읽어 보도록 하겠습니다.",공감돼요,4
13626455,kh*****,2024-04-24 07:29:52.71634,"국어학원 수업관련해서 구입했는데 청소년들에게
필요한 좋은 책이네요",재밌어요,4
13619237,so*****,2024-04-22 21:18:15.467451,"문학을 왜 문학작품이라 부르는지 알게 해주는 글
한강이라는 작가와 동시대를 살고 있어 자랑스럽고 
많은 사람들이 작가님의 글을 읽고 
책에서 다뤘던 일들에 대해 알았으면 좋겠다 ",최고예요,4
13616387,dm******,2024-04-22 09:16:35.181642,재밌게 보고 있습니당,재밌어요,4
13602839,dm******,2024-04-20 09:25:26.017434,좋은 책을 만나서 감사해요,최고예요,4
13590223,ha****,2024-04-19 12:02:52.300691,기억해야할 가슴 아픈 역사,최고예요,4
13562846,ho*******,2024-04-15 13:07:04.187883,마음이 먹먹..한강 작가님의 책 중 가장 좋게 읽었습니다. 추천합니다.,최고예요,4
13503774,rl********,2024-04-06 08:10:07.168168,재미있어요 잘읽었습니다,최고예요,4
13449848,me******,2024-03-29 14:11:43.382999,너무 뜻깊게 읽어서 선물했어요,최고예요,4
13405304,de*******,2024-03-22 14:48:54.221346,도서관에서 읽어보고 자꾸 생각나서 종이책으로 구매했습니다. ,고마워요,4
13395511,tm********,2024-03-21 11:06:40.832243,"읽고, 주변에 선물도 많이했어요",최고예요,4
13334173,tj********,2024-03-12 22:06:57.555081,잘 받았습니다! 읽을 책이 필요해서 사게 되었는데 재밌을 것 같아요ㅎㅎ,재밌어요,4
13317160,wo*****,2024-03-10 15:36:40.202212,아들 학습용으로 구매했어요!,힐링돼요,4
13305882,pn****,2024-03-09 08:05:22.283972,아이가 더 크면 읽히고 싶네요. 감사한 마음으로 살겠습니다..,고마워요,4
