리뷰번호,회원ID,작성일시,리뷰내용,감정키워드,평점
1575179,je******,2022-02-18 09:48:07.9,인간의 오만함으로 결국 인간이 제일 손해볼것 같다,좋아해요,4
1575383,l2*****,2022-02-17 21:22:04.16,긴긴밤 아이가 좋아해요,좋아해요,4
1575287,ye*****,2022-02-17 17:38:13.62,감동적이에요 동화책인데 어른이 읽어도 좋아요,좋아해요,4
1575594,eu******,2022-02-15 23:06:20.796,지인의 추천을 받고 구매했던 책인데 너무 감동적인 내용으로 눈물이.. ㅠㅠ 두고두고 읽고 싶은 책으로 남았습니다 추천합니다!,좋아해요,4
1575586,js*****,2022-02-15 20:48:58.236,성인인 저에게 너무 큰 위로가 된 책이에요ㅠ,좋아해요,4
1575267,sk****,2022-02-14 00:27:02.63,어른을 위한 동화라면서요 ㅠㅠㅠ,좋아해요,4
1575322,ch*****,2022-02-11 21:18:08.936,어른이 읽어도 아주 좋은 책입니다. 추천합니다.,좋아해요,4
1575429,al******,2022-02-08 20:24:48.38,어린 펭귄의 홀로서기를 주변의 여러 비슷한 처지의 동물들과 함께 만들어가는 삶의 이야기.,잘읽어요,4
1575294,db********,2022-02-06 15:14:12.553,이 책을 추천드립니다^^,좋아해요,4
1575277,wi****,2022-02-06 09:40:53.993,잔잔한 감동 긴 여운 추천합니다,좋아해요,4
1575138,er******,2022-02-06 04:32:18.283,추천받아서 구매했습니다.아동챕을사보긴처음입니다 기대되네요,좋아해요,4
1575111,da*******,2022-02-04 23:19:28.326,어린이 독자를 겨냥한? 동화지만 어른에게 더욱 와 닿을 것 같은 내용의 동화.. 너무너무너무 정말 너무 좋았어요.. 슬프고도 아름다운..,좋아해요,4
1575156,hy********,2022-02-04 20:54:23.876,방학 때 아이와 함께 읽어 보려고 주문 했습니다.,좋아해요,4
1575052,jk****,2022-02-02 12:42:00.5,좋아요 추천드려요ㅎㅎ,잘읽어요,4
1575469,ba******,2022-02-01 20:37:40.963,어른이 읽어도 좋은 책이었어요,좋아해요,4
1575247,se********,2022-02-01 15:36:06.876,아주 좋은책입니다^^,재밌어요,4
1575113,gk********,2022-01-31 13:02:12.383,책표지의 맨들맨들한 느낌이 코뿔소를 만지고있는 듯한 착각을 불러일으킨다. 가볍게 잘 읽히지만 아이들보다 어른들이 더 많이 읽었으면 좋겠다.,잘읽어요,3
1575582,ro*******,2022-01-28 21:14:38.753,재미있게 잘 봤어요,좋아해요,3
1575126,k0*******,2022-01-27 22:23:18.963,잔잔하면서 마음이 따듯해지는 이야기..,잘읽어요,4
1575439,ya*****,2022-01-24 21:14:51.783,슬프지만 아름답고 희망찬 이야기 입니다.,잘읽어요,4
1575566,sh****,2022-01-23 23:13:32.5,마음이 따뜻해지는 책입니다,잘읽어요,4
1575276,so******,2022-01-21 20:28:04.583,따뜻한 책입니다 주변에도 소개해 주었네요,잘읽어요,4
1575481,jy*******,2022-01-21 10:18:54.473,방학이라 사주었더니 잘 읽고 자주 읽네요~,잘읽어요,4
1575186,be*******,2022-01-19 22:31:10.6,추천합니다 뭉클하고 마음이 따뜻해지는 책이에요,좋아해요,4
1575527,wo********,2022-01-19 16:30:31.863,너무 따뜻하고 아름다워요,좋아해요,4
1575149,rr******,2022-01-18 23:37:51.243,어린이책이 맞나 싶을정도로 깊은 이야기,좋아해요,4
1575478,bu*******,2022-01-18 15:59:33.51,아이와 함께 읽어보려합니다.,재밌어요,4
1575307,te****,2022-01-17 16:16:01.94,평소 읽어보고싶어한 책인데 너무 재밌게 잘 보았습니다,좋아해요,4
1575283,bo******,2022-01-17 15:13:12.99,도서관에서 빌려보고 아이들과 함께보면 좋을것 같아서 구입했어요.,좋아해요,4
1575280,je********,2022-01-17 15:05:07.343,울음을 꾹꾹 누르며ㅡ 읽다가 결국 한참을 소리내어 울고 말았습니다. 긴긴밤을 이겨내는 건 함께라는 따스한 유대. 노든과 내가 코를 맞대며 인사하는 그 모습이 너무도 아름다워서 눈물이 멈추질 않네요.,좋아해요,4
1575552,ji*****,2022-01-17 13:27:41.213,"힐링책이라도 해서 구매를 하게되었는데,
삶에 많은 생각을 하게 된 책이 되었습니다.

어린이필독도서라는데 심오하고 생각할게 많아지는 좋은책이라고 생각합니다.

슬퍼서 허우적거릴뻔한 자신을 그림이 구해주네요",좋아해요,4
1575431,se*******,2022-01-15 11:55:22.613,"오랜만에 아이가 읽고 싶은 책 말고, 아이가 읽었으면 하는 책을 구매했어요. 아이와 함께 읽기 좋아요",좋아해요,4
1575369,es******,2022-01-13 11:26:32.833,아이가 재밌게 읽고 있어요.,좋아해요,4
1575137,sa******,2022-01-12 20:16:53.783,"따뜻한 사랑의 연대를 보여주는 그림책이다. 혼자이지만 혼자가 아닌 존재들이라는 것을, 지금의 내가 존재하기까지의 많은 시간들과 긴긴밤 속에 여러 사람들의 보살핌, 사랑과 관심들로 지금의 내가 존재함을 이제 자신만의 길을 떠나는 어린 펭귄을 통해 보여준다.",좋아해요,4
1575496,tn*******,2022-01-11 23:29:57.786,긴긴밤을 걷는 너에게,좋아해요,4
1575157,ra******,2022-01-08 12:07:43.493,아이와 함께 읽으려고 샀어요,좋아해요,4
1575311,na*******,2022-01-05 14:32:58.53,어른들도 꼭 읽어봤으면 좋겠어요,좋아해요,4
1575562,aq******,2022-01-04 21:32:32.206,감동을 주는 책이네요,좋아해요,4
1575312,ki******,2022-01-04 19:42:16.12,정말 감동적인 책입니다,좋아해요,4
1575551,si*****,2022-01-04 16:51:35.656,따뜻한 이야기에 마음 녹고 가요,재밌어요,4
1575182,ps********,2022-01-04 13:34:45.13,재밌었는지 읽고 나서 몇 번을 얘기하네요. 이제 동물원의 동물을 보면 조금은 다른 생각을 하게 되지 않을까 싶어요.,좋아해요,4
1575405,mu******,2022-01-03 15:12:51.666,따뜻한 그림과 문체 덕분에 빠르게 술술 위로받는 기분이에요. 책이 참 얇은데 그 안에 수 많은 위로가 담겨있어요,잘읽어요,4
1575201,li*****,2022-01-02 01:15:24.746,"8살 딸이 읽고 길게 이야기를 들려주었는데, 듣는 것만으로도 마음이 짠했습니다.",좋아해요,4
1575490,eu*******,2022-01-02 00:27:21.216,아이가 감동적이라고 엄마도 꼭 읽어보라고 추천까지 하네요.,좋아해요,4
1575549,da*******,2022-01-01 21:52:13.746,추천받고 샀는데 좋은 책이네요,좋아해요,4
1575506,es********,2021-12-30 21:41:07.77,아이들이 좋아할 책입니다.,좋아해요,4
1575222,ne***,2021-12-30 18:10:00.96,1학년 아들이 슬프고 감동적이라네요 저도 읽어봐야겠어요,좋아해요,4
1575436,ah*****,2021-12-30 17:10:15.533,"좋은책, 잘읽었습니다",좋아해요,4
1575154,1w******,2021-12-29 09:34:32.526,책 내용 만족합니다. 구매하고 좋았습니다.,잘읽어요,4
1575171,da****,2021-12-28 17:06:37.49,너무 좋았습니다 재밌게 읽었습니다,좋아해요,4
1575200,oh********,2021-12-27 13:04:13.96,7살에겐 턱도없이 긴 내용이네요. 궁금한데 쉽지가 않네요,재밌어요,4
1575509,ht****,2021-12-26 23:55:21.756,어른을 위한 동화! 감성을 울린다.,재밌어요,4
1575160,ga*******,2021-12-25 22:11:14.743,초5도 초2도 잘 읽어요!,좋아해요,4
1575486,tj*****,2021-12-25 17:40:46.216,마음이 따뜻해지는 책,좋아해요,4
1575110,js********,2021-12-24 15:19:06.823,오랜만에 소장욕구와 더불어 선물하고 싶은 맘이 들게 하는 책을 만났네요.,좋아해요,4
1575067,jh******,2021-12-24 14:39:48.68,정말 감동적입니다. 한동안 가슴이 먹먹할 것 같아요.,좋아해요,4
1575408,we*******,2021-12-23 09:36:54.9,글과 그림이 잘 어울려져 아이들에게 좋은 책이네요,,4
1575556,jy********,2021-12-20 12:52:38.76,추천하길래 구매해봤어요,좋아해요,3
1575489,du*****,2021-12-20 00:47:54.863,아이와 너무 잘보았습니다 여러번읽게되요,잘읽어요,4
1575346,ai*****,2021-12-19 23:16:49.133,큰감동을줍니다!!사길잘했어요,좋아해요,4
1575572,ce******,2021-12-15 16:40:29.466,아이도 어른도 재미있게 읽었어요,좋아해요,4
1575523,zo****,2021-12-14 20:34:57.2,어른도 같이 공감할 수 있어요,좋아해요,4
1575237,ag*****,2021-12-14 13:15:55.78,아이와 함께 어른이 읽어도 좋은 도서입니다. 아이들이 읽고난후에 느끼는 감정 또한 많이 배운 책이었네요.,잘읽어요,4
1575353,ja******,2021-12-13 22:45:56.4,아이들에게 좋은 내용입니다,좋아해요,4
1575043,ch******,2021-12-13 22:16:59.613,어른이 읽기에도 감동적이예요~~,좋아해요,4
1575371,na*****,2021-12-12 06:24:32.936,어른이 읽기에도 좋은 책입니다.,좋아해요,4
1575025,ta****,2021-12-10 16:45:02.1,아이 읽어보라고 주문한건데 레뷰를 보니 너무나 기대됩니다,,4
1575239,de*****,2021-12-10 12:57:14.673,재미있게 읽고 있습니다.,좋아해요,4
1575456,uh*******,2021-12-06 10:09:44.55,평소 읽고 싶었던 책인데 정독했습니다.,재밌어요,4
1575048,ss****,2021-12-03 16:31:09.63,아이들 추천도서라 해서 아이들을 위해 샀습니다. 기대됩니다.,좋아해요,4
1575109,ir******,2021-12-03 13:47:20.723,"읽으며 함께 동화되어 우리가 되고 내가 되는 책.
아이에게 주려고 샀지만 나에게 잔잔한 감동이 되어
나에게도 좋은 책이다.",좋아해요,4
1575114,ro******,2021-12-03 11:14:18.933,먹먹함이 느껴지는 내용이네요,잘읽어요,4
1575050,so*****,2021-11-30 23:02:56.306,슬프고 따뜻한 이야기 내가 간직하고 싶은 이야기,좋아해요,4
1575342,92******,2021-11-27 22:07:51.263,초등학생 동생이 감동적이라고 하네요,좋아해요,4
1575053,sh*******,2021-11-26 22:05:52.526,"우라딸이 너무 재미있게 잘 봤다고 이야기 합니다.
저도 시간내서 읽어보려구요.
남과 다름을 인정해주는 그런 좋은 내용인덧같아요",좋아해요,4
1575150,an******,2021-11-22 10:51:04.263,너무 좋아요. 꼭 읽어보세요,좋아해요,4
1575266,bi******,2021-11-19 10:42:28.643,성인 독자들도 읽을 수 있는 책이에요,잘읽어요,4
1575578,to********,2021-11-16 18:12:16.83,마음을 따뜻하게 해주는거 같아요,잘읽어요,4
1575129,le****,2021-11-08 11:02:17.333,얇은 책이지만 많은 이야기가 곳곳에 심어져있어서 아이들과 토론하며 읽기 좋아요,잘읽어요,4
1575263,ju*****,2021-11-04 09:42:25.7,오랜만에 손이가는 좋은 책입니다,좋아해요,4
1575412,za****,2021-11-03 14:33:17.236,추천을 받고 구입했습니다. 주위에 선물하고 싶어지네요,좋아해요,3
1575167,nu******,2021-11-01 13:47:09.6,이토록 따뜻하고 따뜻한 이야기가 있어 좋았습니다.우리가 사는 세상도 &amp;lt;긴긴밤&amp;gt;만큼 조금은 다정하길 바랐습니다. 저 또한 좀더 좋은 세상이 되도록 노력해야겠다 생각합니다.,좋아해요,4
1575374,sd***,2021-11-01 10:46:20.626,"아이 때문에 구매했지만, 어른도 감동하는 책네요. 좋아요~",좋아해요,4
1575507,yh*****,2021-10-29 06:56:49.916,감동적이고 뭉클한 이야기~,잘읽어요,3
1575232,no*****,2021-10-28 13:16:15.516,"우리는 서로 다르지만 함께 할 수 있어
아이동화지만 어른에게도 좋은 책",좋아해요,4
1575055,hy******,2021-10-27 23:43:12.266,초등학교 아들들이 좋아해요.,좋아해요,4
1575505,ke********,2021-10-26 19:43:55.313,아이 선물로 구매한 책입니다.,좋아해요,4
1575537,yl****,2021-10-25 19:28:25.79,마음이 따뜻해지는 책,재밌어요,4
1575479,js*******,2021-10-24 23:46:40.596,평이좋아구매해봄.금방읽네요,좋아해요,4
1575454,di****,2021-10-20 20:42:57.186,유용하게 잘 읽었어요,잘읽어요,4
1575216,la******,2021-10-18 22:19:13.836,10살아들이 다읽고 감동적이라며 엄마에게 읽어보라 추천까지 해주었어요,좋아해요,4
1575139,kh*****,2021-10-18 18:42:47.663,저도 읽어보고 너무 좋아서 중3 막내에게 선물했습니다. 막내에게도 좋은 책이었다고 합니다.,좋아해요,4
1575574,em******,2021-10-18 09:24:36.703,잘읽었어요~~~!!,추천해요,4
1575192,lu*****,2021-10-13 00:34:17.816,제제가 생각나는 긴긴밤입니다.,좋아해요,4
1575545,to********,2021-10-10 09:21:03.54,아직 어린아이에겐 차마 못 읽어주겠어요. 너무 슬픈 현실이예요.,잘읽어요,2
1575051,re*******,2021-10-09 00:30:33.853,선물하려고 구매했어요,좋아해요,4
1575076,sp******,2021-10-08 22:36:00.656,"단 하나뿐인 우정에 관한 책, 아이 뿐 아니라 어른들도 이 소중하고 특별한 우정에 대해 읽고 나면 사람 관계, 누군가를 키운다는 것에 대해 다시 생각해보게 된다.",잘읽어요,4
1575555,ne*******,2021-10-08 15:08:59.14,"너무 너무 따뜻하고 아름다운 서사입니다
동물들도 이런데
사람은 더욱 그리 살아야하지 싶습니다",좋아해요,4
1575541,ky*******,2021-10-08 02:39:02.82,책표지가 너무 더럽게 출고되었어요. 책 자체는 좋습니다,좋아해요,4
1575036,gu***,2021-10-07 22:22:22.73,너무 슬픈 이야기. . .,좋아해요,4
1575540,sk********,2021-10-06 12:38:24.663,괜찮은 책입니다. 추천해요,좋아해요,4
1575132,ke******,2021-10-05 03:18:12.933,성인이 봐도 좋다기에 구입해봤어요 재밌게 잘 읽었습니당 ㅎㅎ,좋아해요,4
1575401,ky********,2021-10-04 17:46:15.363,마음을 움직이는 힘,좋아해요,4
1575211,ja******,2021-10-04 08:26:25.186,연령 구분없이 읽을 수 있는 책이에요~훌쩍이며 읽어 내려간 책입니다.초등 조카에게도 읽히고 싶어 선물했어요.,좋아해요,4
1575581,La*******,2021-10-03 21:43:06.456,너무 귀엽고 으앙 책 이쁘다 ㅠㅠㅠㅠㅠ,좋아해요,4
1575195,ni*****,2021-10-03 16:30:21.71,읽는내내 눈물이 멈추질 않습니다. 생존을 위해 그들이 보낸 긴긴밤들. 시리고 아프지만 한없이 따뜻한 서로에 대한 애정이 너무나 아름답습니다.,좋아해요,4
1575115,se***,2021-10-03 15:08:01.913,아이도 저도 잘 읽었습니다.,잘읽어요,4
1575292,re******,2021-09-27 09:07:09.736,어른들을 위한 동화,좋아해요,4
1575108,di******,2021-09-27 05:17:14.806,아이가 하루만에 술술읽었어요. 내용이 슬프답니다,잘읽어요,4
1575320,ni******,2021-09-26 23:11:00.296,감동적인 내용이네요. 추천합니다.,좋아해요,4
1575503,xa******,2021-09-26 22:25:19.106,재미있는 이야기입니다.,좋아해요,4
1575198,fr*******,2021-09-25 17:01:59.36,아이네 반전체가 같이 읽을 책입니다,잘읽어요,4
1575271,y1******,2021-09-24 23:26:20.606,감동적인 이야기입니다.,좋아해요,4
1575031,so****,2021-09-24 21:23:27.16,아이와 어른이 같이 읽고 공감할 수 있는 책.,좋아해요,4
1575409,sk********,2021-09-23 16:21:07.686,아이가 잘 읽었습니다.,추천해요,4
1575493,cy******,2021-09-23 12:05:56.59,어른에게도 감동을 주는 책 입니다.,좋아해요,4
1575228,sy*****,2021-09-16 23:35:35.216,재미있어요 추천합니다.,좋아해요,4
1575147,re********,2021-09-15 23:31:41.87,청소년 동화라 가볍게 읽힌다는 추천을 받고 구입했는데 아무 생각 없이 지하철에서 펼쳤다가 시작부터 눈물이 나서 혼났어요,잘읽어요,4
1575345,eh*****,2021-09-15 18:39:22.236,긴긴밤 밀려오는 감정에 어찌할 줄을 몰랐다.어른동화.,좋아해요,4
1575214,sj******,2021-09-14 23:40:38.373,초등학교아이와 같이읽으면 좋을것같습니다^^,좋아해요,3
1575185,li******,2021-09-14 20:38:34.376,"책방에서 보고 바로 구매 했습니다. 저도 읽고 아이더 읽을려구요.
재밌어요.. 동심 ㅎㅎ",잘읽어요,4
1575504,pu******,2021-09-13 20:06:06.93,긴긴밤 재밌게 읽어요.,좋아해요,4
1575406,ho*******,2021-09-13 13:32:45.946,청소년 도서라고 하는데 어른에게도 큰 감동을 주는 책입니다 잘 봤어요,좋아해요,4
1575440,ns*****,2021-09-12 23:00:58.39,깊은 울림이 있는 책,잘읽어요,4
1575300,do*****,2021-09-08 22:24:19.193,어른들도 꼭 읽어야하는 책입니다  눈물이 그냥 ....,좋아해요,4
1575285,on***,2021-09-06 16:38:39.153,긴 여운이 남는 이야기예요. 소장하고 가끔 읽고 싶어지는 책입니다.,재밌어요,4
1575082,li****,2021-09-06 05:19:57.13,"소장가치있는책!
아이가 읽고 추천해준 책 입니다. ^^",좋아해요,4
1575347,so********,2021-09-05 17:30:13.516,슬프고 따뜻한 이야기,좋아해요,4
1575394,hk*****,2021-09-04 16:44:10.163,인간들은 왜 그토록 잔인할까요? 가슴아프게 봤어요,좋아해요,4
1575402,kj*******,2021-09-03 22:43:29.28,어른이 읽어도 감동적인 책~,잘읽어요,4
1575450,re****,2021-09-03 13:42:03.463,어른들을 위한 이야기같습니다,좋아해요,4
1575044,hy******,2021-09-03 09:45:14.96,너무 좋았어요. 그림도 예쁘고 따뜻한 책이예요.,좋아해요,4
1575443,mi*****,2021-09-02 23:08:11.846,사랑 슬픔 감동 먹먹하네요,좋아해요,4
1575314,tl******,2021-09-02 15:51:51.766,"이 책 좋다고 하는 사람들이 많아 구매 하게 되었는데, 왜 호평이 많았는지 알 수 있었습니다 :)",잘읽어요,4
1575037,my****,2021-09-02 15:47:08.723,수상작이라 추천받고읽었는데 재미있게 봤습니다,잘읽어요,4
1575533,na********,2021-09-02 01:06:24.21,진한 감동을 안겨줌 한 편의 아름다운 소설!,좋아해요,4
1575531,mi*****,2021-09-01 18:52:24.563,그림도 예쁘고 좋아요.,좋아해요,4
1575255,pi*****,2021-09-01 14:07:28.213,마음의 고요함이 찾아오는군요,좋아해요,4
1575194,tm*******,2021-09-01 13:46:51.8,재미있어요. 좋아요. 추천합니다.,좋아해요,4
1575532,bo****,2021-09-01 10:30:44.106,아이가 집중해서 정독합니다. 너무 감동적이라고 하네요. 아이가 다 읽고 나면 저도 정독해 보아야겠어요,재밌어요,4
1575404,js*****,2021-09-01 00:37:15.726,마음 따뜻해지는 책이었어요,,4
1575452,01***,2021-08-30 21:37:12.873,추천 받아서 구매해봅니다. 따뜻할 거같아요,좋아해요,4
1575190,so********,2021-08-30 16:49:03.563,어쩌면 지금의 시대에 필요한 서로다른 이들에 대한 배려와 온기가 느껴지는 책인것 같아요.,잘읽어요,4
1575370,sa*****,2021-08-30 16:13:43.476,아이들 감성교육에 좋은 책인 것 같습니다.,좋아해요,4
1575515,ji*****,2021-08-30 11:15:05.596,"책 읽는 내내 엄청 울었네요... 노든과 치쿠와 윔보, 그리고 코뿔소가 키운 펭귄의 이야기가 너무나 아름다워요",좋아해요,4
1575395,le****,2021-08-30 09:09:00.626,아이가 너무 좋아합니다.,좋아해요,4
1575521,lu********,2021-08-28 21:15:22.746,"감동적입니다.
아이들이 꼭 읽어봤으면 좋겠네요",좋아해요,4
1575238,ym****,2021-08-27 20:50:50.73,"감동입니다..
아이들도. 엄마도.",좋아해요,4
1575092,ra*****,2021-08-27 20:47:48.533,어른이 읽기에도 좋고 감동적입니다,좋아해요,4
1575445,vb******,2021-08-27 00:59:48.666,"마음의 울림을 주는 책. 그림만 봐도 저릿하다. 슬프기만 한 책은 아니고, 기분이 좋아지고 따뜻해진다.",좋아해요,4
1575219,il*****,2021-08-26 09:44:05.383,읽으면서도 다 읽고나서도 계속 먹먹해지는 책이였어요. 인간의 추악한 욕심과 공생하려는 선함을 보며 동물들이 인간에게 느낄 감정도 생각하게 되고 과연 나는 동물들에게 어떤 인간일까란 생각도 들더라고요.. 그 책은 정말 다 좋았지만 마지막에 그림들이 정말 클라이막스인거 같아요. 다 읽고 그 그림들을 한장씩 보는데 눈물이 멈추지 않더라고요.,좋아해요,4
1575470,wf*****,2021-08-25 15:15:52.243,"초등 고학년 딸아이와 함께 읽고 싶어서 구매했어요.
잔잔하면서도 몇 번 울컥하면서 손에서 떼지못하고 읽었네요. 아이도 재미있으면서 마음이 아팠대요.
여운이 길게 갈 책이네요.
내용과 어울리는 너무 훌륭한 그림들 역시 감동을 줍니다.",좋아해요,4
1575544,zz*****,2021-08-24 20:37:34.92,너무 좋아해요~~~,,4
1575118,ha*******,2021-08-23 02:36:14.813,내 삶의 무게를 깨닫다,좋아해요,4
1575324,jh*******,2021-08-21 21:14:20.246,감동을 주는책이에요 좋아요,잘읽어요,4
1575274,cm*****,2021-08-21 00:21:31.816,아이와 함께 읽었는데 계속 생각나는 책같아요,잘읽어요,4
1575459,pp******,2021-08-20 18:12:43.426,아이가 읽자마자 완독을 하네요.,재밌어요,4
1575041,ph********,2021-08-20 09:01:48.596,"살아간다는 것. 살아낸다는 것. 
누구 때문이 아니라 나 스스로 살고 싶어서 살아낸다는 것.
서로 다를지라도 ""함께"" 하는 과정에서 ""우리"" 가 되는 따뜻하고 슬픈 이야기",좋아해요,4
1575184,br*******,2021-08-18 11:12:56.666,아이들과 같이 읽기에도 좋네요,잘읽어요,4
1575484,jo*****,2021-08-17 23:30:41.866,희망은 어떤한 고난도 이겨낼 수 있는 힘이다.,좋아해요,4
1575391,na******,2021-08-17 19:23:05.536,어른이 읽어도 좋은 책입니다.,좋아해요,4
1575580,ye****,2021-08-17 17:22:02.766,소장용으로도 너무 좋아요,좋아해요,4
1575081,ch***,2021-08-17 09:05:38.966,"너무 좋은 책이였습니다
꼭 읽어보세요",잘읽어요,4
1575491,he*******,2021-08-16 13:57:26.893,그림도 글도 너무 예쁜 책이에요. 조카에게 선물했어요.,좋아해요,4
1575487,in*****,2021-08-15 15:08:42.466,감동 동물 사랑 재미 잘 읽혀요,좋아해요,4
1575535,tr*******,2021-08-15 14:45:02.866,감동적이에요. 친구에게도 선물했어요,잘읽어요,3
1575302,ju*****,2021-08-12 09:25:09.45,와이프가 아이랑 읽으려고 산 책이에요.,좋아해요,4
1575360,sg*****,2021-08-10 17:01:25.116,닮은 점이 하나도 없어 보이는 존재들이 서로에게 매달려 울고 또 울면서 걷는다는 것.,좋아해요,4
1575047,py***,2021-08-09 11:57:49.806,마지막 글까지 너무 가슴이 징해져왔어요 감동적입니다 아이는 아직 잘 이해못하는거같아 아쉬웠어요 좀 더 크면 알길바래요,잘읽어요,4
1575333,to******,2021-08-05 12:37:51.523,아이가 재미있게 잘 읽네요.,잘읽어요,4
1575060,mr****,2021-08-03 21:18:00.81,어른과 어린이가 같이 읽을 수 있는 책.,좋아해요,4
1575569,ii*****,2021-08-03 13:12:58.26,"책이 불량이라 맞교환으로 다시받았어요~
아이가 너무재미있다고 하네요!",좋아해요,4
1575069,ew*****,2021-08-01 22:25:04.673,"인간의 욕심, 동물들의 함께 사는 법, 착한 인간은 있어도 그 결과가 항상 좋지만은 않다. 
어린이문학상 대상작이지만, 어린이/청소년/어른/노년이 되어 읽을때마다 새로운 느낌을 갖게 할 그런 책. 

그림이 참 아름답다. 
그리고 망고 열매 색을 가진 하늘이라는 표현이 너무 새롭고도 아름다워 한참을 들여다보았다.",재밌어요,4
1575264,dr****,2021-08-01 10:01:42.253,가슴이 먹먹해지네요...,좋아해요,4
1575075,il********,2021-07-30 12:35:29.643,너무 따뜻한 책입니다 아이가 좋아하네요,좋아해요,4
1575123,jh*****,2021-07-29 22:33:44.116,마음의 평온해집니다.,좋아해요,4
1575224,pk*****,2021-07-29 12:59:41.656,감동적인 이야기네요,재밌어요,4
1575363,fa*******,2021-07-28 23:01:53.27,재미있게 잘 보고 갑니다,좋아해요,3
1575433,se*****,2021-07-27 15:30:47.476,어쩌면 어른에게 필요한 이야기.,좋아해요,3
1575176,ha***,2021-07-26 14:36:55.36,구입한지 꾀 되었는데 그사이 더 유명해졌네요 아이와 함께 읽기 좋아요,좋아해요,4
1575332,bo*****,2021-07-25 22:55:46.69,어른들을 위한 동화입니다.,좋아해요,4
1575246,St*****,2021-07-25 10:54:33.883,어른들에게는 그리 새롭지 않은 이야기일 수 있지만 어린이들은 이 책을 읽고 많은 감정을 느낄 것 같습니다.,잘읽어요,2
1575390,se*******,2021-07-23 17:01:18.923,좋아요좋아요좋아요좋아요좋아요,좋아해요,4
1575550,y8*******,2021-07-23 16:27:04.143,"슬프고 먹먹한 이야기
그림도 아름다워요",좋아해요,4
1575451,fo*******,2021-07-22 14:09:08.236,"슬프면서도 감동적인 이야기네요~
읽으면서 몇번이나 울컥 했습니다
예쁜 일러스트도 감동을 더하네요^^",좋아해요,4
1575499,ss*******,2021-07-21 16:21:32.503,엄마인 제가 읽고 싶어 구입한 책이네요^^,좋아해요,4
1575254,am*******,2021-07-20 06:51:22.49,잔잔하게 감동을 주는 책이네요.,좋아해요,3
1575561,si****,2021-07-19 21:37:20.393,감동적인 이야기네요,좋아해요,4
1575558,hk***,2021-07-18 23:36:25.57,어른에게도 추천하는 책이에요 감동적인책 읽고 지인들에게도 추천했어요  좋아요^^,재밌어요,4
1575398,cj****,2021-07-18 20:25:08.54,가끔씩 동화를 읽는 것도 좋겠구나 하는 생각이 들었습니다. 추천합니다.,좋아해요,4
1575449,su********,2021-07-18 13:26:08.27,마음이 따스해지는 아이와 어른을 위한 동화,좋아해요,4
1575095,rl******,2021-07-18 12:01:40.493,고학년이 되니 감동을 주는 소설을 좋아해요,잘읽어요,4
1575227,yu*******,2021-07-18 09:14:38.603,감동을 쥬는 책입니다. 아이와 같이 읽었어요.,잘읽어요,4
