리뷰번호,회원ID,작성일시,리뷰내용,감정키워드,평점
5506810,cj******,2022-01-03 12:35:05.1,"전부터 읽어보고 싶은 책이었는데
지금이라도 보게 되서 좋네요^^",추천해요,4
5507064,zz*****,2022-01-03 05:15:22.29,감사합니다. 잘 읽겠습니다.,쉬웠어요,4
5506880,se*******,2022-01-02 23:50:22.16,돈에 대해 꼭 알아야 하는 유용한 정보 :) 강추!,추천해요,4
5507100,bi*****,2022-01-01 15:28:21.73,좋아요 잘 읽히고 도움되는 내용,쉬웠어요,4
5506825,jo******,2021-12-30 02:55:41.613,돈과 부자에 대한 생각을 다시 하게 만들어 줍니다,도움돼요,4
5506741,op*******,2021-12-28 22:24:38.67,"올해 읽은 책 중에 최고네요. 편하게 읽을수 있고, 동시에 곱씹어볼 메시지가 많아서 누구에게나 도움이 될 것 같네요.",도움돼요,4
5507017,sw****,2021-12-27 23:10:42.916,읽다보면 많은 생각을 하게 되네요 !,쉬웠어요,4
5507080,po*******,2021-12-26 15:18:18.983,좋아요~!좋아요~!  좋아요~!,추천해요,4
5506795,hy******,2021-12-26 10:39:03.846,부자=생존=리스크관리,집중돼요,4
5506828,km******,2021-12-25 11:40:46.796,천천히 읽고 도움되길,쉬웠어요,3
5506781,sp*******,2021-12-20 23:57:17.893,"당신은 왜 부자가 되지 못했는가.
진정한 부를 이해하고 부를 얻을 수 있는 나침반 같은 책",집중돼요,4
5506750,an********,2021-12-16 10:01:42.963,모든 재테크의 기본서,추천해요,4
5506818,ju*******,2021-12-10 14:43:02.373,추천받아서 읽게된 책이에요~~,도움돼요,4
5507117,dy*******,2021-12-09 12:20:58.263,남들이 많이 읽어서 읽어보려구요.. 좋은 내용일듯..,집중돼요,4
5507067,le*****,2021-12-09 11:58:47.916,아직읽기전이지만  좋은내용으로 기대합니다,추천해요,4
5506748,th*****,2021-12-08 23:15:33.866,투자를 하고자하는 사람들의 심리를 잘 기술해놓으면서 어떤 마음가짐으로 투자를 해야하는지 쉽게 깨닫게 해준다. 쉽지만 실천이 어려운게 투자인데 부화뇌동할때마다 읽어야하는 책이라고 생각한다,추천해요,4
5506858,mi*******,2021-12-07 08:22:54.9,와 이거 책을 왜 이렇게 만들고 왜 이렇게 늘려놨지? 아!  이가격을 붙이기 위해 이렇게 늘려놨구나 싶은 실망스러운 책,,1
5507109,rr******,2021-12-05 11:17:32.96,이제 막 성인이 된 내가 가져야 할 돈에대한 관념을 형성하는데 도움이 되었습니다,집중돼요,4
5506821,du******,2021-12-04 22:27:51.363,읽히기 쉽진 않아도 유익합니다,집중돼요,4
5507116,yo******,2021-12-03 16:51:33.246,열심히 한번 읽어보겠습니다,쉬웠어요,4
5506946,mu*****,2021-12-03 00:02:02.216,"훌륭한 작가의 글로써 너무나 잘 읽혔습니다.
흥미로운 아이디어와 실용적인 이야기! 정말 추천합니다.",도움돼요,4
5507124,di*******,2021-12-02 09:58:31.74,잘 읽겠습니다! 유용할거같아요!,추천해요,4
5506730,na******,2021-11-28 13:29:25.876,주변에서 추천해준 책이라 역시 유익했습니다,도움돼요,4
5506801,en********,2021-11-27 10:13:49.87,돈과 재테크에 대한 개관이 잘 되어 있는 책이었습니다^^,추천해요,4
5506957,kc*****,2021-11-26 21:47:16.8,올해만큼 돈을 주제로 발간된 책이 쏟아져 나온해가 있을까 할 정도로 이른바 개나 소나 책을 낸 것 같다. 이런 출간러시중 이 책만큼 내용과 생각에 공감하는 책을 본적이 없었다. 말그대로 군계일학이다,집중돼요,4
5506915,kd****,2021-11-26 21:26:12.346,주식 시작하며 읽어야 할 필수책,집중돼요,4
5506796,sc******,2021-11-25 12:01:12.256,월부 추천도서 잘 읽었습니다.,추천해요,4
5506849,gi****,2021-11-23 14:13:52.743,친구의 추천으로 기대가 됩니다.,도움돼요,4
5507092,na******,2021-11-20 17:28:38.683,원로님께 추천 받은 책. 오나전 긋긋긋,집중돼요,4
5507069,ge*******,2021-11-19 20:00:53.663,시간이 너희를 부유케 하리니,도움돼요,4
5506987,ba*****,2021-11-19 18:55:37.466,"스토리텔링 대박입니다.
재밌네요.",도움돼요,4
5506940,df******,2021-11-19 16:07:47.543,유익한 내용 잘 읽었습니다,집중돼요,4
5506846,ur********,2021-11-18 16:27:56.57,리뷰가 워낙 와 닿아서 정독하고 싶어서 구매했어요,집중돼요,4
5507014,jm*****,2021-11-18 12:34:10.406,"돈의 심리학, 좋아요",집중돼요,4
5507034,lb****,2021-11-17 15:33:22.513,"35살, 이제라도 돈공부를 시작하기 위해 선택한 책입니다.",추천해요,4
5506803,ke******,2021-11-17 08:18:29.85,돈이란 무엇인가? 라는 물음을 던질수 있는데그것에 대한 답이 될수 있네요.,도움돼요,4
5506964,yz****,2021-11-17 01:52:06.106,"돈에도 심리가 있어, 자본이 흘러가는 흐름을 느낄수 있었다.",,4
5507106,ch*******,2021-11-14 13:01:15.343,어쩌면 가장 기본적인 것이요. 투자 아니더라도 살아가는데 필요한 기본적인 것들. 재미있게 잘 읽었습니다.^^,추천해요,4
5506780,ky*******,2021-11-14 09:16:51.806,돈의 관해서 그동안 갖고 있던 생각을 많이 바꾸게 됐습니다,도움돼요,4
5506976,ha*****,2021-11-11 14:24:22.41,돈에 대하여 인간의 심리가 얼마나 영향을 미치는지 새삼 다시 알게 해주네요,추천해요,3
5507145,ke********,2021-11-09 21:44:31.183,돈의 대한 생각을 새로 갖게 해주는 책이라 좋네요~!,집중돼요,4
5506804,sw******,2021-11-05 20:14:25.706,"아무 생각 없이 읽었는데, 정말 하워드 막스급 지혜네요. 훌륭합니다.투자에 대한 입문서로 사실상 완벽합니다.",쉬웠어요,4
5506839,hc***,2021-11-03 22:26:04.786,요즘 핫한책 일단 계속 읽어보려구요,추천해요,3
5506831,hu********,2021-11-02 16:36:15.516,부자를 만드는 심리는 어떤 것인지 읽어볼 수 있습니다.,집중돼요,4
5507152,aw******,2021-11-01 16:33:29.343,늘 궁금했던 돈의 심리  기대합니다,추천해요,4
5506728,ba*****,2021-11-01 14:27:02.233,간만에 뻔하지 않은 투자 책이 나온 것 같아요. 술술 읽히네요,쉬웠어요,4
5507128,tk*******,2021-11-01 12:08:50.436,소장하고 싶어서 구매했습니다,집중돼요,4
5506859,se*****,2021-11-01 07:12:41.383,두꺼운 책이지만 금방 읽엇다 저자의 논리적인 의견 전개에 감탄!,추천해요,4
5506786,ko********,2021-10-30 10:02:07.82,서평대로 매우 만족합니다,집중돼요,4
5506926,le*****,2021-10-26 10:13:24.75,정말 많은 도움이 됩니다~,쉬웠어요,4
5506933,hu****,2021-10-26 09:06:00.143,돈에 대한 생각을 넓힐 수 있는...,도움돼요,4
5507148,in****,2021-10-25 23:26:03.57,"내 인생 최고 경제 인문 서적.
돈 벌고 싶다고 상담오는 후배들 이거 읽고 독후감 써오는거 보고 시작함.  명언 몇 개는 좌우명처럼 외우고 다닙니다. 꼭 보세요.",집중돼요,4
5507104,sl******,2021-10-23 07:11:55.673,투자자에게 꼭 필요한 심리적 인도를 제공하는 책,추천해요,4
5506867,lo********,2021-10-22 21:54:35.226,읽고나서 잊지않는다면 흔들림없는 투자가 가능할것같다,집중돼요,4
5506955,ir******,2021-10-21 16:16:17.14,좋은책입니다 감사합니다,집중돼요,4
5506758,ra*******,2021-10-20 10:50:08.746,너무 술술 잘 읽혀서 너무 가벼운 내용인가 싶지만 어느 부분을 읽어도 생각을 많이 하게 되는 책 책 제목만 보고는 여타 뜬 구름 책들처럼 손이 가지 않다가 결국 사보게 되었는데 왜 이제 읽었을까 아쉬웠던 책 다른 리뷰어들의 글처럼 부제가 글 내용을 가리는 느낌,도움돼요,4
5506937,fo****,2021-10-20 10:48:03.166,`투자의 심리학`이라고 하는 게 맞을 듯...,집중돼요,4
5506807,ra******,2021-10-15 10:11:14.893,잘 읽히고 어렵지 않아요,도움돼요,4
5506757,ch******,2021-10-14 17:28:32.64,전자책으로 읽은 후 소장용으로 추가구매했어요.,추천해요,4
5507028,pa******,2021-10-11 18:07:43.286,인생 책입니다. 이제라도 읽어볼 수 있어서 너무 좋았습니다. 단순히 돈에 대한 관념을 바꾸는걸 넘어서 인생 방향을 정해주는 것 같았습니다. 번역도 깔끔해 잘 읽혔습니다.,추천해요,4
5506983,in******,2021-10-08 09:12:07.3,"평범한 직장인, 생활인이 평범한 일상을 누리면서 현실적으로 경제적 자립을 이루어내는데 도움이 되는 확실한 조언이 가득한 책",추천해요,4
5507038,jh******,2021-10-06 16:20:18.123,정말좋은책입니다 진짜로,집중돼요,4
5507027,mc***,2021-10-02 13:39:09.433,하도 하우절 하우절 궁금해서 사봤네요,쉬웠어요,3
5507052,zs****,2021-09-29 20:27:11.886,투자하기전에 마음을 준비하기 위해 읽습니다,집중돼요,4
5506945,eu********,2021-09-28 00:22:02.843,"문장 문장마다 뼛속에 새기고 싶음!
그런 구절이 많아서 진짜 좋았고
그래서 정독하게 되었다",쉬웠어요,4
5506787,sa********,2021-09-26 15:58:48.743,"다양한 투자서적을 읽었지만,  
이 책에서는 다양한 사람들의 삶을통해서 인생에대한 교훈을 들려준다

 '돈의심리학'이란 제목은 이 책 내용의 어떤것도 대변하지 못함",추천해요,4
5507057,hy********,2021-09-21 23:25:03.4,투자하는사람에게 필독서입니다,집중돼요,4
5506913,no********,2021-09-14 16:14:13.26,내용도 재미있고 만족합니다^^,집중돼요,4
5506929,hj******,2021-09-07 03:49:53.88,제 인생에 자양분이 된 좋은 책입니다.,쉬웠어요,4
5506765,ji*****,2021-09-05 01:10:24.83,e북으로 먼저 듣고 정독해보려 합니다.,쉬웠어요,4
5507138,kp********,2021-09-04 21:29:04.73,재미있게 잘 읽었습니다.,쉬웠어요,4
5506744,yp******,2021-09-04 15:14:57.626,좋아요 아주 좋은 서적입니다^^,집중돼요,4
5507135,ch*******,2021-09-02 15:02:38.986,"복리의 혜택을 가장 쉽고 확실하게 알려주는 책, 성공하고 행복하게 살고 싶다면 반드시 읽어야 하는 책입니다.",집중돼요,4
5507044,te*******,2021-09-02 10:35:52.173,요즘 유행하는 따라잡기 시리즈 등의 책과는 결이 다른 책입니다. 한번 쯤 읽어볼 만한 책입니다.,추천해요,3
5507142,cy*****,2021-09-01 13:04:46.816,잘 읽혀집니다! 감사합니다,집중돼요,4
5507068,ru******,2021-08-28 19:56:35.24,일부 페이지가 뒤집혀서 인쇄되었네요.,,3
5506873,ve********,2021-08-25 15:51:53.446,투자자라면 한번쯤 읽어 볼만한 책이에요,도움돼요,4
5506842,jj*****,2021-08-22 20:23:14.776,새로운 시각으로 바라볼수 있어서 좋았습니다.,집중돼요,4
5506887,fa*****,2021-08-22 00:03:17.6,돈에 관심이 있는 모든 사람들을 위한 책,집중돼요,3
5506785,so*****,2021-08-19 09:23:20.593,도움이 많이 되는 좋은 책입니다.,추천해요,4
5507053,ch********,2021-08-19 07:42:37.863,오래전부터 보관함에 담아뒀다 이제야 읽어보게 됐지만 빨리 읽을걸 후회중에 있습니다 ㅠ,도움돼요,4
5507058,se*******,2021-08-16 15:03:47.46,돈 뿐만 아니라 인생을 살아가는데 있어서도 어떤 태도를 지녀야 할지 생각해보게 되었습니다.,도움돼요,4
5507112,pr******,2021-08-13 16:30:32.596,명품 심리학 꼭옥 읽어 보시길 바랍니다.,집중돼요,4
5507147,yo******,2021-07-27 07:05:07.55,"아버지 생신 선물로 잘 맞았습니다,",집중돼요,4
5506853,ja******,2021-07-22 20:55:36.666,그냥 잘 읽이고 전체적으로 내용이 설득력이 있지만 깊이는 없네요.,도움돼요,3
5507144,j6*****,2021-07-22 08:19:46.81,읽어보세요 나쁘지 않습니다,,3
5507062,ad*****,2021-07-19 08:40:58.4,정말 잘 읽히고 배울 점이 많습니다. 추천하고싶은 책입니다.,도움돼요,4
5506897,eh*******,2021-07-15 10:03:01.583,가히 복음서라 할 만 합니다!!!! 평생 함께 할 책!!!,집중돼요,4
5506892,ky*****,2021-07-10 16:04:45.316,추천받아서 읽었습니다 초보자도 읽을 수 있는 쉬운 책!,추천해요,4
5507093,ap*******,2021-07-04 15:48:59.75,술술 잘 읽혀서 좋습니다. 추천합니다 &#55357;&#56397;,도움돼요,4
5506788,fo********,2021-07-01 15:16:24.48,깊은 통찰을 주는 책. 두번 읽을거에요,추천해요,4
5506835,44***,2021-07-01 09:11:55.34,투자에 대햐 가장 합리적인 계획을 세울수 있는 책 입니다,집중돼요,4
5507041,th*****,2021-06-28 09:47:38.81,"주변 모든 사람들에게 한 번 읽어보라고 권하고 싶은 책이네요...돈을 버는 재테크가 아닌 그 전에 생각해야 할 돈에 관한 개인의 자세(?), 철학을 세우는데 정말 유용한 책인 것 같습니다.",집중돼요,4
5506826,pr********,2021-06-23 15:18:14.593,투자의 정석을 보여주는 귀한 지침입니다,최고예요,4
5507085,06******,2021-06-22 16:33:03.996,경제 공부할 수 있어 좋았습니다,집중돼요,3
5506904,dy***,2021-06-20 20:20:59.73,읽을만합니다 기본에 충실,쉬웠어요,3
5506768,dc***,2021-06-18 11:38:58.866,술술 잘 읽힙니다.,집중돼요,4
5507075,mu*****,2021-06-10 06:49:28.653,"어렵지만 좋아요 
한번 읽어볼만합니다",추천해요,4
5507061,mu***,2021-06-05 14:22:12.573,돈에 대해 생각해 볼 수 있어서 나름 읽어 볼만한 책이라 생각됩니다.,집중돼요,4
5506877,fo*****,2021-06-03 02:26:46.526,요즘 가장 힘든것이 돈이고 경제인것같아요 열심히 잘 읽고있아요,쉬웠어요,4
5506997,li*****,2021-05-30 15:46:03.16,추천이 정말 많아서 샀어요. 아껴두고 읽고 싶은 책이에요.,집중돼요,4
5507137,ba*****,2021-05-25 10:39:40.863,돈을 대하는 태도에 대해서 많이 생각하게 하는 책,집중돼요,4
5506771,wo******,2021-05-24 11:57:30.213,돈의 심리학에 대해 배웠습니다,도움돼요,4
5506814,el******,2021-05-19 15:45:56.776,"술술 잘 읽히고, 돈과 부에 대해 내가 가지고 있던 개념을 돌아볼 수 있었다.",도움돼요,4
5507012,se****,2021-05-17 20:10:45.126,투자 철학을 세우고자 할 때 도움이 많이 됩니다,추천해요,4
5506973,bv********,2021-05-16 21:04:28.61,읽어볼만한 책이라고 생각됩니다,집중돼요,4
5507122,ka***,2021-05-14 05:45:07.686,요즘 이쪽으로 관심이 생겨 구매했습니다^^,집중돼요,4
5506893,ho*****,2021-05-11 22:55:04.806,알기 쉽게 정리되어 있어요,도움돼요,4
5507042,ra***,2021-05-04 09:08:41.696,돈에 대해 생각할 수 있는 좋은 책,집중돼요,4
5506819,10******,2021-05-03 23:29:45.886,"일반적인 돈에 관한 책과는 다른 심리에 기반한 견해를 보여주고 있어서 추천합니다.
꼭 한 번 읽어보세요~",최고예요,4
5506980,go******,2021-05-03 13:54:30.956,투자에 아주 실용적인 책입니다,집중돼요,4
5506797,hc*****,2021-05-03 09:03:13.17,읽고 싶던 책을 구매해서 읽고 있습니다. 다 읽고 나서 디 리뷰 남길게요,집중돼요,4
5506886,tw******,2021-05-02 18:32:56.39,유익한 독서였습니다.,추천해요,3
5506794,aw*******,2021-05-02 08:33:51.153,돈을 알고 싶다면 읽을 것,추천해요,4
5506969,so*****,2021-04-30 20:57:04.74,"자산,재테크,노후준비에 대한 생각과 틀을 잡아준 고마운 책",추천해요,4
5506864,b1******,2021-04-30 15:44:10.956,선물로 드렸는데 좋아하시네요^^,집중돼요,4
5506761,hu****,2021-04-30 03:49:49.16,투자시 멘탈 잡는데 도움되요,추천해요,4
5507072,on*****,2021-04-29 18:37:56.753,내용이 그리많지 않아 하루만에 다읽었습니다. 단순하지만 명료한 돈의 철학에대해 이야기 형식으로 풀어나가는게 흥미롭네요,도움돼요,3
5506805,go****,2021-04-29 11:58:08.63,더 빨리 알아내서 읽었을 걸 하고 내내 정독하며 아쉬웠습니다. 꼭 읽어보세요. 추천합니다.,최고예요,4
5506845,sd****,2021-04-29 05:32:20.1,"책 제목. 표지. 이미지에 이책 주문했었는데..
아~~~ 책 속에 빠져들만큼 정보도 아니고.. 다시 생각 날 만큼 글귀도 아닌거같고.. 

책 표지는 참 잘 만든건 맞는거같ㄷㄱㆍ",,1
5506991,ja******,2021-04-28 10:21:39.7,이 책을 사길 잘했다는 생각을 했습니다. 혼자 생각하고 있는 돈의 개념과 관리에 대해 다시 생각하고 정리하고 배울수 있어서 좋았습니다.,쉬웠어요,4
5506962,s0****,2021-04-26 10:04:51.47,결론은 차입하지 마라! 진리네요,도움돼요,4
5507049,im*****,2021-04-24 00:20:47,여러가지 생각이 많아지는 부분이 있습니다 ^^,추천해요,4
5506760,ke*****,2021-04-22 12:59:43.616,요즘 세상이 어떻게 돌아가는지 돈이 문제가 되는 듯 한데 지인 추천으로 읽어봅니다. 돈에 무지한 저에게 빛이 되길 바라며.,쉬웠어요,4
5506862,ch*******,2021-04-19 21:41:00.41,"원론적인 얘기일 수 있지만 절대 간과해서는 안 되는 내용이 많다. 절약과 리스크 관리, 그리고 겸손의 중요성을 환기시켜주는 고마운 책. 지인들에게 추천하고 싶다.",추천해요,4
5506939,ju******,2021-04-19 21:05:21.333,좋아요. 도움이되요,추천해요,4
5506776,ta*****,2021-04-19 10:30:22.45,돈이 어떻게 굴러들어올지 계획을 세우게 되는 책,도움돼요,4
5506789,sn********,2021-04-19 10:27:27.26,읽기에 무난한 내용입니다,도움돼요,3
5506978,co******,2021-04-17 18:18:55.466,돈에 대한 심리를 잘,추천해요,4
5506984,ju********,2021-04-16 10:01:17.76,돈의 심리학이 어떤지를 작가 나름대로의 시각에서 볼 수 있었다,도움돼요,4
5506934,ke*****,2021-04-14 22:31:09.966,투자하기 전 꼭 읽어야하는 책이라고 생각합니다. 마음을 다잡는데 큰 도움이 되었습니다.,집중돼요,4
5507035,un*******,2021-04-09 11:34:20.16,어렵지 않게 쓰여서 읽기에도 좋고 내용도 좋아요.,도움돼요,4
5506996,vi*******,2021-04-05 00:31:34.103,도서관에서 대출해서 읽고 소장해서 여러번 읽고 싶은 책이라 구입했어요. 왜 여기저기서 추천하는지 알겠네요.,추천해요,4
5507127,dw********,2021-04-04 14:21:49.99,내가 왜 부자가 되지 못했는가?  누군가가 나에게 속삭인다. 옆에 두고 반복적으로 읽으며 행동으로 실천하라고,쉬웠어요,4
5507110,ny*****,2021-04-04 11:58:19.93,순식간에 읽어버렸습니다. 내용은 좋은데 책제목이좀...,도움돼요,4
5506772,pr*******,2021-04-02 09:20:10.523,&#49873;게 내용이 잘 풀어져 좋아요~,집중돼요,4
5506879,dk***,2021-04-01 16:12:32.833,내용 정말 좋고 일독권합니다.,집중돼요,4
5506921,ko******,2021-04-01 12:59:34.836,추천해주는 사람이 많은 이유가 있는 책이였습니다,추천해요,4
5506979,gh****,2021-04-01 00:40:15.953,재밌어요,집중돼요,4
5506943,kk*****,2021-03-31 20:29:15.503,내용이 딱딱하지 않고 간결하게 설명되어 있어서 좋습니다.,도움돼요,4
5507096,tw*******,2021-03-31 10:45:38.586,최고입니다~~!!,집중돼요,4
5506806,ca****,2021-03-29 11:14:20.656,동생이 존리님 유&#53933;보고 사달라고해서 사줬는데 좋다고 하네요!,최고예요,3
5506740,co********,2021-03-29 01:08:39.776,통찰력이 생겨요,집중돼요,3
5506967,mt*****,2021-03-28 14:33:26.953,"천박하지 않은, 생각하게 해주는 책",집중돼요,4
5507095,ti********,2021-03-28 14:12:18.626,나의 심금을 울리는 유일한 경제책,집중돼요,4
5507143,ag****,2021-03-28 09:45:55.793,"지인이 보고싶다고 해서 선물했어요.
잘보고 있대요^^",집중돼요,4
5506871,ho*****,2021-03-25 13:31:07.566,돈에 대한 심리를 잘 설명한 책,집중돼요,4
5507006,cl*****,2021-03-25 11:10:02.863,오늘 같은 시국에 더욱 어려워진 경제...이 정돈 알고 가자! 필독!,,4
5507098,ji*******,2021-03-23 22:02:28.13,2021년 3월 나의 책♡,집중돼요,4
5506875,ns*****,2021-03-23 15:44:35.24,좋아요!,쉬웠어요,3
5507036,se********,2021-03-23 13:19:09.87,돈에 대해서 다시 생각해보게 되는 책입니다. 매우 유익합니다.,도움돼요,4
5506823,ry********,2021-03-23 02:49:04.84,내가 생각해오던 것을 확인하게 해주는 것 꼭 봐야함,최고예요,4
5506918,be*******,2021-03-22 18:20:57.373,돈과 사람의 공포나 불안이 어떻게 작용하는지 잘 보여주는 듯 합니다,도움돼요,4
5507022,dk*******,2021-03-20 11:55:40.73,잘봤어요,집중돼요,4
5506723,ne*****,2021-03-17 18:46:26.546,돈에 관한 수많은 책을 샀지만 이 책만큼은 그 중에서도 최고다! 쉽고도 빠르게 돈에 관한 20가지를 읽다 보니 이 책은 보통 내공이 아니다. 자연스럽게 이 책을 쓴 모건 하우절의 다음 책이 벌써부터 기대된다.,도움돼요,4
5506981,tj*****,2021-03-17 09:17:17.67,돈에 대하여 자세히 알 수 있어 좋습니다,집중돼요,4
5507043,af********,2021-03-16 23:09:49.713,인식하지못하는 부분들 잘 짚어주는 꼭 필요한 책입니다,쉬웠어요,4
5506950,nj****,2021-03-16 14:03:28.513,좋은 책 입니다.,집중돼요,3
5506966,by*****,2021-03-15 09:24:25.403,"내용이 좋는것 같아요
돈에 대한 샛각을 다시 한번 더 생각하게 되네요",쉬웠어요,4
5507074,ab********,2021-03-14 23:24:09.596,"미드 시리즈는 보는 것 같다.
한편 끝나면 다음편이 기대되는....",최고예요,4
5507046,km******,2021-03-14 16:40:40.796,돈과 부의 축적에 대한 평정심을 줄 수 있는 책이라 생각한다. 또한 가독성도 좋아 빠르게 읽을 수 있었다.  책을 잃고 각 내용에 개인 의견을 달아 성인이 된 자녀들에게 보여주고 다시 구매하여 한 권씩 선물하였다.,추천해요,4
5507048,eu*****,2021-03-12 20:08:15.53,"잘받았어요. 단, 책이ㅠㅠ 안에 꽁꽁 싸매시면서 구겨졌나봅니다.ㅠ 읽는데는 문제없어서 괜찮지만 표지가 좀 구겨졌네요ㅠㅠ",,3
5507078,hj*****,2021-03-11 17:57:40.503,도움됐어요!,추천해요,4
5506725,si*****,2021-03-10 13:39:40.673,수준 높은 통찰을 쉽게 전해주는 내공,집중돼요,4
5506922,co********,2021-03-09 19:34:02.666,좋아요~,집중돼요,4
5507076,mo********,2021-03-08 08:53:23.226,"주식을 하는데 있어 욕심, 탐욕으로 인해 파산하는 경우가 많습니다. 안전마진 등 적절한 포트폴리오 구성으로 모두가 부자되기를 기원합니다.",집중돼요,4
5507101,an*******,2021-03-06 11:27:25.79,"재미있고 잘 읽혀요
중심 잡는데 도움되요",도움돼요,4
5506974,ya*****,2021-03-06 10:09:43.726,"내가 바라보는 시각을 바꿔줄 수 있는, 생각의 변화를 일으키게하는 마중물이 될  만한 책이다.
여러 번 정독하길 추천합니다.",최고예요,4
5506900,oh****,2021-03-06 09:09:30.183,한번쯤 읽어보면 좋은 도서네요,추천해요,4
5506736,ss****,2021-03-02 22:53:41.886,돈에 대한 자세와 그것을 버는 주체인 우리가 가지고 있어야 할 마인드랄까.. 무리없이 잘 조명해주고 있다.. 책의 제목은 너무 상업적 접근보다는 원서가 가지고 있는 맥락을 살리는 범위 내에서 정하면 좋갰다.,추천해요,4
5506726,he*****,2021-03-02 13:12:11.79,"부자가 되는 것도 어렵지만, 부자로 남는 것도 어렵다.
꼭 명심할 부분이 곳곳에 있으니 정독하고 정독해야 한다.",쉬웠어요,4
5506911,mu*******,2021-02-28 10:17:49.906,"돈에 관한 책들을 작년부터 꾸준히 읽기 시작했어요 요즘 트랜드이기도 해서 돈의속성, 존리책, 부자아빠 시리즈, 레버리지 부의 추월차선 등등 근데 이 책은 끝판왕입니다. 저의 가치관과 부합되고 특히 돈은 심리다라는 말에 너무 공감이 됩니다. 트레이너로 돈을 벌던 부동산으로 벌던 저마다 자기한테 맞는 수단이 있겠지만 별로 공감이 안갔는데 이책은 저에게 정말 돈에 대한 완성이였습니다.",집중돼요,4
5507033,dn******,2021-02-27 12:50:03.173,돈에 대한 다양핫 관점이 당연하고 이런 가치관이 환경과 시대를 반영한자는 것이 공감되고 좋아요~,최고예요,4
5506990,ca*******,2021-02-27 10:07:27.76,많은 도움이 되었습니다.,추천해요,4
5507118,k0****,2021-02-25 19:15:21.333,나는 부자가 되겠다,집중돼요,4
5507082,na*******,2021-02-25 10:49:54.123,읽어보고 또읽어봐야할거같아요.  지금  현재  돈에대해서 많은생각을 하게되는거같아요. 자기맘을 다스리는거 그게 젤로 힘든부분이 아닐까싶어요.저에겐 그게 많이 힘든부분이에요.ㅠ,집중돼요,4
5506811,dl********,2021-02-24 14:32:11.903,투자의 핵심은 심리,집중돼요,4
5507134,le********,2021-02-22 20:42:21.946,좋은책 감사합니다~,도움돼요,4
5506919,du****,2021-02-22 10:08:24.356,"부제가 맘에 안들지만, 내용은 정말 흥미롭네요.  돈에 대한 새로운 이야기",추천해요,4
5506909,qu***,2021-02-21 13:25:57.943,도입부부터 이렇게 술술 잘 읽히다니 놀랍습니다!!,도움돼요,4
5506792,li*****,2021-02-21 11:55:54.473,간만에 좋은 책 샀습니다,집중돼요,4
