리뷰번호,회원ID,작성일시,리뷰내용,감정키워드,평점
5315356,du*******,2022-03-09 22:17:05.673,[스포 없는 리뷰 대회]과학자 데이비드 스타 조던의 전기문인 줄 알았다. 샌프란시스코 대지진 속에서도 어류의 분류에 집착했던 과학자. 그렇지만 이 책은 그의 과학적 성과를 넘어 &#39;존재&#39;의 의미&#39;에 대한 질문을 던진다. 인간중심적 과학의 오류를 집는다. 이정도면 철학책이라고 해야 하지 않을까? 독자들 각자가 자기만의 기준으로 이 책을 분류해야 할 것이다. 우리 각자의 시각에 따라 책은 진화할테니 말이다. 마지막 책장을 덮고서야 책 제목에 무릎을 치게 된다.,최고예요,4
5315348,he******,2022-03-09 16:06:14.866,"[스포없는리뷰대회] 책의 앞부분만 읽었다면 데이비드 스타 조던의 전기 또는 그의 과학적 연구성과에 대한 찬양 글이라고 생각되었을 것입니다. 그러나 중요한 것은 부인의 죽음에도, 자식의 죽음에도 의연하게 보였던 열광적인 우생학자로 인해, 그의 기만으로 인해, 낙관적인 방패로 인해 인간 마저도 계층 사다리에 올라타게 되었다는 것입니다. 흑인과 혼혈, 히스패닉과 함께 미국 원주민, 정신질환을 앓고 있는 사람들이 인간의 분류에서 하위를 차지하고 진화를 위해, 퇴화 되지 않기 위해 이들을 더이상 번성하지 못하게 만들어야 한다는 개념이 자라납니다. 도시의 부랑자들, 범죄자들은 물론 성소수자, 성 개념에 문제가 있는 어린 아이들까지 수감을 시키고 어떤 설명이나 동의도 받지않고 불임화를 법의 이름으로 자행합니다.

룰루 밀러는 데이비드 스타 조던의 전기를 따라가다 캐리 벅이 불임화를 당했던 바로 그 건물이 있는 수용소에서 1967년 똑같이 불임화를 당한 당시 열아홉 살 애니가 생존해 있다는 소식을 듣고 그녀를 방문합니다.

박물학자에 의해 분리되었던 외피 중심의 물고기란 사실 존재하지 않습니다. 외형상으로 날개 달린 설치류와 같이 보이는 박쥐가 오히려 낙타와 더 유전적으로 유사한 종인 것처럼, 소와 연어와 폐어 중 유사성이 떨어지는 것은 허파 호흡을 하지 않는 '연어 ' 인것처럼, 태어날 당시엔 뇌를 가지고 있다 정착하며 뇌를 퇴화시키는 멍개가 오히려 변이를 통해 진화한 생물인 것처럼 분리 된 사다리는 존재하지 않으며 오히려 우성인자로 동일화 된 생물은 곧 사라지게 됩니다.

왜 이책을 읽어야 하는지는 읽어 본 사람만이 장담할 수 있습니다. 별을 포기하면 우주를 얻을 수 있는 것 처럼 물고기를 포기하면 과연 우리는 무엇을 얻을 수 있을지 궁금하면 꼭 읽어보시길.

#물고기는존재하지않는다 #룰루밀러 #정지인_옮김 #곰출판
#책추천 #책스타그램 #과학 #분류학 #종의기원",추천해요,4
5315415,mi********,2022-03-09 14:06:16.27,생각을 깨우쳐주는 책이었어요,쉬웠어요,4
5315556,19*****,2022-03-09 13:13:21.803,"딸이 사달라고해서
사줬는데
잘읽고있어요",추천해요,3
5315516,so******,2022-03-09 11:32:42.443,"[스포 없는 리뷰 대회] 어떻게 이 책을 비단 과학 에세이로만 한정지을 수 있을까? 조던의 삶을 훑는 작가의 집요함과 섬세함에서 이는 이미 훌륭한 평전이며, 중반을 넘어 보이는 기가막힌 캐릭터의 반전에서는 훌륭한 서스펜스이다. “과학” 에세이에서 기대하기 어려웠던 가장 의외의 면모는 이 책을 두번째까지 읽고나서야 비로서 보이게 된 문학적 특성이다. 물고기의 살을 뚫고 직접 이름표를 피부에 새기던 조던의 바느질과 애나의 배를 성의 없이 꼬매놓은 바늘땀. 바늘을 매개로, 기나긴 산문시라 볼 수 있는 책 전체를 관통하는 거대한 환유를 발견하면서, 책의 저자인 룰루 밀러가 말하고자 하는 바를 자신의 책을 통해서도 몸소 실천하고 있다는 것을 알게 됐다. 한계가 없는 책, 서점의 그 어떤 코너에 두어도 자연스럽게 녹아들 책.책 후반에서 ‘민들레 법칙’을 말하며 어린 시절 저자에게 잔인한 가르침으로 남은 “넌 중요하지 않다”에 반기를 든다. 인간으로서 우리 모두는 어쩌면 대자연에게 있어 개미 한 마리 만큼의 중요성도, 효용도 존재하지 않을 수 있다. 하지만 애초에 “중요하다”는 개념 자체는 너무나 주관적이며, 모두 찾지 않는 잡초같은 민들레가 이 세상에 단 한 사람이 애타게 찾고있는 약초로 쓰일 수도 있다. 이렇기에 우리 모두는 중요하고, 소중하다. 좋아하는 영화의 대사를 쓰며 리뷰를 마치고 싶다. 우리 모두는 눈빛을 공유하고 관계를 맺은 순간 모든 이야기와 소설의 공동 집필자이다. 그렇게 우리는 서로에게 중요한 존재로 빚어지며 살아간다.“Why are you making everyone die?”“It’s my story.”“Mine too.”-The Fall(2006)",최고예요,4
5315550,ks*****,2022-03-09 11:12:55.313,끝까지 읽어야한다고 해서 참고 읽었는데 그저그랬어요....,,3
5315465,to******,2022-03-09 08:38:04.12,"추천받아서
구입해봤는데
흥미롭네요~^^",최고예요,4
5315478,ju******,2022-03-08 21:10:19.103,물고기는 존재하지 않는다,,4
5315349,pr*****,2022-03-07 11:03:22.356,"[스포 없는 리뷰 대회]한 치 앞을 알 수 없는 전개, 천재적인 구성, 하나둘 베일을 벗는 비밀, 마음을 울리는 인물들…. 소설이냐고요? 아닙니다. 놀랍게도 이 책은 논픽션입니다.책을 한 문장으로 요약해 봅니다. “좌절을 겪은 저자가 어떤 분류학자를 조사하면서 자기 삶을 돌아보고 세상을 보는 새로운 시각을 얻게 된다.” 그런데 그게 또 전부는 아닙니다. 룰루 밀러는 우리에겐 생소한 분류학자 데이비드 스타 조던의 일화로 이 책을 시작합니다. 데이비드는 인류에게 알려진 어류의 5분의 1을 발견했을 정도로 분류학에 한 획을 그은 인물이지요.밀러는 데이비드의 생애 중 지진이 그의 삶을 뒤흔든 순간에 주목합니다. 그는 평생의 업적이 수포로 돌아갔음에도 좌절하지 않고 제 할일을 계속합니다. 밀러는 의문을 품지요. “무엇이 그로 하여금 절망하지 않게 만든 것일까? 그걸 알 수 있다면 나도 소중한 것을 되찾을 수 있지 않을까?” 그렇게 이 책은 작가가 어느 분류학자의 삶을 통해 우리에게도 중요한 메시지를 전해 주리라는 기대를 품게 합니다. 그러니까 진실이 제 모습을 드러내기 전까지는… 말이죠.밀러는 과학, 철학, 정치에 걸친 거대한 주제와 자신을 비롯한 개인의 삶을 놀랍도록 유기적으로, 아름답게 엮어냅니다. 망원경과 현미경을 함께 든 시인이랄까요? 그러면서 탁월한 구성으로 독자를 사로잡기도 합니다. 아마 밀러는 처음부터 데이비드가 어떤 사람인지 개략적으로는 알았을 겁니다. 몇 년에 걸쳐 그를 조사하며 그의 심연을 대면했겠지만요. 밀러는 의도적으로 그에 관한 정보를 조금씩 흘리며 궁금증을 불러일으킵니다. 괜히 과학 ‘스릴러’로 분류되는 게 아닐 만큼 그 솜씨가 뛰어나지요.차기작이 기대되는 작가 룰루 밀러는 자기 이야기를 할 땐 솔직하고 주관적인 관점을 드러냅니다. 실수의 수치, 진실 앞에서의 머뭇거림, 분노와 복수심(로맨스도)을 그대로 보여주지요. 그런 인간적인 면이 이 책에서 우리가 받아들이기 힘들 수도 있는 진실을 마주하는 데 도움이 되기도 했던 것 같습니다.",도움돼요,4
5315440,vi*******,2022-03-06 23:23:53.813,나름 흥미롭게 읽었어요,최고예요,3
5315473,co********,2022-03-06 18:07:39.15,"시간 날 때 조금씩 나눠 읽었으면, 
중반까지는 하고자 하는 얘기가 뭔지 모르겠고 지겨워서 
완독 못할 수도 있었겠어요. 
하지만 후반부에 시원한 웃음을 전달해 줍니다. 
그래서 짬 날 때 읽기보다는, 시간 내서 한번에 후루룩 읽으시길 추천드립니다.",최고예요,2
5315488,je*******,2022-03-04 17:12:42.85,두번째 보는중인데 주변에 추천할만합니다,집중돼요,4
5315627,wh******,2022-03-04 12:44:32.896,의미 없는 곳을 떠도는 보잘것없는 나에게 처음으로 중요할 수 있음을 알려준 책.,최고예요,4
5315536,ss******,2022-03-04 12:03:47.323,이야기가 어떤 식으로 진행되는 건지 감이 잡히지 않다가 중반부로 넘어가면서 전체적인 흐름이 파악되지만 이 책은 마지막 페이지까지 다 읽어봐야 내가 무엇을 읽었는 지 알 수 있다.,최고예요,4
5315422,er******,2022-03-04 02:07:17.17,하도유명해서 궁금해서 사봤어요ㅋㅋ,최고예요,4
5315379,kj*****,2022-03-04 00:49:29.6,다른 세계는 있지만 그것은 이 세계 안에 있다,집중돼요,4
5315541,wp*****,2022-03-03 21:57:02.123,물고기는 존재하지 않는다 잘 읽었습니다,도움돼요,2
5315660,bt******,2022-03-02 21:44:26.546,선입견없이 정보없이 왜 읽으라고했는지 알겠어요,쉬웠어요,4
5315632,da*****,2022-03-02 21:23:20.93,워낙에 추천이 많아서 빨리 읽어 보고 싶네요,추천해요,3
5315464,rh********,2022-03-02 20:48:17.516,"[스포 없는 리뷰 대회] 
물고기는 존재하지 않는다를 읽다보면 
초반: ""흠.. 그렇구나.. 오호?? ""
중반: 데이비드?????????????????????????? 에엥?????  
후반: 이런!!!!!!!!&#55357;&#56872;
라는 반응을 하게 됩니다. 어째서 사전 정보 없이 읽으라고 하는지, 그리고 왜 꼭 끝까지 읽으라고 하는지 마지막까지 읽고나니 알겠더라구요. 간만에 책 읽고 마음이 두근두근 거렸던거 같아요. 개인적으로 이 책을 누구에게 추천하고 싶은가요? 라는 질문을 받는다면 전 푸틴에게 추천하고 싶습니다. 읽고 정신 차리라구요. 그만큼 여러가지 시점에서 돌아볼 수 있게 하는 책 인거 같습니다. 저자의 데뷔작이라고 알고 있는데 첫작이 워낙 좋아서 다음 작품은 어떨지 기대가 됩니다^^ 「물고기는 존재하지 않는다 」꼭 한번 쯤은 읽어보셨으면 좋겠어요~!",최고예요,4
5315543,ho*******,2022-03-02 19:11:48.51,"세상에는 너무 많은 기준과 범주가 있고, 이 것이 항상 나라는 존재에 큰 영향을 미쳐왔다. 상상할 수 있는 것보다 더 경계가 없고 더 풍요로운, 아무런 기준 선도 긋지 않는 가치관에 대한 열망, 내가 서있는 지금 내가 서 있는 이 현실의 질서를 무너뜨리는 것, 우리가 쓰는 이 척도들을 불신하는 것이 인생을 걸고 해야할 일이라는 깨달음을 주었다.",집중돼요,4
5315648,ye*******,2022-03-02 14:36:36.933,책의 내용과 이야기 전개방식 등이 매우 새롭고 인상적이었다!,최고예요,4
5315363,hs******,2022-03-02 13:43:52.6,"우선 책이 가벼워서 좋아요~!조용히,,, 가만히,,, 저녁에 읽으면 좋은책이예요.",쉬웠어요,4
5315574,ki*******,2022-03-02 13:35:19.18,동성애 엔딩이라 불편하지만 내용은 대체로 좋음,추천해요,3
5315557,te*******,2022-03-02 12:12:31.183,신선하고 새롭습니다. 한번 쯤 읽어보길 추천합니다.,쉬웠어요,4
5315606,hj*****,2022-03-02 03:14:12.38,아직 읽진 않았디만 두근두근 하며 읽기전 기대중..!,집중돼요,4
5315389,lu*****,2022-03-01 18:34:55.836,베스트셀러가 되기엔 조금 어려운 책같긴한데 아직 읽고있는 중이에요,최고예요,4
5315612,ju*****,2022-03-01 16:50:13.64,"[스포 없는 리뷰 대회]
과학의 시선으로 인생을, 우리의 인생을 함께 해주는 수많은 존재를 새롭게 보게 해주는 철학책. 이 책의 제목을 읽고 의아해할 수 있으나 이 제목을 이해하기 위해선 끝까지 읽어야만 한다. 초반에는 이 책이 하고자 하는 말이 무엇인지 모르겠다는 생각에 답답할 수도 있으나 꼭 참고 읽었으면 한다. 그 기다림 끝에 마지막 장에선 분명히 이 작가가 우리에게 하고자 했던 말, 물고기는 실제로 존재하지 않는다는 사실을 마음에 담고 갈 수 있을 것이다. 그리고 그 사실을 깨닫고, 물고기를 포기함으로써 얻게 되는 것은 모두가 각자의 이유로 다를 것이다.",최고예요,4
5315437,re*******,2022-03-01 16:26:01.413,인생의 의미.. ㅎㅎㅎ,최고예요,4
5315534,dl*****,2022-03-01 12:36:42.6,정말 재밌게 읽었어요 신선함 그 자체,도움돼요,4
5315636,ht*****,2022-03-01 04:22:56.506,마지막이 인상깊습니다,집중돼요,4
5315443,km******,2022-03-01 00:40:53.393,엄청난 책인 것 같아서 기대 중,쉬웠어요,4
5315514,de********,2022-02-28 16:32:21.206,[스포 없는 리뷰] 나의 존재와 삶의 의미 그리고 자연을 통하는 다채로운 이야기,집중돼요,4
5315396,co*****,2022-02-28 10:29:53.856,"생각치 못한 결말.
책 전체가 참 잘 짜여져 있다. 부러운 책이다.
작가와 그녀의 가족 모두 행복하게 살기를",최고예요,4
5315641,he*****,2022-02-28 09:03:11.543,"요즘 핫한 책이라 구입했어요
읽은 분들이 추천하시길래 기대됩니다",,3
5315365,so****,2022-02-27 21:59:19.376,친구랑 같이 읽으려고 구매했어요 잘읽겠습니다,쉬웠어요,4
5315526,eh******,2022-02-27 20:59:08.243,"읽기를 추천하기가 어렵다
수준이 내가 낮아서 그런지 너무 어렵다
하고자 하는 말은 알겠고 은유가 수식이 재미지지만
특별한 분야에 특별한 관심과 지식이 없다면 결코 쉬운 책은 아니다",,2
5315608,th*******,2022-02-26 00:47:33.73,"[스포 없는 리뷰 대회]
그렇다. 물고기는 존재하지 않는다. 
그 사실은 중요하다.
완전히 새로운 세상이 열릴 테니까.",최고예요,4
5315581,su*******,2022-02-25 23:27:24.636,"[스포 없는 리뷰 대회] 책을 읽으면 읽을수록 내 날개뼈 사이에 지느러미가 피어났다. 한 장 한 장 책 속을 헤엄칠수록, 그렇게 난 존재하지 않았다.",최고예요,4
5315447,my****,2022-02-25 15:19:23.613,자연이라는 거대한 세계 속에서 ‘물고기는(그리고 우리는) 어떤 존재인가’에 관한 철학적이면서 명상적인 질문으로 가득 찬 책,집중돼요,4
5315351,hj*****,2022-02-25 14:57:52.593,"제가 먼저 읽고 좋아서 선물하려고 샀어요.
에세이의 서사가 독특하고 저자가 세상을 바라보는 관점이 좋습니다.",집중돼요,4
5315656,c8******,2022-02-25 10:04:50.8,내용이 철학적이나 어렵디 않고 좋아요 ㅎ,도움돼요,4
5315532,lo********,2022-02-25 00:22:13.37,중반까지는 참아야 결말을 읽을수있습니다,최고예요,3
5315655,ka*****,2022-02-24 18:14:03.2,무슨 책인지 잘 모르겠어요. 생각치도 못한 전개와 이게 왜 베스트셀러인가하는 의문,,2
5315453,ac*******,2022-02-24 11:52:55.173,제목을 가지고는 내용을 알 수 없지만 읽어 보면 좋은 책,최고예요,2
5315497,gk********,2022-02-24 08:55:40.53,흥미롭게 읽었습니다,최고예요,4
5315622,li***,2022-02-24 00:47:46.193,"나날이 늦어지는 배송
같은 날 같은 시간에 주문한 YXX 24와 이틀이나 차이가 나네요.",최고예요,3
5315579,ch*****,2022-02-23 23:56:55.146,"[스포 없는 리뷰 대회]나는 책을 읽기 전에 리뷰를 꼭 확인하는 편이다. 나의 독서가, 나의 지출이 실패하지 않았으면 하는 마음에서 말이다. 많은 리뷰와 추천사를 빠짐없이 다 읽고 난 뒤 나는 확신했다. 이 책은 나에게 굉장한 것을 줄 것이 분명하다고 말이다. 그래서 나는 이 책을 구매했다. 책을 다 읽어갈 쯤에 내가 얻게 될 것이 무엇일지 너무나 궁금했다. 마지막장을 읽고 있다는 것을 알아챘을 때도, 에필로그를 읽고 있다는 것을 인식했을 때도, 희망의 끈을 놓지 않았다. 주석까지 모조리 훑은 뒤에야 나는 깨달았다. 내가 얻어낸 것이 혼돈이라는 것을. 물고기는 존재하지 않았다.",최고예요,4
5315520,sh*****,2022-02-23 17:24:32.976,"[스포없는 리뷰 대회]

물고기는 존재하지 않는다.

이 책의 제목이 비유나 메타포가 아님을 마지막 책장을 덮는 순간 알게 됩니다.",최고예요,4
5315605,ed****,2022-02-23 17:08:42.776,"[스포 없는 리뷰 대회] 애독가가 아니라면 미리 정보를 찾아보고 읽어도 좋다.하지만 당신이 애독가인데 만약 주위에서 이 책의 내용에 대해 미리 알려주려는 사람이 있다면... 재빨리 그 자리를 피해 달아나자!오죽하면 이런 스포 없는 리뷰 대회까지 할까?앞의 4페이지에 들어있는 &#39;이 책에 대한 찬사&#39;들도 버릴 것 하나 없는 리뷰들이자 문장이다.  그 문장들 이상의 리뷰를 남길 자신이 없다. 아마 리뷰들도 작가가 따로 선정했거나 부탁했을 것 같다. 다만 이 책을 읽을 때 주의사항이 있다.1. 반드시 끝까지 읽어보자.2. 분량이 많지 않으니 2~3시간 정도 시간을 내어 처음부터 한 호흡으로 읽어내려가는게 좋다.3. 책의 맨 앞부분에 “이 책에 대한 찬사” 4페이지를 먼저 읽고, 책을 정독한 후, 다시 이 4페이지를 꼭 읽어보자. 하나도 버릴 만한 문장이 없을 것이다.4. 다윈의 진화론과 우생학, 엔트로피 증가의 법칙 정도는 사전지식을 갖고 읽으면 좋다.",최고예요,3
5315359,cy*****,2022-02-23 17:05:23.3,"[스포없는 리뷰 대회]새로운 느낌의 책이다. 그저 100년 미국 생물학자 전기인것 같은데 왜 이렇게 평이 좋을까 했다. 읽고 나니 알겠다. 생각을 잘못했다. 이 책은 한 인물에 삶을 조망하며 스스로를 비추어 보는 자기성장의 기록이다. 자신이 가진 틀을 깨어부수는 한 여성의 수기다.우리는 잘 모르지만, 미국에선 유명한 학자인것 같다. 스텐퍼드대학 초대 총장을 지낸 데이비드 스타 조던. 그는 생물학자 특히 분류학자로 지구상의 어류5을 수집하고 이름을 붙힌 학자로 유명하다고 한다. 저자는 그의 소년시절 이야기에서 시작하여 점차 성장하는 학자의 모습을 그린다. 더불어 학자의 삶을 바라보는 저자 룰루 밀러 자신의 이야기가 겹쳐진다. 학자가 살아가며 선택한 일들과 그 이유를 지켜보며 저자는 자신의 생각, 고통, 고민, 갈증을 성찰하게 된다.무척이나 솔직한 책이다. 타인의 삶을 내 삶 안으로 끌고 들어와 최대한 정교히 반추해 내려는 시도. 멋지게 성공했다. 젊은 여성인 저자는 어린시절 까칠한 과학자 아버지로부터 잔인한 진실을 듣게된다. 우리 인간은 우주의 먼지와 같이 사실은 아무것도 아니라는 &#39;진실&#39;을. 그 &#39;진실&#39;이 그녀의 삶에 도움이 되었을까? 저자에겐 아니었다. 한 생물학자의 삶을 찾아가는 과정을 정리한 이 책은 그 &#39;진실&#39;에서 스며있는 인생의 의미와 가치, 그 길을 찾아가는 여정이다.자세한 내용은 필요없다. 그냥 읽기를 추천한다. 아무런 사전배경이 없어도 읽다보면 이 책의 마력을 느낄 것이다. 꼭 실시간으로 변해가는 듯한 저자의 생각과 호흡을 느끼길 바란다. 또한 제목인 &#39;물고기가 존재하지 않은다&#39;는 그냥 비유만이 아닌 사실이라는 것에도 놀랄 것이다. 책을 덮고 잠시 머리속에 머물렸던 말, &#39;성장한다는 것은 자신에 대한 다른사람들의 말을 더이상 믿지 않은 법을 배우는 거야&#39;라는 문장이 오래 남을 것 같다. 좋은 책이다.",집중돼요,4
5315353,GO*****,2022-02-23 15:31:04.93,"[스포없는 리뷰대회]
유튜브에서 기막힌 책이라는, 절대 사전정보 없이 읽으라는, 호기심일으키는 영상을 보고, 그 즉시 구매해서 읽었습니다 끝까지 사전정보를 보지 않고 읽으려고 얼마나 노력했던지... 
우선 이 책은 기존 자기 성찰, 자기 고백이 담긴 책들과는 전혀 다른 흐름으로 진행되는것이 신선했습니다
그리고 작가의 아버지... 자신의 자녀에게 하는 말. 저는 솔직히 그런 말이 좀 당황스러웠습니다. 어느 누가 그렇게 자기 아들 딸에게 말할수있을까... 그리고 그 자녀는 끊임없이 자기 인생에 대해 돌아보고... 
인생, 추구하는 것, 목적, 그 모든 것이 있어야 살아갈 동력을 얻을텐데, 아무튼 작가의 기술방식에 한번 놀랐고, 그 아버지의 교육에 놀란 책이었습니다. 
그러나 나는 내주변의 사람들에게 그 아버지와 같이 얘기해주고 싶지는 않다는 생각이 들었습니다
지금 이 책을 다 읽고 내 머리속에 남은 단어는 ""혼돈"" 그리고 ""삶의 목적"" 이라는 것입니다.",최고예요,3
5315570,dd******,2022-02-23 15:19:56.406,"[스포 없는 리뷰 대회] 작은 것이 하나도 없는 책. 글쓴이의 의도도, 글의 방향도, 다루는 분야도, 모두 방대하다.",집중돼요,4
5315519,28*******,2022-02-23 12:31:52.19,평들이 흥미로워 구입.,집중돼요,3
5315513,ck****,2022-02-23 10:24:59.6,2020년 최고의 책!,도움돼요,4
5315523,gy*****,2022-02-22 22:26:09.71,너무 좋은 책입니다.,쉬웠어요,4
5315451,ba****,2022-02-22 09:43:01.863,환경서적인줄 알고 읽기 시작했는데 전기인가? 싶더니 소설인 줄 착각하게 만드는 철학적인 과학책,최고예요,3
5315382,da*******,2022-02-20 21:46:16.676,재미나게 잘 읽고 있어요. 처음은 과학 책인가 했는데 아직 정확하게는 모르겠고 그냥 재미있게 읽고 있어요.,최고예요,4
5315549,lh*****,2022-02-20 19:20:23.79,호평일색이라 기대가 크네요,,4
5315558,na******,2022-02-19 19:04:37.79,신박한 이야기입니다~~,도움돼요,4
5315399,DA********,2022-02-19 16:37:05.986,흡입력이 대단한 책입니다. 재밌어요,최고예요,4
5315638,je*******,2022-02-19 00:20:27.38,사전정보 없이 읽으면 더 재밌는 책이에요.,집중돼요,4
5315408,yo*******,2022-02-18 22:02:32.183,좋은후기들이 많아 구매했습니다:) 표지도 너무 예쁘네요ㅎㅎ,집중돼요,4
5315459,so*******,2022-02-18 21:23:48.383,스포없이 읽어야 한다 꼭!!!,최고예요,4
5315373,ss*****,2022-02-18 10:57:51.81,하도 재미있다길래 구매했어요..기대가 됩니다.,집중돼요,4
5315452,kh*****,2022-02-18 01:28:32.64,서점에서 앞부분 읽다가 구매합니다~,집중돼요,4
5315386,fh******,2022-02-17 23:25:42.473,끝까지 읽어야 진가를 알 수 있는 책!!! 추천합니다!!!!,쉬웠어요,4
5315458,77***,2022-02-17 20:36:02.173,핫한 책.. 바로드림으로 구매하였는데 하마터먼 그 사이 재고가 다 나가서 못가져올 뻔했네요. 기대합니다.,집중돼요,4
5315448,gr***,2022-02-17 19:01:09.87,추천받아서 읽어보려구요. 기대중입니다.,집중돼요,4
5315506,87********,2022-02-17 17:30:11.766,현재 가장 핫한 책! 수많은 사람들에게 인생책으로 등극!,집중돼요,4
5315651,da******,2022-02-17 00:13:30.893,재미 있어요. 열심히 읽어요.,,3
5315371,na*****,2022-02-16 18:08:22.653,바로드림으로 구매. 이제 읽어봅니다.,최고예요,3
5315436,sa*****,2022-02-16 15:37:46.603,추천 받아서 구매했습니다,쉬웠어요,4
5315577,ro*******,2022-02-15 16:03:31.47,트위터에서 자주 보이던 책이라 나도 모르게 구매했다,집중돼요,4
5315390,ze******,2022-02-15 01:40:32.413,정말 재밌어서 금방 읽었어요,쉬웠어요,4
5315593,am******,2022-02-15 00:34:03.71,"책이 가벼워서 좋긴 한데 파손이 잘 될 것 같아 아쉬워요. 
읽고 있는데 술술 잘 읽히네요.",집중돼요,3
5315568,tl********,2022-02-14 22:55:09.376,우리가 이름 붙여주지 않아도 이 세계에는 실재인 것들이 존재한다,쉬웠어요,4
5315410,hs****,2022-02-14 18:09:06.6,유익하고 흥미로운 내용입니다,집중돼요,4
5315604,bu******,2022-02-14 10:57:09.94,어떤 말도 할 수 없지만 너무 좋았다.,집중돼요,4
5315510,ot********,2022-02-14 10:33:55.886,요즘 같은 시기에 어울리는 책이네요. 잘 읽고 있습니다.,집중돼요,4
5315461,dk*******,2022-02-14 10:06:33.476,흥미롭고 재밌어요!,집중돼요,4
5315490,sk****,2022-02-13 23:48:53.343,칭찬일색이라 재미있을거같아서 구매해요,집중돼요,4
5315522,bo*****,2022-02-13 23:44:36.36,나 역시 물고기를 포기 하지 않고 지낸 과거들이 부끄럽다.,도움돼요,4
5315412,hh****,2022-02-11 22:37:39.496,옆에 두고 반복해서 읽어볼 책이에요. 너무 좋았습니다. 표지가 코팅이 안 되어있는 게 아쉽네요ㅠ,쉬웠어요,4
5315444,go*****,2022-02-11 14:17:42.506,추천받고 구매했어요. 사은품 선택을 고민했는데 천원짜리 공책 물고기 노트? 선택했고 무지고 간단히 적기 좋아보여요..,집중돼요,4
