리뷰번호,회원ID,작성일시,리뷰내용,감정키워드,평점
15020024,zm********,2024-11-15 10:00:04.169742,진짜 몇시간만에 읽어버렸는데 마지막부분이 젤 슬펐어요,공감돼요,4
15019379,la*****,2024-11-15 00:43:50.137242,그 시대의 아픔을 생생히 알수 있었습니다,고마워요,4
15019269,ir*******,2024-11-15 00:05:30.857625,읽어보고 싶은책입니다,공감돼요,4
15018970,je*******,2024-11-14 23:18:01.184299,슬펐습니다. 막내를 그리워하는 어머니~~~,최고예요,4
15018853,b6****,2024-11-14 23:02:41.654589,광주 이야기. 슬퍼요,고마워요,3
15018654,an***************,2024-11-14 22:19:10.644809,배송빠르고 책 내용 좋아요 ,최고예요,4
15018474,wo********************,2024-11-14 21:46:22.727541,아버지가 꼭 읽으라고 말씀하셔서 봤는데 진짜 눈물 줄줄이네요..,최고예요,4
15018045,tr***,2024-11-14 19:05:15.665811,최고의 소설 입니다,최고예요,4
15017998,sk*****,2024-11-14 18:35:58.516715,수상 축하드려요! ,최고예요,4
15017960,jd****************,2024-11-14 18:22:02.760427,읽는 순간 계속해서 눈물이 흘렀어요. 그 시간을 기억하겠습니다.,최고예요,4
15017819,tn********,2024-11-14 17:18:13.576931,정말 최고입니다. ,최고예요,4
15017661,ni****************,2024-11-14 16:26:24.667633,"부정 당했던 현실이 세상에 나오게 돼 감사하고, 알게 되어 슬픕니다.",고마워요,4
15017628,do*******,2024-11-14 16:19:08.133647,한강 - 소년이 온다,최고예요,4
15017499,ch******,2024-11-14 15:47:30.344104,훌륭한 한강 작가님의 책 ,최고예요,4
15017127,51***,2024-11-14 14:19:50.361994,노벨문학상 수상을 축하하며..한강 작품을 하나씩 읽고 있어요..,힐링돼요,4
15017075,se*******,2024-11-14 14:02:27.386606,한 강의 책 중에 가장 공감이 되는 책이었고 다시는 이런 일이 일어나지 않기를. 가슴 한쪽이 먹먹 해지는 내용이었습니다.,고마워요,4
15016990,ad****,2024-11-14 13:33:05.509965,"저는 수업시간 내내 자고있던 적이 많아서 역사부터 근현대사 모두 어렴풋하게만 아는정도였는데요, 책을 읽으면서 더 잘 이해하고싶어서 다큐도 찾아보고 하면서 많은 생각을 했어요. 책을 읽다가 소리가 날 정도로 울었던 적은 처음이네요. 마음이 먹먹해지는 책인것 같아요.",고마워요,4
15016984,sj*****,2024-11-14 13:30:32.711604,역시 노벨문학상 축하합니다.,최고예요,4
15016359,gm*******,2024-11-14 10:41:38.137603,"기대하고 있는 작품이에요
읽어볼개요",공감돼요,4
15015478,4y*****,2024-11-13 23:57:15.662575,잘 읽었습니다.....,고마워요,3
15015166,ch********,2024-11-13 22:17:18.66535,초반에는 이게 뭐지? 하던게 점점 빠져드네요.,최고예요,4
15014992,09******,2024-11-13 21:30:56.619423,"아름다우면 안되는 역사지만 아름답게 표현된 책.
많은 생각을, 슬픔을 고통을 다시 느낄 수 있는 책입니다 :) 정말 잘 읽었어요",최고예요,4
15014929,sw*****,2024-11-13 21:09:37.425938,아이한테 선물했는데 좋아하네요~^^,최고예요,4
15014900,su******,2024-11-13 20:57:49.425753,고맙습니다. 작가님,고마워요,4
15014798,dl******,2024-11-13 20:16:13.499388,"노벨상 수상, 한강 작가님의 책을 읽고자 구입했어요. 기대됩니다!",고마워요,4
15014631,ss****,2024-11-13 18:57:26.508407,역사적 팩트를 기초로 현실을 외면하지 않는 작가의 가치관이 깊게 투영되어 있음.,공감돼요,4
15014506,mi******,2024-11-13 18:11:36.227309,맘이 아픈 소설이다.,최고예요,4
15014487,mi******,2024-11-13 18:02:50.718368,누구나 다 읽었으면 하지만 특히 청소년들에게 필독서가 되었으면 히는 바램을 기져 봅니다,최고예요,4
15014084,hj**************,2024-11-13 15:45:12.409154,최고에요 정말 재밌네요,최고예요,4
15013443,yo******,2024-11-13 12:06:05.819578,5월에 읽으려고 아껴뒀어요. ,고마워요,4
15013104,at****,2024-11-13 10:43:21.534009,아주 재미있고 유익합니다,재밌어요,4
15012622,gh****,2024-11-13 09:05:22.18116,아내가 무척 좋아합니다. 아내가 무척 좋아합니다. 아내가 무척 좋아합니다. 아내가 무척 좋아합니다. 아내가 무척 좋아합니다. 아내가 무척 좋아합니다. ,재밌어요,4
15012256,go********,2024-11-13 04:21:09.417079,초등딸이 하루만에 다 읽었어요 너무 슬퍼요,재밌어요,4
15011871,sy*******,2024-11-12 23:52:35.16467,"우리가 알고 있는 5.18과 관련 있는 스토리입니다.
",공감돼요,4
15011045,rh******,2024-11-12 20:18:04.458905,읽는 내내 심적으로 힘이 들었지만  꼭 읽어봐야 할 작품입니디.,최고예요,4
15010790,bb*****,2024-11-12 18:42:04.827965,"어제 받자마자 단숨에 읽었어요. 
저는 역사에 참 무지 했음을 깨닫고 참 창피했습니다.
그리고 오늘 유트브로 518광주 민주화 운동이 왜 일어나게되었는지... 그후 6월 항쟁까지 다 찾아보게되었네요. 그저 두리뭉실하게만 알고 있었던 한국역사를 흐름순으로 알게된 계기를 만들어준 소설입니다.
잘 간직했다가 제 아들에게도 알려주렵니다.",고마워요,4
15010772,ic*****,2024-11-12 18:32:11.087729,좋은책이라추천합니다,고마워요,4
15010744,wo*****,2024-11-12 18:25:26.797788,천천히 읽어보려고 합니다,고마워요,4
15010566,hy********,2024-11-12 17:24:28.969731,예전의 기억을 떠 올라 다시한번 읽고 싶네용 광주역사기행을 위해,고마워요,4
15010404,ah*****,2024-11-12 17:04:55.838714,잘 읽었습니다. 좋은 책 감사합니다.,고마워요,4
15010253,ac*****,2024-11-12 16:21:41.082627,감정적으로 답답해지지만 그래도 읽어야하는 책이었어요,최고예요,4
15010198,bu******,2024-11-12 15:55:43.154006,오래기다렸는데 잘 읽을께요,최고예요,4
15010085,jk******,2024-11-12 15:23:08.16463,역시 무척 기대되는 책입니다.,최고예요,4
15009524,se******,2024-11-12 12:59:45.131523,한강 작가님 노벨상 수상 기념 친구에게 선물로 줬어요,최고예요,4
15008470,we*******,2024-11-12 10:16:24.839098,노벨문학상 수상 기념으로 구매했어요,최고예요,4
15008447,lo********,2024-11-12 10:12:27.928433,다 읽고 가슴이 먹먹해서 잠시 넣어 둔 책. 또 생각 나면 꺼내 읽을 책입니다. 중독성있는 작가님의 목소리와 문체가 자꾸 귓가에 아른거리네요~,고마워요,4
15008445,hs****,2024-11-12 10:11:53.761589,"부끄럽게도 작가님이 노벨상을 수상한 뒤에야 이 책을 읽어보았습니다. 5.18의 비극을 여러 사람들의 입장에서 처참한 상황을 세밀하게 담아내고 있네요.
어린 나이에 세상을 뜬 소년 동호의 아픔이 비단 한사람이 아닌, 당시 광주에 있던 시민들 모두에게 적용되었을 것입니다.
소설을 읽고 다음 주 광주에 가서 망월동 묘지 및 전남도청, 금남로 일대를 가보려 합니다.",공감돼요,4
15008049,tj*********,2024-11-12 07:56:53.547468,아버지가 읽고 싶어하셨는데 동네서점에는 없다고해서 주문해드렸어요~^^,최고예요,4
15008040,ga******,2024-11-12 07:45:48.940763,그저 갓..  이런 소설가가 있음에 감사 용기에 존경을,최고예요,4
15007953,pg*****,2024-11-12 05:42:02.552732,악마는 우리 주변 곳곳에 있고 역사는 반복된다.,공감돼요,4
15007601,he*****,2024-11-11 23:32:26.26058,"배송 빠르고 좋았습니다.
포장 상태도 좋습니다.
추천합니다.",고마워요,4
15007521,jh****,2024-11-11 23:15:28.252728,워낙 슬프다는 말을 많이 들은 작품이에요,최고예요,4
15007466,so******,2024-11-11 22:57:27.046604,아직 읽고 있는데 한강 작가님 진짜 대박이네요,최고예요,4
15007400,fu******,2024-11-11 22:38:43.555996,최고의도서 대만족이요,고마워요,4
15007390,na*****,2024-11-11 22:36:06.921668,최고의도서 대만족이요,고마워요,4
15007294,my***,2024-11-11 22:16:20.21548,"한 장, 한 장 읽어내려갈때마다 마음이 너무 아프네요. 우리나라의 근현대사의 한페이지를 기록해주셔서 감사합니다. 전국민이 읽어봐야 할 소설책입니다.",최고예요,4
15007167,na******,2024-11-11 21:47:06.53524,보는 내내 먹먹하네요. 감정이입이 되서 책장 넘기기가 힘들었어요. ,최고예요,4
15006651,ys*******,2024-11-11 18:56:12.040151,읽어볼만한 책이에요,공감돼요,2
15006414,sw********,2024-11-11 17:47:55.706766,광주의 아픔과 용기를 세계에 알릴 수 있어 감사합니다,최고예요,4
15006321,mi*******************,2024-11-11 17:21:03.261841,아직 읽기 전인데 기대돼요,최고예요,4
15006159,it******,2024-11-11 16:31:31.974484,"한강작가님의 노벨상 수상을
축하드리며 채식주의자에
이어서 소년이 온다
열심히 읽겠습니다.
한강작가님! 고생하셨고 고맙습니다.",고마워요,4
15005535,se******,2024-11-11 13:05:35.893551,한강작가님 감사합니다. 소설을 잘 읽지않는편인데 읽어보려고 많이 시켰습니다.,최고예요,4
15005517,dr*******,2024-11-11 12:51:34.08065,누구나 꼭 읽었으면 하는 책 중 하나다. 그만큼 우리나라의 역사를 잘 담아낸 책이다.,최고예요,4
15005262,hy*******,2024-11-11 11:47:15.487985,한강 작가님의 책을 기대하는 마음으로 읽어봅니다. 좋은 글 감사합니다.,최고예요,4
15004839,ph*****,2024-11-11 10:00:43.757766,"힘들고 고통스럽게 집필했을 작가님의 숨결이 느껴졌습니다. 누군가는 꼭 해야만 했을 진실을 용기내어 세상에 알리는 일을 하신 작가님께 감사드립니다.
소년의 죽음이, 광주시민들의 억울한 죽음이 헛되지않게 해주셔서 감사합니다.
그들의 희생으로 더 나은 세상에서 살고 있는 우리들이라 죄송하고 감사합니다.",고마워요,4
15004664,je*****,2024-11-11 08:47:52.142725,잘 읽었습니다.    ,공감돼요,4
15004631,lo*****************,2024-11-11 08:18:05.35145,"책 상태가 엉망입니다
급하게 인쇄해서 그런지 많이 아쉽네요
",재밌어요,1
15004597,sa***,2024-11-11 07:55:09.799799,한강 작가의 노벨상 수상을 축하하며 구입했어요. 기대됩니다.,최고예요,4
15004593,sa***,2024-11-11 07:53:29.96907,한강 작가의 노벨상 수상을 축하하며 구입했어요. 기대됩니다.,최고예요,4
15004520,ls****,2024-11-11 06:49:12.993557,우리나라에 노벨상을 타는 작가님이 나와서 기념으로 책을 구입했어요. 그런데 눈도 잠이 오는듯 말씀하실때도 졸음이 오는 듯 몽롱한 모습이 영 보기가.,최고예요,4
15004460,os********,2024-11-11 03:45:34.048087,좋ㅇ습니다좋아요..,힐링돼요,4
15003617,ho****,2024-11-10 22:05:04.521395,광주의 아픔을 기억해 봅니다,고마워요,4
15003570,ti*****,2024-11-10 21:56:30.688076,아이가 한강님 책을 원해서 구매했습니다 ,고마워요,4
15002909,jj*****,2024-11-10 18:47:40.143936,기대됩니다. 몇 장 읽었는데 잘 읽히네요. 이 가을에 읽기 좋습니다.,최고예요,4
15002844,bu********,2024-11-10 18:19:39.800936,우리의 아픈과거를 아프게 적어놓아 공감합니다,공감돼요,4
15002580,po***,2024-11-10 16:40:10.969405,수상하신 한강 작가의 책을 읽을 수 있어 좋았습니다,고마워요,4
15002529,af********,2024-11-10 16:21:27.352459,읽다보면 갑자기 눈물터집니다 멈출수가 없습니다 다 읽고나면 또 터집니다 ,최고예요,4
15002127,ha****************,2024-11-10 13:31:41.45648,"부모님의 책읽으시는 모습이 너무 아름다워보였던 시간이었습니다.
가족 모두 읽고 같은 공간 소소하게 공감한 부분을 나누는 시간이 행복했습니다.❤️",고마워요,4
15002015,ar***,2024-11-10 12:44:02.864918,우리모두가 꼭 읽어봐야할 책입니다~,고마워요,4
15001689,ma******,2024-11-10 10:29:30.967732,한강 작가님 노벨문학상 수상 축하드려요~!,최고예요,4
15001474,hi******,2024-11-10 09:05:20.126515,시적 산문이란 표현이 무엇인지 알게 되었어요. 가슴 먹먹한 내용이지만 아름답게 느껴지기도 하고. 소장가치 백프로 입니다.,최고예요,4
15000434,po********,2024-11-09 21:00:37.707655,우리나라에서 노벨 문학상 수상자가 나오다니 너무 자랑스럽고 기쁜 마음에 구매했습니다👍,재밌어요,4
15000376,ji******,2024-11-09 20:31:45.614082,읽고 있는 내내 계속 눈물이 났지만 이야기 속에 빠져  읽는 것을 중단할 수 없었습니다. 강력 추천합니다.,최고예요,4
15000204,do******,2024-11-09 19:10:02.259949,힘든날 힐링되는 도서~!!!,힐링돼요,4
14999815,fa********,2024-11-09 17:31:54.022923,너무 아픈 역사… 읽기 힘들지만 그들에게 빚진 우리들이 꼭 읽고 기억해야 할 책,고마워요,4
14999796,mo*******,2024-11-09 17:25:47.879766,필수로 읽어야죠 기대됩니다,고마워요,4
14999552,ys******,2024-11-09 16:04:17.068446,유명한 책을 읽을 수 있게되어 영광이네요,최고예요,4
14998945,mo*****,2024-11-09 12:05:37.430018,읽고싶었는데 기대가 됩니다,최고예요,4
14998918,ed******,2024-11-09 11:51:51.321322,"한강의 책이 공립도서관에 있어야하네 마네, 이런 논쟁은 소모적이다. 그리고 한국 문학교육이 얼마나후진적 수준인지 보여주는 논쟁이다. 표현방법, 내용은 그녀가 얼마나 깊은 고통속에서 작품을 써냈는지를 알수있게하는 장치일 뿐이다. 당신의 자녀들은 이것보다 훨씬 자극적인 영상물을 유튜브 통해서 접하고 있다. 이 책에 화풀이 하지말고 당신 자녀의 핸드폰 영상시청 기록이나 보시라. ",공감돼요,4
14998456,le********,2024-11-09 09:38:37.775365,당시 시대상과 아픔묘사에 공감,공감돼요,3
14998280,ra*****,2024-11-09 08:45:06.139064,같은 사건에 대해 다른 인물들의 마음을 볼 수 있는. ,최고예요,4
14998207,sk*****,2024-11-09 08:12:35.672563,아직도 광주 학살 사건을 있는 그대로 인정하지 않는 사람들이 있다. 일반인인 총칼으 몽둥이에 맞아 죽고 어린 학생이 끔찍하게 군인에게 죽었는데 본질이 왜곡된 말들로 역사를 망가뜨리려 하고 있다. 정말 무엇 때문에 그렇게 하는가?,최고예요,4
14998119,ku*****************,2024-11-09 06:30:31.272688,왠지 꼭읽어봐야겠다는 상각이들어 구매합니다,고마워요,4
14997905,01*****,2024-11-09 00:24:32.476575,작가님 수상 후 구입했는데 금방 책장이 금방 넘어가네요...,최고예요,4
14997901,01*****,2024-11-09 00:22:18.515007,작가님 수상후 구입했는데 최고입니다,최고예요,4
14997800,co******,2024-11-08 23:41:00.192419,한강 작가 노벨수상 발표 직후 오늘 드림 신청에서 광화문 교보문고 갔다 왔어요. 오늘 드림 신청할 때에는 교보문고에 재고가 아마 지금 기억으로 70 권 정도 있었던 걸로 기억하는데 결제하고 광화문 교보문고 가는 도중 광화문 교보문고 재고가 0권으로 바뀐 걸 확인했어요. 그래도 오늘 드림  신청 당시ㅇ는 책이 있었던 걸 봤었기 때문에 우선 교보문고로 갔는데 직원분이 상황 들으시고 친절하게 재고 확인해주신후 책 오늘드림 정상적으로 당일에 받을 수 있게 도와주셨습니다. 그 당시 도와주셨던 광화문 교보문고 직원분 감사합니다. 책은 정말 읽으면 읽을 수록 슬퍼져서 더 슬퍼질까봐 못 넘기겠는 책이에요. 하지만 감사히 읽겠습니다. 노벨문학상을 원어로 읽을 수 있다는 행운이 오다니 정말 행복해요,최고예요,4
14997587,av*******,2024-11-08 22:58:53.812111,아직 읽기 전인데 읽고 싶어서 구매했습니다.,최고예요,4
14997571,hi*******,2024-11-08 22:56:32.796153,"역사로 배웠던, 5.18국립묘지에서 봤던 그 내용 그대로 에요",고마워요,4
14997552,j1****,2024-11-08 22:53:43.861633,잘 읽었습니다. 한강 작가님 축하드립니다.,고마워요,4
14996743,mi******,2024-11-08 18:04:59.009139,감동입니다! 잘 읽을게요!,최고예요,4
14996729,le******,2024-11-08 17:59:04.371775,5ㆍ18 민주항쟁을 체험한 작가의 노벨문학상 작품!,공감돼요,3
14996401,ch*****,2024-11-08 16:10:21.094748,한강작가책중 두번째 책인데 작가의 독특한 시점에서 몰입이 되어 잘읽었습니다,고마워요,4
14996394,ki********,2024-11-08 16:09:30.368978,비단 노벨상 수상때문만이 아닌 읽어보고싶었던 책인데 이 참에 사서 잘 읽고있어요.,최고예요,4
14996293,ww*******,2024-11-08 15:45:06.953242,"국내 최초로 노벨문학상 
당연히 읽어봐야죠",최고예요,4
14996248,go*******,2024-11-08 15:26:52.615128,한강작가님의 소년이 온다는 한국인이라면 모두가 읽어야 하는 책이라고 생각합니다,고마워요,4
14996241,gh****,2024-11-08 15:25:42.605607,너무 슬프고 처절한 우리의 역사 잔혹한 인간성 함부로 평가할 수 없는 산문 ,공감돼요,4
14996182,eu*******,2024-11-08 14:58:43.778125,"읽는내내 마음아팠지만 끝까지 읽어냈습니다.
",최고예요,4
14995343,xh*********************************,2024-11-08 10:40:16.381727,한국소설을 안읽는 저였는데 이렇게 사게될줄 몰랐습니다 재미있었습니다,최고예요,4
14995247,gy*******,2024-11-08 10:11:39.85311,"태어나서 한번은 읽어봐야하는 책입니다.
",고마워요,4
14995246,gy*******,2024-11-08 10:10:32.64876,"태어났으면 꼭 한번은 읽어봐야하는 책입니다.
한강작가님 아시잖아요?!",고마워요,4
14995218,js*****,2024-11-08 10:06:28.486689,역시 최고입니다 좋아요,최고예요,4
14994875,km*******,2024-11-08 08:18:04.282366,잘 읽겠습니다~ 고맙습니다.,최고예요,4
14994800,cs**************,2024-11-08 07:38:45.83499,좋아해요 ㅎㅎ 추천합니다 ,고마워요,4
14994763,ai******,2024-11-08 07:24:03.42093,역사적인 사건을 개인의 관점에서 잔잔하게 풀어쓴 작품입니다,재밌어요,4
14994434,yu******,2024-11-08 00:45:09.786451,눈물을 참을 수 없습니다,최고예요,4
14994206,ni*****,2024-11-07 23:38:35.092825,구매해봅니다 아직 읽기 전이라 ,고마워요,4
14993867,wo*******,2024-11-07 22:14:59.849459,책을 다 읽고 나서 다시 한 번 읽어보고 싶은 책,최고예요,4
14993777,ji***,2024-11-07 21:41:46.386344,고통이 커 페이지를 넘기기가 힘들었다.,재밌어요,4
14993522,pe****,2024-11-07 20:11:46.492369,"처음 부터 끝까지 한 호흡에 읽기 힘들었던 책, 몇 번을 덮었다 펴가며 읽게된..",고마워요,4
14993423,re*******************,2024-11-07 19:50:13.165286,재밌어요 나중에 다시 또 읽어봐야겠어요,최고예요,4
14992667,hw****,2024-11-07 15:47:22.813082,5ㆍ18 광주...생중사에서 들숨과 날숨으로 짜여진 다각적인 시선이 깊은 한숨으로 펼쳐진 먹먹함...,공감돼요,4
14992644,ru********,2024-11-07 15:35:05.432919,"책을 놓을 수 없었습니다
ㅜㅜ",최고예요,4
14992465,pj***************,2024-11-07 14:48:15.952491,배송은 좀 늦었지만 너무너무 좋아요~~~ ,최고예요,4
14992462,pj***************,2024-11-07 14:47:42.882599,배송은 좀 늦었지만 너무너무 좋아요~~~ ,최고예요,4
14992319,le*****,2024-11-07 14:04:38.578395,우리나라의 노벨 문학상 작가라니~안 읽어볼 수가 없겠죠~~우리 작가님의 글 너무 궁금하여 구매완료. 518광주 학생운동배경의 소설은 그당시의 분위기가 그대로 소설 읽는 내내 전해지는 잔잔하면서 울림이 있는 이야기 입니다. 최고에요~~,최고예요,4
14992200,ki********,2024-11-07 13:27:26.802817,리얼한 묘사가 섬뜩하기도 했고 슬펐네요,공감돼요,2
14992116,gu****************,2024-11-07 13:03:14.996345,"너무 잘 읽었습니다
",최고예요,4
14992112,gu****************,2024-11-07 13:01:39.323168,"참혹 했던 그 시간을 책으로 느껴봅니다
",최고예요,4
14992033,re******************,2024-11-07 12:43:28.094983,아픈 역사지만 더이상 숨기지 말고 드러내어 다시는 이런 비극이 생기지 않기를 바래봅니다. 작가님 좋은 글 써주셔서 감사합니다.,최고예요,4
14991911,ss******************,2024-11-07 12:08:24.077222,작가님 노벨문학삭 수상 축하드립니다!😃 너무 좋은 책이에요!,최고예요,4
14991672,ad****,2024-11-07 10:58:11.267558,작별하지 않는다를 먼저 읽고 구매하게 됐어요. 마음이 너무 아픕니다..,최고예요,4
14991531,ii*******,2024-11-07 10:20:31.416786,노벨상의 문체를 경험하세요,최고예요,4
14991399,tw*****,2024-11-07 09:33:26.461991,수고와 노력에 감사,고마워요,4
14990848,mo***,2024-11-07 00:32:27.172398,가습 아픈 이야기를 잘 풀어낸 작품이라고 들었어요. 이런게 바로 문학의 가치가 증명되는 순간이 아닌가 싶습니다.,최고예요,4
14990452,qu*****,2024-11-06 22:48:31.432056,광주항쟁을 다양한 화자의 시각으로 접근한 구성이 돋보입니다.,최고예요,4
14990441,qu*****,2024-11-06 22:46:47.334074,광주 시민항쟁의 다양한 화자의 시선으로 구성한 면이 돋보입니다,최고예요,4
14990361,he****,2024-11-06 22:21:48.41262,작가님의 수상을 축하드려요 ,최고예요,4
14990357,sk*******,2024-11-06 22:20:36.651354,감동적인 책입니다 술술 읽혀요,최고예요,4
14989829,ho******,2024-11-06 19:12:08.063979,노벨상 수상 축하드립니다,최고예요,4
14989715,qo******,2024-11-06 18:34:08.935132,"잊고살면 안되는 이야기들 입니다.
",최고예요,4
14989711,sl******,2024-11-06 18:33:37.558042,한강 작가님 노벨문학상 축하드립니다🙌,최고예요,4
14989569,go*****,2024-11-06 17:45:23.068771,너무 아프네요. 너무아파,최고예요,4
14989438,pl*****,2024-11-06 17:09:30.928113,"글을 읽다가 와락 눈물이 저도 모르게 쏟는 부분도 있었고.. 읽는 내내 마음이 정말 너무 무거웠고 비통했습니다. 이러한 일이 있었다는 것만 알고 있었지, 자세히는 정확히 상황을 알지 못했습니다. 이제서야 조금은 깊게 알게 된 거 같습니다. 절대로 잊지 말아야 할 역사입니다. ",최고예요,4
14989385,sj******,2024-11-06 17:00:13.216591,무거운 주제라 저는 읽기 무섭고 메이트가 읽고 싶다기에 주문했습니다. 찌그러지지 않고 잘 받았어요~!,최고예요,4
14989356,tj*******,2024-11-06 16:42:15.344702,두고두고 여러 번 읽고 싶어요 감사합니다,고마워요,4
14989335,fl*****,2024-11-06 16:36:42.395663,한강의 책은 따뜻하다,힐링돼요,4
14989023,ha********,2024-11-06 15:25:19.406539,가슴아픈 이야기를 문학적으로 아름답게 승화시킨 최고의 작품입니다.,최고예요,4
14988914,al*****,2024-11-06 14:38:08.162149,오랜만에 감동감동 입니다,최고예요,4
14988713,ph***************,2024-11-06 13:41:21.082679,이 책부터 읽어야 하는 이유를 알게 해준책 이었어요. ,최고예요,4
14988703,ph***************,2024-11-06 13:36:17.407892,한강 작가님의 감성을 느낄수 있었습니다.,공감돼요,4
14988597,to********,2024-11-06 12:50:52.547017,좋은책 잘 읽었습니다. ,최고예요,4
14988458,cl********,2024-11-06 11:44:29.023874, 광주에 살고 있어서 책 속에 나오는 지명들이 익숙하여 더 잘 읽힙니다. 소년이 온다. 좀 슬프고 그러네요. ,고마워요,4
14988436,ca********,2024-11-06 11:41:22.129944,배송 빠르고 이벤트도 많고 너무 좋아요 ,고마워요,4
14988414,st*******,2024-11-06 11:31:54.16679,요즘 한강 소설 별따기 이런 소설을 이제야 접하다니  감사히 잘 읽겠습니다 ,최고예요,4
14988364,gl********,2024-11-06 11:15:22.539691,이 책을 읽으면서 많은 감동을 느꼈습니다,고마워요,4
14988161,gy******,2024-11-06 10:23:25.089398,기대돼요. 어떤 내용일지,고마워요,4
14988130,rk*****,2024-11-06 10:17:49.07689,곱씹어 읽어봐야 할 책이에요,고마워요,4
14987963,tk*****************,2024-11-06 09:33:19.810208,정말 좋은작품인거 같아요,최고예요,4
14987888,su******,2024-11-06 09:22:10.003211,작가님 고맙습니다.,고마워요,4
14987722,ge*****,2024-11-06 08:51:43.216247,처음부터 끝까지 눈물을 멈출 수 없었던 책 최고입다,최고예요,4
14987148,zz*******,2024-11-06 00:18:59.462378,읽으면 한문장 읽을 때마다 눈물이 나서 덮은 책. 읽어야 하는데 마음이 저릴까봐 아직 끝까지 못읽은 책. 모두가 한번쯤음 읽어봤으면 좋겠는 책.,고마워요,4
14986921,do***,2024-11-05 23:17:29.985702,잘읽겠습니다 굿   ,고마워요,4
14986863,he****,2024-11-05 23:11:18.448632,"다시 한 번 생각하게 되는 그 이야기들...
",최고예요,4
14986627,ga********,2024-11-05 22:03:02.087788,음~괜찮아요. ㆍㆍㆍㆍㆍㆍ,공감돼요,2
14986366,at******,2024-11-05 20:48:22.117312,아 이게 바로 문학이구나… 시대의 아픔이 느껴집니다,최고예요,4
14986290,eu****,2024-11-05 20:28:27.521839,한강 작가님 작품 너무 좋아요,고마워요,4
14986286,pa********,2024-11-05 20:27:25.840124,한강 작가님 작품 너무 좋아요,공감돼요,4
