리뷰번호,회원ID,작성일시,리뷰내용,감정키워드,평점
13714671,19******,2024-05-07 03:01:28.20025,좋아하는 작가입니다,재밌어요,3
13683956,ju******,2024-05-03 09:12:48.017664,재밌게 잘봤어요  ,재밌어요,4
13662225,ha*********,2024-04-30 16:09:24.594325,좋아요 좋아서 샀습니당,최고예요,4
13656029,ja********,2024-04-29 17:39:36.454844,재미있게 잘 읽었습니다.,힐링돼요,4
13653941,jj********,2024-04-29 12:58:49.090129,천천히 정독할 예정입니다.,고마워요,4
13652284,by******,2024-04-29 00:49:02.079697,짧지만 강렬한 이야기,공감돼요,3
13643573,fk*****,2024-04-27 11:51:48.008984,짧은 문장 속에 많은 것을 내포하고 있어요,최고예요,4
13643350,an*******,2024-04-27 11:03:27.999745,좋아요 굿굿굿 아주아주 맘에 들어요 ,고마워요,4
13641382,wt*****,2024-04-26 23:59:12.731337,인기있는 이유가 있다고 생각되네요,재밌어요,4
13641281,zs****,2024-04-26 23:55:31.999519,추천도서라서 기대가 되네요,재밌어요,4
13640382,kt****,2024-04-26 22:26:06.35881,다시 읽어보고 싶은 책이에요,힐링돼요,4
13634796,bu********,2024-04-25 20:43:16.338006,한번 정독하고 다시 첫페이지로 돌아가 재독했어요,재밌어요,4
13630258,ga****,2024-04-24 22:57:50.984963,"말이나 행동으로 하거나 하지않는 사소한 것들을, 무얼 알았을지를 생각했다. 그것들이 한데 합해져서 하나의 삶을 이루었다. (p 120)

짧지만 많은 것을 담고 있는,,,,,,,,,,,",공감돼요,4
13623649,kl*****,2024-04-23 18:02:53.735729,운과 업은 돌고돌아 자신한테 결국 돌아온다는걸 새삼 느꼈다,공감돼요,4
13612350,qw*******,2024-04-21 14:34:05.263588,배송도 빠르고 좋아요,최고예요,4
13610319,yo*****,2024-04-20 23:33:00.190566,"유년기에 풀지 못한 숙제를 안고 성장하여 결혼을 하고 자녀를 키우며 잘 살아가고 있는 것으로 보이는 주인공. 모두가 외면하는 불편한 진실을 맞닥드렸을 때 주인공의 심리와 태도가 공감이 가서 이입이 잘 되었고 흥미롭게 이야기를 끝까지 읽을 수 있었다. 시대의 분위기와 장소, 공기까지도 묘사하는 섬세함이 돋보이던 작품. ",재밌어요,4
13603153,tk******,2024-04-20 09:51:37.757096,마지막 책장을 덮고 다시 첫장을 펴게 되는 책입니다.,최고예요,4
13602712,jj*******,2024-04-20 09:14:47.954552,좋은 책 감사합니다,최고예요,4
13588490,un******,2024-04-19 08:11:54.263631,짧지만 많은 생각을 하게하는 압축적인 문장과 내용,공감돼요,4
13587307,ro********,2024-04-19 01:39:24.047184,좋네요 잘읽었습니다,공감돼요,4
13587188,sd***,2024-04-19 01:13:48.192001,최근에 읽은 소설들중에 단언코 최고입니다,최고예요,4
13584922,vv******,2024-04-18 21:55:56.85437,좋아요 재미있어요.,재밌어요,4
13581633,tj******,2024-04-18 11:42:41.223198,이처럼   사소한 것들,고마워요,4
13574016,ur******,2024-04-16 23:39:32.611202,읽어볼만한 책입니다.,힐링돼요,3
13569149,ja*****,2024-04-16 05:09:26.762695,잔잔하게 주는 감동,힐링돼요,4
13567621,ej*****,2024-04-15 23:06:00.835454,일상에 균열이 생기는 순간,최고예요,4
13566099,jw****,2024-04-15 19:58:36.138133,올해의 책으로 골랐어요,최고예요,4
13562228,so*****,2024-04-15 12:03:57.210015,너무 좋아서 맡겨진 소녀도 읽었어요 강츄,재밌어요,4
13557331,iw********,2024-04-14 23:37:51.335253,추천 받아 구매합니다.,최고예요,4
13556890,ju*******,2024-04-14 22:50:52.222469,믿고 보는 클레어 키건,고마워요,4
13553647,ja*****,2024-04-14 12:56:32.452069,역시 명불허전이네요,최고예요,4
13530488,ag****,2024-04-10 14:22:45.706638,양심을 지키며 살아간다는 것의 중요함,최고예요,4
13530283,fu***,2024-04-10 14:09:30.313177,추천합니다 감사해요,힐링돼요,4
13523524,kt*******,2024-04-09 16:53:57.568509,"누구나 할 수 있지만 누구도 쉽게 할 수 없는 일
",공감돼요,4
13493991,ji*******,2024-04-04 16:28:42.464939,"이기적인 사람들이 가득한 세상 속 인간적인 주인공, 이런 움직임들이 세상을 바꾼다는걸 알지만 실천하기 쉽진 않네요
내가 저 상황이었어도 결단을 내릴 수 있을까하는 고민이 드는 책이었습니다.",힐링돼요,4
13493396,ka*****,2024-04-04 14:42:15.914891,정말 꼭 읽어봐야할 책이예요  깊은 감동이 있습니다,최고예요,4
13493328,ge*******,2024-04-04 14:33:02.085261,맡겨진 아이보다는 조금 덜하지만 그림같이 떠올리게하는 문장력은 정말 대단한것같아요,재밌어요,4
13487462,tj******,2024-04-03 19:33:14.369551,학사에서  추천한 책인데  읽고있지만   재미있게 읽고 있어요^^,고마워요,4
13485709,ar********,2024-04-03 15:08:28.851154,좋아하는 작가의 소설! 바로 빠져드는 흡입력 최고!!,최고예요,4
13480451,ch********,2024-04-02 22:30:50.970545,"아일랜드의 작은 도시.
석탄. 목재상 일로 생계를 꾸미는 빌 펄롱의 일상.

기계적으로 반복되는 삶에 지쳐가다 자신의 일상 속에서
'자기가 가지고 있던 사소하지만 소중한 것들' 을  찾아보지만 다른 가족들의 행복을 보며 자신은 그 속에 속하지 못했음을 깨달았다.

크리스마스의 화려하고 따뜻한 분위기의 집들을 묘사하는데...
펄롱은 여전히 하대를 받으며 석탄을 나르고 있다.
함께 어울리지 못하는 신분일까 ?


태어남부터 남달랐던 그는 삶이 여유롭지 못한채 
지금껏 살아왔다. 
작은 희망을 꿈꾸며 뭔가를 찾는 그는 끝까지 외로윘다.


수녀원의 움직임은 수상했으나 참견할 수 없었고...
수녀원과 연결된 세탁소는 연일 바쁘고 힘든 일의 연속이었다.
사소하지만 사소하지 않은 것을 지키기 위해 열심히 일하는 소녀들.


우연히 창고에 갇히며 그 곳에서 한 소녀를 만났다.
창고에서 나오며 수녀원에 소녀를 데려다주고 오는데...

책임감. 의무.
어쩌면 삶을 열정적으로 살게하는 것은 책임감때문인지 모른다.


소녀를 자신의 집으로 데려오며 생각하는 펄롱 !
옳은게 무엇인지 스스로 선택하는 '인간성 회복'

나도...
혼자 살때와 결혼하여 둘이 살 때.
그리고 아이들이 생기면서 나의 생활이 달라졌다.


자유롭고 홀가분한 삶을 좋아했는데...
진짜 행복은 아이들이 성장하는 모습 속에 있었다.

바라보기만해도 좋다.

절로 웃음이 나온다.

어느새 커서 어른이 되었다고 자신의 몫을 하는 아이들.
내 삶이 사라졌다 생각했는데..
더 풍성해진 것이었다.


홀로 살던 펄롱에게 찾아온 가족.
사소한 모든 것들이 행복으로 다가올 것이다.

작가는 두 번 읽기를 권했다.
한 번 읽어서는 보이지 않는다고...


처음 읽었을땐 눈에 들어오지 않던 암시들.
두 번째 읽으니 하나씩 보였다.

좋은 책은 두고두고 봐야하는것 같다 ^^",힐링돼요,4
13479521,bb****,2024-04-02 20:37:06.945734,재미있게 읽었습니다 ,재밌어요,4
13454126,jy*****,2024-03-30 00:36:38.941912,흥미롭게 읽었어요~~ 추천합니다,재밌어요,4
13452544,fl*****,2024-03-29 22:48:34.365205,"역시는 역시
재밌습니다.",고마워요,4
13440053,jy*******,2024-03-27 20:59:50.405411,힐링되는 책이에요~^^,힐링돼요,4
13433146,le******,2024-03-26 16:35:17.574936,맡겨진 소녀 잘 읽어서 구매해봤어요 기대됩니다,최고예요,4
13428012,bl******,2024-03-25 19:46:58.005531,이처럼 사소한 것들 추천받아 읽어요,공감돼요,4
13427804,js*****,2024-03-25 19:30:35.791575,짧아서 쉽게 읽을 수 있어요,힐링돼요,4
13426452,to*****,2024-03-25 16:29:06.690948,잔잔하지만 깊은 소설,고마워요,3
13421726,ly*******,2024-03-24 22:15:30.729143,"너무 좋은 책인 것 같습니다! 구매 추천드립니다!
후회 안하실 것에요~!!",고마워요,4
13413160,pe*******,2024-03-23 15:24:31.757786,아직 읽어보지는 않았지만 재미있을거 같아요.,최고예요,4
13411966,hs********,2024-03-23 11:44:06.613851,"클레어키건 ""이처럼 사소한 것들"" 잘 읽겠습니다^",고마워요,4
13411351,tl*******,2024-03-23 08:39:57.789914,내용을 천천히 곱씹으며 읽게 되네요,재밌어요,4
13410916,ki*******,2024-03-23 02:20:50.519059,킬리언 머피 주연 영화화된다고 하네요,고마워요,4
13406549,qk*******,2024-03-22 16:18:30.786126,이 책을 읽으며 사소한 것들의 소중함을 다시 알았네요.,힐링돼요,3
13400095,on*******,2024-03-22 00:01:38.867111,짧지만 여운이 길어요,고마워요,4
13399279,cd********,2024-03-21 23:12:45.64559,짧은 내용이지만 읽고 난 후 여운은 크네요. ,최고예요,4
13399038,m3****,2024-03-21 22:36:54.272585,몰입해서 순식간에 읽어나갔습니다,최고예요,4
13389484,le*******,2024-03-20 13:25:24.554169,재밌게 읽고 도움 많이 받았어요,공감돼요,4
13380785,pa********,2024-03-18 22:58:30.796579,"시작 파트지만 글자도 크고 얇고
잘 읽히는 문체여서 순식간에 읽을 것 같아요!",고마워요,4
13379374,le****,2024-03-18 19:26:03.046353,"
따뜻한 기분입니다. 잘 읽었습니다.",힐링돼요,4
13377875,jy*******,2024-03-18 15:21:54.760681,짧지만 강렬한 소설이에요.,힐링돼요,4
13373966,ti****,2024-03-18 09:04:15.168537,"빙산의 일각 같은 소설이다. 아직 끝나지 않은 이야기, 여전히 이야기는 계속되고 있다. ",공감돼요,4
13373536,su*******,2024-03-18 08:55:21.287963,감동적인 내용이어서 마음이 따뜻해집니다~,힐링돼요,4
13373294,bs*****,2024-03-18 08:40:17.154763,다시 꺼내 읽고 싶은 책,공감돼요,4
13372489,qk*******,2024-03-18 05:42:26.577294,제가 읽고 이해하기엔 어려웠던거 같지만 사소함의 중요함을 느꼈습니다.,힐링돼요,4
13365473,no*******,2024-03-17 11:06:43.64867,재미있게 읽도록 하겠습니다.,고마워요,4
13364165,kk*******,2024-03-17 02:10:26.472794,"짧지만 간결하면서도 현실적이며, 쓰라리듯 마음 아파오는 소설",최고예요,4
13363398,ji*****,2024-03-16 23:50:57.05838,맡겨진 소녀 보가는 이 책이 훨씬 좋았어요.,최고예요,4
13360764,to****,2024-03-16 21:27:33.04198,전작에 이어서 구입했는데 역시나 좋아요,공감돼요,4
13359588,ja****,2024-03-16 18:39:36.72227,클레어 키건의 천재적인 잠재력을 더욱 더 기대하게 해주는 아름답고 명료한 심리적인 소설.,최고예요,4
13352180,xo****,2024-03-15 17:21:16.688422,유익한 내용 좋아요 ㅎㅎ,재밌어요,4
13349327,zx********,2024-03-15 01:57:47.037451,베스트셀러라 손이 안갔는데 정말 좋아요,최고예요,4
13341000,ro*****,2024-03-13 20:50:32.644336,주인공의 생각이 나의 마음에 깊이 전달되는 느낌이 듭니다.,공감돼요,4
13340132,ha*****,2024-03-13 18:05:36.990021,마지막까지 무슨 이야기일까 궁금하다가 끝에 소름 돋았어요,공감돼요,4
13339957,sk****,2024-03-13 17:31:01.6442,"책이 읽고싶어서 충동적으로 산 책인데 재밌게 읽긴했습니다
근데 남한테 사서 읽어보라 추천하긴 애매한 느낌이에요
그냥 산김에 읽기 좋았어요",재밌어요,3
13339341,an*****,2024-03-13 15:24:51.920538,기분좋게 잘 읽었습니다,힐링돼요,4
13336883,wa******,2024-03-13 10:06:42.992132,"한 편의 시같은 소설이었다.
날카로운 포착",최고예요,4
13331917,ky****,2024-03-12 16:27:34.612022,"최고의 소설, 최고의 문장",고마워요,4
13329504,wn*****,2024-03-12 09:45:03.408903,이처럼 사소한 것들,최고예요,4
13313627,ma******,2024-03-09 22:44:16.445384,잔잔하게 읽기 좋은 책이에요. 추천합니다!,재밌어요,4
13311480,jh****,2024-03-09 17:53:42.412592,잘 읽어지는 그런 책이예요,재밌어요,4
13310598,il******,2024-03-09 15:35:51.033499,원서내용을 몰라서....번역이 너무 단조롭게 된건지..이 소설이 왜??..라는 생각만... 강추하고 싶진 않아요..추천하고 싶지도 않고..  가볍게 읽는 에세이 느낌정도..  ,공감돼요,2
13309942,ch******,2024-03-09 14:46:58.354935,두고 두고 소장하고 읽을 책입니다. 영화가 기대됩니다.,힐링돼요,4
13308539,os***,2024-03-09 12:00:47.408498,재밌어보여서 샀어요. ,재밌어요,4
13297153,pl*****,2024-03-08 07:59:29.741756,어머님께서 보신다고 구입했는데 너무 좋다고 하시네요,최고예요,4
13290952,hn*****,2024-03-07 09:38:34.438082,유명한 내용의 베스트셀러 ,최고예요,3
13279254,af*****,2024-03-05 21:22:09.747396,보고싶었던 책 최고,최고예요,4
13276379,an*****,2024-03-05 14:27:58.536832,내용이 정말 좋아요,재밌어요,4
13275365,qw***,2024-03-05 12:04:02.423009,부담없이 읽을수 있는 소설 책이라 좋아요.,공감돼요,3
13268788,ba****,2024-03-04 18:30:12.371796,무난한 거 같아요요요,최고예요,4
13268044,he********,2024-03-04 17:29:06.370888,전작을 너무 잘 읽어서 재구매했어요,최고예요,4
13261936,7q***,2024-03-04 07:50:51.489132,클레어키건의 글들은 정물화를 보는듯하다,재밌어요,4
13261526,cr******,2024-03-04 06:02:33.987716,소소한 일상. 참 좋습니다.,힐링돼요,4
13251445,st******,2024-03-02 22:55:30.845699,왜 다들 추천하는지 알겠어요,최고예요,4
13249142,kx****,2024-03-02 17:05:26.850602,클레어 키건은 언제나 탁월하네요.,최고예요,4
13238887,sk*****************,2024-03-01 02:59:56.432575,짧아서 순식간에 읽었네요. 여운이 많이 남아 나중에 꼭 다시 읽으려고요.,힐링돼요,4
13236858,jo*******,2024-02-29 21:35:30.35928,매년 크리스마스가 되면 생각날것 같습니다,공감돼요,4
13235550,tj********,2024-02-29 18:44:11.16,나에겐 와 닿지않는~~~,고마워요,3
13232960,mi****,2024-02-29 10:06:33.31883,"분량이 작은것보단,책내용과맞게 딱좋은분량이라
구매후돌아와한시간에다읽었네여
명성그대로,흡입력있어여 ㅋ
",재밌어요,3
13228758,gr********,2024-02-28 18:41:39.849644,기대되는 책인 것 같습니다.,고마워요,4
13225074,hy*******,2024-02-28 00:16:38.290967,좋습니다 정말로 감사합니다,최고예요,4
13224456,oa*****,2024-02-27 23:05:02.566587,배송도 빠르고 좋아요,힐링돼요,4
13224166,cr*******************,2024-02-27 22:29:33.475834,얇은책에서 많은 이야기가 있는듯..,재밌어요,4
13222378,rl**********,2024-02-27 17:56:34.832095,잔잔하게 힐링되는책 좋았습니다~!,힐링돼요,3
13221233,li*******,2024-02-27 14:42:56.502463,오늘 바로드림으로 받아서 읽고 있어요,힐링돼요,4
13215932,tk*******,2024-02-26 16:43:12.662273,짧은 소설이지만 임팩트가 있습니다. ,재밌어요,4
13214771,gu***,2024-02-26 15:00:16.13517,좋아요 유익하네요 ,최고예요,4
13214351,nu****,2024-02-26 14:17:23.894175,짧지만 여운도 깊고 강렬한 인상을 남겼다.,최고예요,4
13214269,sh********,2024-02-26 14:06:46.184788,책이 생각보다 얇으네요  재미있게.읽었습니다,공감돼요,3
13210867,ji****,2024-02-26 08:09:12.595042,중편이라하기도 짧지만 은근하고 강하게 책을 다시 한번더 펼치게한다,최고예요,4
13210094,op*****,2024-02-26 05:24:59.338416,재미있게 잘 읽었습니다.,재밌어요,4
13200736,le*******,2024-02-24 22:16:03.733155,재미있게 봤습니다 ,재밌어요,4
13199311,gr********,2024-02-24 18:55:03.28686,추천 많이 받아 읽어봐요,힐링돼요,4
13197548,yo*******,2024-02-24 13:02:57.529121,먹먹해지는 이야기에요. ,최고예요,4
13196424,ji********,2024-02-24 08:15:18.130847,맡겨진소녀가 더 좋았다,힐링돼요,4
13194546,no****,2024-02-23 22:19:09.456573,기대됩니다 기대됩니다 ,최고예요,4
13190096,sm****,2024-02-23 01:20:21.057379,"상당히 얇은 책
기승전결 기다리다 기에서 바로 결로 넘어감
광고의 힘",고마워요,3
13189905,oh*****,2024-02-23 00:20:56.587917,이토록 짧고 묵직한 여운,최고예요,4
13187638,tj********,2024-02-22 18:31:42.592017,첫 장읽고 지루해서 덮었네요,고마워요,1
13187257,ps******,2024-02-22 17:59:49.788971,짧지만 오래 여운이 남네요,재밌어요,4
13184451,er***,2024-02-22 12:25:46.732568,펄롱의 마음과 행동은 많은 스케치의 결과,공감돼요,4
13170487,cp*****,2024-02-20 20:43:26.30369,짧지만 많은 여운을 주는 책,힐링돼요,4
13169256,hy********,2024-02-20 16:57:17.944049,고발이나 다큐형식이 아니어서 더욱 오래 기억에 남을 것 같습니다.,최고예요,4
13158395,cj******,2024-02-18 23:19:06.498622,재밌게 잘 봤습니다 ,최고예요,4
13157635,gP******,2024-02-18 22:21:09.755999,짧은 소설이지만 여운이 기네요,공감돼요,4
13156417,un****,2024-02-18 20:03:17.844282,궁금해서 저 읽으려 사면서 선물도 했는데 좋아하네요^^,고마워요,4
13152708,tt****,2024-02-17 23:52:56.646916,짧지만 부족함이 없다. 무거운 주제를 명료하게 담아냈다.,최고예요,4
13151700,yu****,2024-02-17 21:53:19.038664,좋은 책이네요 추천합니다,힐링돼요,4
13149116,eh*******,2024-02-17 13:44:12.773116,점점 몰입해가는 저를 보게 됐습니나,최고예요,4
13148434,cy*****,2024-02-17 11:09:51.184211,궁금하고 기대됩니다 ,고마워요,4
13138982,dl*******,2024-02-15 21:43:26.389059,하…안 읽어본 사람 없게해주세요,최고예요,4
13137589,ma********,2024-02-15 18:11:48.906047,너무 기대했던 책이었는데 재미있게 잘 읽고 있어요,최고예요,4
13137442,yo*****************,2024-02-15 17:51:21.498054,그냥 봤는데 볼 만 했어요,고마워요,4
13137020,se****,2024-02-15 16:30:04.351806,쉽게 읽히고 그렇지만 내용은 가볍지 않고 여운이 많이 남네요. 읽자마자 바로 다시 처음 부터 읽기는 처음이예요. 이소설로 작가님 다른책도 궁금해서 읽었습니다 추천 드립니다 ~~ 말로 표현하기 힘든 감동과 생각을 주는 책입니다 ,최고예요,4
13136675,ah*****,2024-02-15 15:30:10.892865,좋아요 역시 이유가 있네요,재밌어요,4
13135338,ba******,2024-02-15 11:24:24.81871,진실을 외면하지 않고 마주함에 용기를 내는 펄벅~,최고예요,4
13130796,hj*****,2024-02-14 18:41:33.171284,짧은 이야기 긴 여운,최고예요,4
13128545,ls********,2024-02-14 13:26:27.810451,잘 읽었습니다 추천할해요 ! ,힐링돼요,4
13127857,me******,2024-02-14 11:09:15.082882,맞아요 이처럼 사소한것들을 놓치고 사는 우리죠.,힐링돼요,4
13126028,er***,2024-02-14 01:14:21.73066,많은 사소한 것이 한 순간을 지나며,공감돼요,4
13125642,sn********,2024-02-13 23:53:41.564796,책 제목이 끌려 구입한 책이예요. 기대되네요.,최고예요,4
13123172,dl*******,2024-02-13 19:45:11.371198,클레어 키건의 새로운 세계에 매료되었어요,최고예요,4
13121757,kr****,2024-02-13 16:37:21.403611,"잔잔하게 그러나 참아가며 하나씩 풀어나가는 이야기 속에서 서글픔이 배어나고, 작은 일이 아니고 사실은 엄청난 일이 벌어진 것 같습니다. 펄롱의 마음이 이해가 되면서 그의 용기에 감동했습니다
짧지만 큰 여운이 남는 책입니다",공감돼요,4
13119394,ai*****,2024-02-13 12:09:54.491109,펄롱을 응원합니다. ,최고예요,4
13118258,lu******,2024-02-13 09:50:27.323221,너무 사소하지만 우리가 모른 척하고 지느가는 것들에 관한 이야기,고마워요,4
13118226,ki*****,2024-02-13 09:45:59.375978,최고에요 좋아요!!!,최고예요,4
13112893,eh*******,2024-02-12 17:26:23.716511,책 한 권 더 사서 보관해놓고 싶은 책입니다,힐링돼요,4
13111700,cy*******,2024-02-12 14:11:12.774021,"베스트셀러라서 믿고 구매했는데, 저는 너무 지루해서 얇은 책이 진도가 안나가네요.",힐링돼요,2
13111659,cy*******,2024-02-12 14:07:48.732111,음...베스트셀러라 믿고 구입했는데...책을 잘 살펴보고 구입했어요. 전 지루함이 느껴져서 책은 얇은데 진도는 잘 안나가네요.,힐링돼요,2
13111435,kw*****,2024-02-12 13:26:14.971803,재미있게 잘 읽었습니다.,최고예요,4
13108580,wj********,2024-02-11 21:29:32.278967,잔잔하고 천천히 읽을 수 있는 책,공감돼요,4
13107446,fe*****,2024-02-11 17:53:03.840884,여운이 길게 남네요 문장들이 좋아서 보는 동안 배경 상상이 잘 됐습니다,최고예요,4
13104204,ho******,2024-02-10 23:29:41.759886,재미있게 잘읽었어요,재밌어요,4
13099698,su********,2024-02-09 23:43:50.424145,좋은책입니다 감사합니다,최고예요,4
13098194,ek*******,2024-02-09 18:40:50.771512,따뜻한 이야기 입니다,최고예요,4
13096868,vi*****,2024-02-09 11:06:45.043269,따뜻하게 힐링되네요.,최고예요,4
13091669,si*****,2024-02-08 12:37:45.576041,작가님의 두번째 책. 재밌어요,공감돼요,4
13090772,sh****,2024-02-08 10:42:06.919707,"원문을 대조해 보며 읽고 있습니다. 구두점이 없이 길게 이어지는 영어 문장이 흥미로워서 함께 보고 있는데, 우리말 번역이 아주 좋습니다.",최고예요,4
13090620,re*****,2024-02-08 10:19:43.870891,"정말 걸림이나 군더더기 없는 표현으로
마음의 울림이 큰 책이다.",공감돼요,4
13090201,st********,2024-02-08 09:18:22.398268,너무 재밌는 책이예요:),힐링돼요,4
13087053,ur******,2024-02-07 22:54:22.161626,잘 읽 었 습 니 다,힐링돼요,4
13087048,ur******,2024-02-07 22:54:03.861393,기대만큼은 아니었지만 잘 읽었습니다,힐링돼요,4
13087046,ur******,2024-02-07 22:53:48.070038,기대만큼은 아니었지만 잘읽었습니다.,힐링돼요,4
13087042,ur******,2024-02-07 22:53:18.487934,잘읽었습니다                     ,힐링돼요,4
13087039,ur******,2024-02-07 22:53:00.90419,잘 읽었어요...........,힐링돼요,4
13079642,hj*****,2024-02-06 18:13:02.949279,예쁜책..      ,힐링돼요,4
13078060,oh*****,2024-02-06 12:54:57.524687,이처럼 사소한 것들,공감돼요,4
13077288,ib******,2024-02-06 08:59:27.811606,"책의 표지가 너무나 맘에 들었다. 양장으로 두껍지 않아서 순식간에 읽었다. 하지만 내용은 강렬했다.
제목이 왜 이처럼 사소한 것들인지 마지막이 되어서 저자는 표현하였다.
인간은 어떻게 살아가야 하는지. 인간으로서 지켜야 할 최소한의 사소한 것들..그런 것들이 모여 한 인간의 삶이 되고, 그 삶들이 모여서 이 사회가 이루어진다.
저자가 나타내고자 한 의미가 이것이 맞는지 모르겠지만, 난 그렇게 느껴졌다.
옳지 않음을 보고 피하지 않는 최소한의 도덕성.. 사실 나도 자신은 없다.
그것이 최소한이라고 하지만, 그것이 가능할지..

두 사람은 계속 걸었고 펄롱이 알거나 모르는 사람들을 더 마주쳤다. 문득 서로 돕지 않는다면 삶에 무슨 의미가 있나 하는 생각이 들었다. 그 나날을, 수십 년을, 평생을 단 한번도 세상에 맞설 용기를 내보지 않고도 스스로를 기독교인이라고 부르고 거울 앞에서 자기 모습을 마주할 수 있나?

아이를 데리고 걸으면서 펄롱은 얼마나 몸이 가볍고 당당한 느낌이던지, 가슴속에 새롭고 새삼스럽고 뭔지 모를 기쁨이 솟았다. 펄롱의 가장 좋은 부분이 빛을 내며 밖으로 나오고 있는 것일 수도 있을까? 펄롱은 자신의 어떤 부분이, 그걸 뭐라고 부르든 - 거기 무슨 이름이 있나? - 밖으로 마구 나오고 있다는 것을 알았다. 대가를 치르게 될 테지만, 그래도 변변찮은 삶에서 펄롱은 지금까지 단 한 번도 이와 견줄 만한 행복을 느껴본 적이 없었다. 갓난 딸들을 처음 품에 안고 우렁차고 고집스러운 울음을 들었을 때 조차도.

펄롱은 미시즈 윌슨을, 그분이 날마다 보여준 친절을, 어떻게 펄롱을 가르치고 격려했는지를, 말이나 행동으로 하거나 하지 않은 사소한 것들을, 무얼 알았을지를 생각했다. 그것들이 한데 합해져서 하나의 삶을 이루었다.",최고예요,4
13073901,ke********,2024-02-05 17:15:43.436443,제목만큼 이처럼 사소한..,고마워요,4
13071259,tj******,2024-02-05 09:40:00.383762,슬프지만 여운이 남는 책이에요,재밌어요,4
13071235,db*******,2024-02-05 09:34:30.221355,생각 정리가 잘 되는 책입니다. 강추,힐링돼요,4
